{
  "simulation_id": "sim_leadership_20250417_135051",
  "config": {
    "use_team_leadership": true,
    "use_closed_loop_comm": false,
    "use_mutual_monitoring": false,
    "use_shared_mental_model": false
  },
  "exchanges": [
    {
      "type": "sequential_refinement",
      "exchanges": [
        {
          "type": "initial_ranking",
          "role": "science",
          "message": "When ranking the lunar survival items, it is essential to account for the unique conditions of the lunar surface. Factors influencing survival include the lack of atmosphere, extreme temperatures, reduced gravity, absence of liquid water, and exposure to solar radiation. The primary goals are to ensure oxygen supply, water intake, navigation, communication, adequate protection, and safe passage over the 200-mile trek.\n\nHere is the ranking of the items along with justifications:\n\n---\n\n### **Ranking of Lunar Survival Items**\n\n1. **Oxygen Tanks**\n   - **Justification:** The moon lacks an atmosphere, making oxygen critical for survival. Without sufficient oxygen, no other items matter. It is the top priority until the rendezvous.\n\n2. **Water**\n   - **Justification:** Hydration is vital for maintaining bodily functions, especially in the lunar environment where there are no sources of liquid water. Water ranks as the second most critical need after oxygen.\n\n3. **Stellar Map**\n   - **Justification:** Navigating a 200-mile journey on the moon's surface requires precise orientation. A stellar map is indispensable for determining direction, as there are no landmarks or magnetic fields like on Earth.\n\n4. **Solar-powered FM Receiver-Transmitter**\n   - **Justification:** Communication with the mother ship or crew might be necessary for assistance and coordination. The solar-powered feature ensures functionality despite lunar conditions.\n\n5. **Food Concentrate**\n   - **Justification:** High-calorie, lightweight food is necessary to maintain energy levels for the trek. While less critical short-term than oxygen and water, food becomes increasingly important over time.\n\n6. **Parachute Silk**\n   - **Justification:** Parachute silk can provide shade from intense solar radiation, serve as a makeshift carrier for items, or reduce heat absorption, addressing thermal challenges on the lunar surface.\n\n7. **First Aid Kit**\n   - **Justification:** Injuries or health issues during the trek could be incapacitating. A first aid kit ensures basic medical care and could help treat abrasions, radiation burns, or other physical ailments.\n\n8. **Nylon Rope (50 feet)**\n   - **Justification:** Rope is versatile and could be used for climbing over obstacles, securing gear, or creating tools/shelters. It provides solutions for terrain navigation.\n\n9. **Signal Flares**\n   - **Justification:** Useful for signaling the mother ship\u2019s location or crew members during the journey. They may also serve as a visual aid in case of search and rescue.\n\n10. **Life Raft**\n    - **Justification:** While seemingly less useful in a non-aquatic environment, the raft could help transport items or serve as a protective barrier against lunar soil and debris.\n\n11. **Two .45 Caliber Pistols**\n    - **Justification:** Tools for launching flares or breaking things apart (e.g., opening sealed containers). Defense from threats is unnecessary on the moon.\n\n12. **Portable Heating Unit**\n    - **Justification:** Though lunar temperatures vary significantly, heat management can primarily be achieved through physical layering (e.g., parachute silk or spacesuit insulation). This item is less critical given spacesuit technology.\n\n13. **Magnetic Compass**\n    - **Justification:** The compass is non-functional on the lunar surface since the moon lacks a global magnetic field. It has no navigational use.\n\n14. **One Case of Dehydrated Milk**\n    - **Justification:** Provides additional food but is inferior to food concentrate in terms of portability, calorie density, and ease of consumption. It is a redundant item.\n\n15. **Box of Matches**\n    - **Justification:** Matches are entirely useless in the lunar environment due to the absence of oxygen necessary for combustion. They serve no purpose for survival or navigation.\n\n---\n\n### **Key Considerations**\n- **Life-sustaining essentials:** Oxygen and water top the list due to their immediate necessity.\n- **Navigation:** The stellar map ranks high because accurate direction is essential for reaching the rendezvous safely.\n- **Protection and communication:** Parachute silk, FM receiver-transmitter, and the first aid kit address environmental hazards and communication needs.\n- **Least useful items:** The magnetic compass and matches are effectively non-functional in the lunar environment, making them the least important for survival.\n\nThis ranking optimizes resources to address survival priorities under challenging lunar conditions while ensuring mobility and the potential for assistance from the mother ship.",
          "ranking": [
            "Oxygen tanks",
            "Water",
            "Stellar map",
            "Solar-powered FM receiver-transmitter",
            "Food concentrate",
            "Parachute silk",
            "First aid kit",
            "Signal flares",
            "Life raft",
            "Two .45 caliber pistols",
            "Portable heating unit",
            "Magnetic compass",
            "One case of dehydrated milk",
            "Box of matches",
            "50 feet of nylon rope"
          ]
        },
        {
          "type": "refinement",
          "iteration": 1,
          "role": "resource",
          "message": "### **Refined Ranking of Lunar Survival Items**\n\nAfter reviewing the initial ranking, I suggest refinements based on factors such as resource efficiency, survivability priorities, and utility in the environment provided by the lunar surface. Here is the updated ranking:\n\n---\n\n### **Refined Lunar Survival Items Ranking**\n\n**1. Oxygen Tanks**  \n   - **Justification:** Survival on the moon is impossible without a reliable oxygen supply. Oxygen remains the most critical resource, as the moon has no breathable atmosphere. Current ranking is appropriate.\n\n**2. Water**  \n   - **Justification:** The human body requires hydration to function optimally, particularly in the harsh lunar environment. Water is second only to oxygen in importance for survival. Current ranking is appropriate.\n\n**3. Stellar Map**  \n   - **Justification:** Navigation is essential for the trek across a featureless lunar surface to reach the rendezvous point. A stellar map is indispensable for determining direction in the absence of landmarks or magnetic fields. Current ranking is appropriate.\n\n**4. Solar-powered FM Receiver-Transmitter**  \n   - **Justification:** Communication is key for safety and coordination with the mother ship or other crew members. Its solar-powered functionality ensures long-term use under lunar conditions. Ranking remains unchanged.\n\n**5. Food Concentrate**  \n   - **Justification:** High-calorie, lightweight food provides sustained energy for the 200-mile trek. It is less immediately critical than oxygen, water, and navigation tools but vital for long-term physical endurance. Current ranking is appropriate.\n\n**6. First Aid Kit**  \n   - **Change in Ranking:** Moved up from rank 7 to 6.  \n     - **Reasoning:** The likelihood of injuries during the trek (from falls, abrasions, dehydration effects, or radiation burns) makes basic medical supplies crucial for survival. It should rank higher than the parachute silk, which is useful but less urgent in addressing life-threatening issues.\n\n**7. Parachute Silk**  \n   - **Change in Ranking:** Moved down to rank 7.  \n     - **Reasoning:** While useful for shade against solar radiation and item transport, parachute silk is less critical than the first aid kit for immediate survival needs. Its utility is primarily supplementary.\n\n**8. Signal Flares**  \n   - **Change in Ranking:** Moved up from rank 9 to 8.  \n     - **Reasoning:** Signal flares are crucial for visual signaling to the mother ship, particularly near the endpoint of the journey. They may also serve as a coordination tool if rescue becomes necessary. Their signaling utility makes them indispensable after navigation tools.\n\n**9. Nylon Rope (50 feet)**  \n   - **Change in Ranking:** Moved down to rank 9.  \n     - **Reasoning:** Rope provides situational utility for climbing obstacles, carrying items, or creating makeshift tools, but its necessity is conditional. It ranks slightly lower than signaling equipment.\n\n**10. Life Raft**  \n   - **Justification:** The life raft could serve as a sled for carrying supplies or a protective layer against lunar soil and debris. While useful, it is situational and not as critical as other items above. Current ranking remains appropriate.\n\n**11. Two .45 Caliber Pistols**  \n   - **Justification:** The pistols are minimally useful on the moon, serving as tools for launching flares or breaking objects. There are no direct survival threats requiring pistols, but their utility for problem-solving justifies this position. Current ranking is appropriate.\n\n**12. Portable Heating Unit**  \n   - **Change in Ranking:** Moved up from rank 13 to 12.  \n     - **Reasoning:** While the spacesuit offers some protection against extreme temperatures, the lunar environment can subject the crew to significant cold during the long trek in shadowed regions. A portable heating unit provides added protection, making it slightly more valuable than redundant items such as the magnetic compass or dehydrated milk.\n\n**13. One Case of Dehydrated Milk**  \n   - **Justification:** Dehydrated milk is nutritionally inferior to the food concentrate and less convenient for consumption during the trek. Its added water requirement makes it inefficient under survival conditions. Current ranking remains appropriate.\n\n**14. Magnetic Compass**  \n   - **Justification:** Non-functional due to the absence of a global magnetic field on the moon. It has no direct survival utility. Current ranking remains appropriate.\n\n**15. Box of Matches**  \n   - **Justification:** Matches are entirely useless on the moon due to the lack of oxygen required for combustion. They provide no survival value. Current ranking remains appropriate.\n\n---\n\n### **Refined Ranking Summary**\n1. Oxygen Tanks  \n2. Water  \n3. Stellar Map  \n4. Solar-powered FM Receiver-Transmitter  \n5. Food Concentrate  \n6. First Aid Kit  \n7. Parachute Silk  \n8. Signal Flares  \n9. Nylon Rope (50 feet)  \n10. Life Raft  \n11. Two .45 Caliber Pistols  \n12. Portable Heating Unit  \n13. One Case of Dehydrated Milk  \n14. Magnetic Compass  \n15. Box of Matches  \n\n---\n\n### **Evaluation of Changes**\n\n- **First Aid Kit (Rank 6):** Prioritized over parachute silk due to its ability to directly address health emergencies.  \n- **Signal Flares (Rank 8):** Elevated for its survival-critical function to ensure visibility and communication near the endpoint.  \n- **Portable Heating Unit (Rank 12):** Raised slightly due to its potential value for cold protection during extended shadow travel.  \n\nThe revised ranking optimizes survival utility for the trek while reflecting the priorities of oxygen, hydration, navigation, and protection under lunar environmental constraints.",
          "ranking": [
            "Oxygen tanks",
            "Water",
            "Stellar map",
            "Solar-powered FM receiver-transmitter",
            "Food concentrate",
            "First aid kit",
            "Parachute silk",
            "Signal flares",
            "Life raft",
            "Two .45 caliber pistols",
            "Portable heating unit",
            "One case of dehydrated milk",
            "Magnetic compass",
            "Box of matches",
            "50 feet of nylon rope"
          ]
        }
      ],
      "iterations": [
        {
          "iteration": 0,
          "current_ranking": [
            "Oxygen tanks",
            "Water",
            "Stellar map",
            "Solar-powered FM receiver-transmitter",
            "Food concentrate",
            "Parachute silk",
            "First aid kit",
            "Signal flares",
            "Life raft",
            "Two .45 caliber pistols",
            "Portable heating unit",
            "Magnetic compass",
            "One case of dehydrated milk",
            "Box of matches",
            "50 feet of nylon rope"
          ],
          "current_message": "When ranking the lunar survival items, it is essential to account for the unique conditions of the lunar surface. Factors influencing survival include the lack of atmosphere, extreme temperatures, reduced gravity, absence of liquid water, and exposure to solar radiation. The primary goals are to ensure oxygen supply, water intake, navigation, communication, adequate protection, and safe passage over the 200-mile trek.\n\nHere is the ranking of the items along with justifications:\n\n---\n\n### **Ranking of Lunar Survival Items**\n\n1. **Oxygen Tanks**\n   - **Justification:** The moon lacks an atmosphere, making oxygen critical for survival. Without sufficient oxygen, no other items matter. It is the top priority until the rendezvous.\n\n2. **Water**\n   - **Justification:** Hydration is vital for maintaining bodily functions, especially in the lunar environment where there are no sources of liquid water. Water ranks as the second most critical need after oxygen.\n\n3. **Stellar Map**\n   - **Justification:** Navigating a 200-mile journey on the moon's surface requires precise orientation. A stellar map is indispensable for determining direction, as there are no landmarks or magnetic fields like on Earth.\n\n4. **Solar-powered FM Receiver-Transmitter**\n   - **Justification:** Communication with the mother ship or crew might be necessary for assistance and coordination. The solar-powered feature ensures functionality despite lunar conditions.\n\n5. **Food Concentrate**\n   - **Justification:** High-calorie, lightweight food is necessary to maintain energy levels for the trek. While less critical short-term than oxygen and water, food becomes increasingly important over time.\n\n6. **Parachute Silk**\n   - **Justification:** Parachute silk can provide shade from intense solar radiation, serve as a makeshift carrier for items, or reduce heat absorption, addressing thermal challenges on the lunar surface.\n\n7. **First Aid Kit**\n   - **Justification:** Injuries or health issues during the trek could be incapacitating. A first aid kit ensures basic medical care and could help treat abrasions, radiation burns, or other physical ailments.\n\n8. **Nylon Rope (50 feet)**\n   - **Justification:** Rope is versatile and could be used for climbing over obstacles, securing gear, or creating tools/shelters. It provides solutions for terrain navigation.\n\n9. **Signal Flares**\n   - **Justification:** Useful for signaling the mother ship\u2019s location or crew members during the journey. They may also serve as a visual aid in case of search and rescue.\n\n10. **Life Raft**\n    - **Justification:** While seemingly less useful in a non-aquatic environment, the raft could help transport items or serve as a protective barrier against lunar soil and debris.\n\n11. **Two .45 Caliber Pistols**\n    - **Justification:** Tools for launching flares or breaking things apart (e.g., opening sealed containers). Defense from threats is unnecessary on the moon.\n\n12. **Portable Heating Unit**\n    - **Justification:** Though lunar temperatures vary significantly, heat management can primarily be achieved through physical layering (e.g., parachute silk or spacesuit insulation). This item is less critical given spacesuit technology.\n\n13. **Magnetic Compass**\n    - **Justification:** The compass is non-functional on the lunar surface since the moon lacks a global magnetic field. It has no navigational use.\n\n14. **One Case of Dehydrated Milk**\n    - **Justification:** Provides additional food but is inferior to food concentrate in terms of portability, calorie density, and ease of consumption. It is a redundant item.\n\n15. **Box of Matches**\n    - **Justification:** Matches are entirely useless in the lunar environment due to the absence of oxygen necessary for combustion. They serve no purpose for survival or navigation.\n\n---\n\n### **Key Considerations**\n- **Life-sustaining essentials:** Oxygen and water top the list due to their immediate necessity.\n- **Navigation:** The stellar map ranks high because accurate direction is essential for reaching the rendezvous safely.\n- **Protection and communication:** Parachute silk, FM receiver-transmitter, and the first aid kit address environmental hazards and communication needs.\n- **Least useful items:** The magnetic compass and matches are effectively non-functional in the lunar environment, making them the least important for survival.\n\nThis ranking optimizes resources to address survival priorities under challenging lunar conditions while ensuring mobility and the potential for assistance from the mother ship.",
          "current_agent": "science"
        },
        {
          "iteration": 1,
          "current_ranking": [
            "Oxygen tanks",
            "Water",
            "Stellar map",
            "Solar-powered FM receiver-transmitter",
            "Food concentrate",
            "First aid kit",
            "Parachute silk",
            "Signal flares",
            "Life raft",
            "Two .45 caliber pistols",
            "Portable heating unit",
            "One case of dehydrated milk",
            "Magnetic compass",
            "Box of matches",
            "50 feet of nylon rope"
          ],
          "current_message": "### **Refined Ranking of Lunar Survival Items**\n\nAfter reviewing the initial ranking, I suggest refinements based on factors such as resource efficiency, survivability priorities, and utility in the environment provided by the lunar surface. Here is the updated ranking:\n\n---\n\n### **Refined Lunar Survival Items Ranking**\n\n**1. Oxygen Tanks**  \n   - **Justification:** Survival on the moon is impossible without a reliable oxygen supply. Oxygen remains the most critical resource, as the moon has no breathable atmosphere. Current ranking is appropriate.\n\n**2. Water**  \n   - **Justification:** The human body requires hydration to function optimally, particularly in the harsh lunar environment. Water is second only to oxygen in importance for survival. Current ranking is appropriate.\n\n**3. Stellar Map**  \n   - **Justification:** Navigation is essential for the trek across a featureless lunar surface to reach the rendezvous point. A stellar map is indispensable for determining direction in the absence of landmarks or magnetic fields. Current ranking is appropriate.\n\n**4. Solar-powered FM Receiver-Transmitter**  \n   - **Justification:** Communication is key for safety and coordination with the mother ship or other crew members. Its solar-powered functionality ensures long-term use under lunar conditions. Ranking remains unchanged.\n\n**5. Food Concentrate**  \n   - **Justification:** High-calorie, lightweight food provides sustained energy for the 200-mile trek. It is less immediately critical than oxygen, water, and navigation tools but vital for long-term physical endurance. Current ranking is appropriate.\n\n**6. First Aid Kit**  \n   - **Change in Ranking:** Moved up from rank 7 to 6.  \n     - **Reasoning:** The likelihood of injuries during the trek (from falls, abrasions, dehydration effects, or radiation burns) makes basic medical supplies crucial for survival. It should rank higher than the parachute silk, which is useful but less urgent in addressing life-threatening issues.\n\n**7. Parachute Silk**  \n   - **Change in Ranking:** Moved down to rank 7.  \n     - **Reasoning:** While useful for shade against solar radiation and item transport, parachute silk is less critical than the first aid kit for immediate survival needs. Its utility is primarily supplementary.\n\n**8. Signal Flares**  \n   - **Change in Ranking:** Moved up from rank 9 to 8.  \n     - **Reasoning:** Signal flares are crucial for visual signaling to the mother ship, particularly near the endpoint of the journey. They may also serve as a coordination tool if rescue becomes necessary. Their signaling utility makes them indispensable after navigation tools.\n\n**9. Nylon Rope (50 feet)**  \n   - **Change in Ranking:** Moved down to rank 9.  \n     - **Reasoning:** Rope provides situational utility for climbing obstacles, carrying items, or creating makeshift tools, but its necessity is conditional. It ranks slightly lower than signaling equipment.\n\n**10. Life Raft**  \n   - **Justification:** The life raft could serve as a sled for carrying supplies or a protective layer against lunar soil and debris. While useful, it is situational and not as critical as other items above. Current ranking remains appropriate.\n\n**11. Two .45 Caliber Pistols**  \n   - **Justification:** The pistols are minimally useful on the moon, serving as tools for launching flares or breaking objects. There are no direct survival threats requiring pistols, but their utility for problem-solving justifies this position. Current ranking is appropriate.\n\n**12. Portable Heating Unit**  \n   - **Change in Ranking:** Moved up from rank 13 to 12.  \n     - **Reasoning:** While the spacesuit offers some protection against extreme temperatures, the lunar environment can subject the crew to significant cold during the long trek in shadowed regions. A portable heating unit provides added protection, making it slightly more valuable than redundant items such as the magnetic compass or dehydrated milk.\n\n**13. One Case of Dehydrated Milk**  \n   - **Justification:** Dehydrated milk is nutritionally inferior to the food concentrate and less convenient for consumption during the trek. Its added water requirement makes it inefficient under survival conditions. Current ranking remains appropriate.\n\n**14. Magnetic Compass**  \n   - **Justification:** Non-functional due to the absence of a global magnetic field on the moon. It has no direct survival utility. Current ranking remains appropriate.\n\n**15. Box of Matches**  \n   - **Justification:** Matches are entirely useless on the moon due to the lack of oxygen required for combustion. They provide no survival value. Current ranking remains appropriate.\n\n---\n\n### **Refined Ranking Summary**\n1. Oxygen Tanks  \n2. Water  \n3. Stellar Map  \n4. Solar-powered FM Receiver-Transmitter  \n5. Food Concentrate  \n6. First Aid Kit  \n7. Parachute Silk  \n8. Signal Flares  \n9. Nylon Rope (50 feet)  \n10. Life Raft  \n11. Two .45 Caliber Pistols  \n12. Portable Heating Unit  \n13. One Case of Dehydrated Milk  \n14. Magnetic Compass  \n15. Box of Matches  \n\n---\n\n### **Evaluation of Changes**\n\n- **First Aid Kit (Rank 6):** Prioritized over parachute silk due to its ability to directly address health emergencies.  \n- **Signal Flares (Rank 8):** Elevated for its survival-critical function to ensure visibility and communication near the endpoint.  \n- **Portable Heating Unit (Rank 12):** Raised slightly due to its potential value for cold protection during extended shadow travel.  \n\nThe revised ranking optimizes survival utility for the trek while reflecting the priorities of oxygen, hydration, navigation, and protection under lunar environmental constraints.",
          "current_agent": "resource",
          "difference_score": 4
        }
      ],
      "final_ranking": [
        "Oxygen tanks",
        "Water",
        "Stellar map",
        "Solar-powered FM receiver-transmitter",
        "Food concentrate",
        "First aid kit",
        "Parachute silk",
        "Signal flares",
        "Life raft",
        "Two .45 caliber pistols",
        "Portable heating unit",
        "One case of dehydrated milk",
        "Magnetic compass",
        "Box of matches",
        "50 feet of nylon rope"
      ],
      "final_message": "### **Refined Ranking of Lunar Survival Items**\n\nAfter reviewing the initial ranking, I suggest refinements based on factors such as resource efficiency, survivability priorities, and utility in the environment provided by the lunar surface. Here is the updated ranking:\n\n---\n\n### **Refined Lunar Survival Items Ranking**\n\n**1. Oxygen Tanks**  \n   - **Justification:** Survival on the moon is impossible without a reliable oxygen supply. Oxygen remains the most critical resource, as the moon has no breathable atmosphere. Current ranking is appropriate.\n\n**2. Water**  \n   - **Justification:** The human body requires hydration to function optimally, particularly in the harsh lunar environment. Water is second only to oxygen in importance for survival. Current ranking is appropriate.\n\n**3. Stellar Map**  \n   - **Justification:** Navigation is essential for the trek across a featureless lunar surface to reach the rendezvous point. A stellar map is indispensable for determining direction in the absence of landmarks or magnetic fields. Current ranking is appropriate.\n\n**4. Solar-powered FM Receiver-Transmitter**  \n   - **Justification:** Communication is key for safety and coordination with the mother ship or other crew members. Its solar-powered functionality ensures long-term use under lunar conditions. Ranking remains unchanged.\n\n**5. Food Concentrate**  \n   - **Justification:** High-calorie, lightweight food provides sustained energy for the 200-mile trek. It is less immediately critical than oxygen, water, and navigation tools but vital for long-term physical endurance. Current ranking is appropriate.\n\n**6. First Aid Kit**  \n   - **Change in Ranking:** Moved up from rank 7 to 6.  \n     - **Reasoning:** The likelihood of injuries during the trek (from falls, abrasions, dehydration effects, or radiation burns) makes basic medical supplies crucial for survival. It should rank higher than the parachute silk, which is useful but less urgent in addressing life-threatening issues.\n\n**7. Parachute Silk**  \n   - **Change in Ranking:** Moved down to rank 7.  \n     - **Reasoning:** While useful for shade against solar radiation and item transport, parachute silk is less critical than the first aid kit for immediate survival needs. Its utility is primarily supplementary.\n\n**8. Signal Flares**  \n   - **Change in Ranking:** Moved up from rank 9 to 8.  \n     - **Reasoning:** Signal flares are crucial for visual signaling to the mother ship, particularly near the endpoint of the journey. They may also serve as a coordination tool if rescue becomes necessary. Their signaling utility makes them indispensable after navigation tools.\n\n**9. Nylon Rope (50 feet)**  \n   - **Change in Ranking:** Moved down to rank 9.  \n     - **Reasoning:** Rope provides situational utility for climbing obstacles, carrying items, or creating makeshift tools, but its necessity is conditional. It ranks slightly lower than signaling equipment.\n\n**10. Life Raft**  \n   - **Justification:** The life raft could serve as a sled for carrying supplies or a protective layer against lunar soil and debris. While useful, it is situational and not as critical as other items above. Current ranking remains appropriate.\n\n**11. Two .45 Caliber Pistols**  \n   - **Justification:** The pistols are minimally useful on the moon, serving as tools for launching flares or breaking objects. There are no direct survival threats requiring pistols, but their utility for problem-solving justifies this position. Current ranking is appropriate.\n\n**12. Portable Heating Unit**  \n   - **Change in Ranking:** Moved up from rank 13 to 12.  \n     - **Reasoning:** While the spacesuit offers some protection against extreme temperatures, the lunar environment can subject the crew to significant cold during the long trek in shadowed regions. A portable heating unit provides added protection, making it slightly more valuable than redundant items such as the magnetic compass or dehydrated milk.\n\n**13. One Case of Dehydrated Milk**  \n   - **Justification:** Dehydrated milk is nutritionally inferior to the food concentrate and less convenient for consumption during the trek. Its added water requirement makes it inefficient under survival conditions. Current ranking remains appropriate.\n\n**14. Magnetic Compass**  \n   - **Justification:** Non-functional due to the absence of a global magnetic field on the moon. It has no direct survival utility. Current ranking remains appropriate.\n\n**15. Box of Matches**  \n   - **Justification:** Matches are entirely useless on the moon due to the lack of oxygen required for combustion. They provide no survival value. Current ranking remains appropriate.\n\n---\n\n### **Refined Ranking Summary**\n1. Oxygen Tanks  \n2. Water  \n3. Stellar Map  \n4. Solar-powered FM Receiver-Transmitter  \n5. Food Concentrate  \n6. First Aid Kit  \n7. Parachute Silk  \n8. Signal Flares  \n9. Nylon Rope (50 feet)  \n10. Life Raft  \n11. Two .45 Caliber Pistols  \n12. Portable Heating Unit  \n13. One Case of Dehydrated Milk  \n14. Magnetic Compass  \n15. Box of Matches  \n\n---\n\n### **Evaluation of Changes**\n\n- **First Aid Kit (Rank 6):** Prioritized over parachute silk due to its ability to directly address health emergencies.  \n- **Signal Flares (Rank 8):** Elevated for its survival-critical function to ensure visibility and communication near the endpoint.  \n- **Portable Heating Unit (Rank 12):** Raised slightly due to its potential value for cold protection during extended shadow travel.  \n\nThe revised ranking optimizes survival utility for the trek while reflecting the priorities of oxygen, hydration, navigation, and protection under lunar environmental constraints.",
      "score": 20
    }
  ],
  "final_ranking": [
    "Oxygen tanks",
    "Water",
    "Stellar map",
    "Solar-powered FM receiver-transmitter",
    "Food concentrate",
    "First aid kit",
    "Parachute silk",
    "Signal flares",
    "Life raft",
    "Two .45 caliber pistols",
    "Portable heating unit",
    "One case of dehydrated milk",
    "Magnetic compass",
    "Box of matches",
    "50 feet of nylon rope"
  ],
  "nasa_ranking": [
    "Oxygen tanks",
    "Water",
    "Stellar map",
    "Food concentrate",
    "Solar-powered FM receiver-transmitter",
    "50 feet of nylon rope",
    "First aid kit",
    "Parachute silk",
    "Life raft",
    "Signal flares",
    "Two .45 caliber pistols",
    "One case of dehydrated milk",
    "Portable heating unit",
    "Magnetic compass",
    "Box of matches"
  ],
  "score": 20,
  "teamwork_metrics": {}
}