{
  "simulation_id": "sim_baseline_20250417_131024",
  "config": {
    "use_team_leadership": false,
    "use_closed_loop_comm": false,
    "use_mutual_monitoring": false,
    "use_shared_mental_model": false
  },
  "exchanges": [
    {
      "type": "sequential_refinement",
      "exchanges": [
        {
          "type": "initial_ranking",
          "role": "science",
          "message": "Survival on the Moon entails addressing life-critical needs: breathable oxygen, temperature regulation, hydration, navigation, communication, and mobility. The lunar environment presents challenges such as lack of air, extreme temperature variation, and no magnetic field, which renders certain Earth-based tools ineffective. Based on these conditions and the scenario provided, here is the ranked list of the 15 items:\n\n---\n\n### **Ranking of Lunar Survival Items**\n1. **Oxygen tanks**  \n   Without a breathable oxygen supply, survival on the Moon is impossible. The Moon\u2019s atmosphere is nearly non-existent, and humans rely entirely on supplemental oxygen. This is the single most critical need.\n\n2. **Water**  \n   After oxygen, water is the next most critical resource for human survival. Dehydration can quickly lead to debilitating health effects, and walking 200 miles in a spacesuit will require adequate hydration.\n\n3. **Stellar map**  \n   Since the Moon has no magnetic field and a magnetic compass won't work, a stellar map is vital for navigation. The map will allow precise orientation using celestial objects as reference points, helping guide the team to the rendezvous point.\n\n4. **Solar-powered FM receiver-transmitter**  \n   A communication device is critical for contacting the mother ship to provide updates, coordinate survival efforts, or signal distress. Solar power ensures functionality given the Moon\u2019s continuous daylight period on one side.\n\n5. **Food concentrate**  \n   Although less urgent than oxygen and hydration, food is important for energy to sustain physical effort. Food concentrate is highly efficient in terms of weight and caloric output, making it ideal for the trek.\n\n6. **First-aid kit**  \n   Injury on the Moon could become life-threatening. A first-aid kit addresses immediate health emergencies such as cuts, abrasions, or spacesuit punctures that could compromise survival.\n\n7. **Parachute silk**  \n   Parachute silk has versatile applications, such as providing sunshade to regulate body temperature in extreme heat, repairing gear, or creating a signaling device. It is lightweight and can easily be carried.\n\n8. **Signal flares**  \n   Signal flares are useful for visually indicating your location to the mother ship or potential rescue teams, especially if the crew approaches the rendezvous point or faces unexpected delays.\n\n9. **50 feet of nylon rope**  \n   Rope is versatile in survival scenarios. It could assist in climbing over obstacles, securing equipment, or even as extra tethering to ensure crew members remain connected during the trek.\n\n10. **Portable heating unit**  \n   While lunar days are warm (up to 250\u00b0F), regions of shadow or lunar nights can drop to extreme cold (-200\u00b0F). If the team becomes stranded in darkness, this could prevent hypothermia, though managing solar day heat is generally the greater priority.\n\n11. **Two .45 caliber pistols**  \n   While a pistol may seem impractical on the Moon\u2019s airless surface, it could serve as a blunt tool for breaking equipment stuck in place or creating a noise signal if needed.\n\n12. **One case of dehydrated milk**  \n   This could serve as a supplemental food resource, but it is bulkier, requires water to reconstitute (which is a highly limited supply), and is far less efficient compared to the food concentrate.\n\n13. **Life raft**  \n   A life raft may seem unnecessary in the lunar environment as there is no water. Its inflated structure could provide thermal insulation or be used as a makeshift sled to drag supplies, at best.\n\n14. **Magnetic compass**  \n   The Moon has no magnetic field, so a magnetic compass would not function. This item is essentially useless for navigation in the lunar environment.\n\n15. **Box of matches**  \n   Matches are entirely useless on the Moon, as there is no oxygen in the atmosphere to sustain combustion. This item has absolutely no survival value.\n\n---\n\n### **Justifications Summary**\n1. Oxygen and water address immediate survival needs.  \n2. Navigation (stellar map), communication (FM transmitter), and energy (food) facilitate the trek.  \n3. Safety items (first-aid kit, parachute silk, signal flares, rope) assist in managing environmental challenges.  \n4. Tools of lesser importance (pistols, heating units) are assigned lower rankings.  \n5. Items that provide no functionality in the lunar environment (magnetic compass, box of matches) are ranked at the bottom.\n\nThis ranking prioritizes the crew's ability to sustain life and successfully navigate 200 miles to the rendezvous point amidst the Moon\u2019s hostile conditions.",
          "ranking": [
            "Oxygen tanks",
            "Water",
            "Stellar map",
            "Solar-powered FM receiver-transmitter",
            "Food concentrate",
            "Parachute silk",
            "Signal flares",
            "50 feet of nylon rope",
            "Portable heating unit",
            "Two .45 caliber pistols",
            "One case of dehydrated milk",
            "Life raft",
            "Magnetic compass",
            "Box of matches",
            "First aid kit"
          ]
        },
        {
          "type": "refinement",
          "iteration": 1,
          "role": "resource",
          "message": "### **Refined Lunar Survival Item Ranking**\n\nAfter reevaluating the original rankings, I largely agree with the reasoning behind the prioritizations. However, I suggest a few adjustments based on functionality, resource efficiency, and survival optimization for the 200-mile lunar trek. Here is my refined list:\n\n---\n\n### **1. Oxygen Tanks**  \nUnchanged. Oxygen is the number one life-critical resource. Without it, survival is impossible given the Moon\u2019s lack of atmosphere. \n\n---\n\n### **2. Water**  \nUnchanged. Hydration is critical for survival, particularly for sustaining physical effort during the long trek.\n\n---\n\n### **3. Stellar Map**  \nUnchanged. Navigation using celestial reference points is essential because the Moon lacks a magnetic field. This item ensures the team doesn\u2019t get lost.\n\n---\n\n### **4. Solar-powered FM Receiver-Transmitter**  \nUnchanged. Maintaining communication with the mother ship is vital for updates, coordination, and distress signaling. It is also solar-powered, ensuring functionality during the lunar day.\n\n---\n\n### **5. First-Aid Kit**  \n**Moved up from #6 to #5.** The risk of injuries (cuts, abrasions, punctures to spacesuits) cannot be overstated in the Moon\u2019s unforgiving environment. Addressing even minor injuries quickly is essential, as they can escalate into life-threatening issues without intervention.\n\n---\n\n### **6. Food Concentrate**  \n**Moved down from #5 to #6.** While food is necessary for maintaining energy, it is slightly less urgent compared to tools like the first-aid kit, which addresses life-critical injuries. The body can survive longer without food than without addressing medical emergencies.\n\n---\n\n### **7. Signal Flares**  \n**Moved up from #8 to #7.** Signal flares are extremely valuable for visual signaling as the team approaches the rendezvous point or if unforeseen delays arise. They are lightweight and provide a reliable way to alert rescuers.\n\n---\n\n### **8. Parachute Silk**  \nUnchanged. Its versatility in providing sunshade, gear repair, or as a signaling aid makes it more valuable than items lower on the list.\n\n---\n\n### **9. 50 feet of Nylon Rope**  \nUnchanged. Rope is multifunctional for securing equipment, assisting in climbing, and ensuring the team stays tethered. It is slightly less critical than parachute silk due to the trekking scenario not overtly requiring vertical climbing or other frequent uses for a rope.\n\n---\n\n### **10. Portable Heating Unit**  \nUnchanged. With temperatures on the Moon ranging from extreme heat during the day to extreme cold at night, this item is an essential backup if temperatures drop unexpectedly (e.g., if the team is delayed and nighttime conditions occur).\n\n---\n\n### **11. Life Raft**  \nUnchanged. Though it has minimal usefulness in the lunar environment, there are creative uses like thermal insulation or as a sled for carrying equipment. Its bulky and single-use nature limits its ranking.\n\n---\n\n### **12. Two .45 Caliber Pistols**  \n**Moved down from #11 to #12.** While these could theoretically be used as blunt tools or signaling devices, their utility is significantly overshadowed by other tools like the signal flares or parachute silk.\n\n---\n\n### **13. One Case of Dehydrated Milk**  \nUnchanged. This item has limited usefulness because it requires water to reconstitute, which is a precious resource better reserved for drinking. Food concentrate is a far superior energy source for its weight.\n\n---\n\n### **14. Magnetic Compass**  \nUnchanged. Completely ineffective on the Moon due to the lack of a magnetic field. However, it is ranked higher than the box of matches because it is not an outright deadweight; it can serve as a minor weight to secure other items if needed.\n\n---\n\n### **15. Box of Matches**  \nUnchanged. Entirely useless on the Moon due to the lack of oxygen to sustain combustion.\n\n---\n\n### **Refined Ranked List with Justifications**\n1. **Oxygen Tanks:** Critical for breathing. Immediate survival need.\n2. **Water:** Essential for hydration on the trek. Second most urgent need.\n3. **Stellar Map:** Key navigation tool given the Moon\u2019s lack of a magnetic field.\n4. **Solar-powered FM Receiver-Transmitter:** Maintains vital communication with the mother ship.\n5. **First-Aid Kit:** Essential for treating injuries that could become life-threatening.\n6. **Food Concentrate:** Compact energy source. Less urgent than first-aid but necessary for the trek.\n7. **Signal Flares:** Lightweight and key for visual signaling near the rendezvous point.\n8. **Parachute Silk:** Versatile multi-use tool helpful for sunshade, repairs, or signaling aid.\n9. **50 feet of Nylon Rope:** Useful for securing cargo and assisting in team coordination or navigation.\n10. **Portable Heating Unit:** Necessary backup for extreme cold temperatures during nighttime delays.\n11. **Life Raft:** Minor utility as thermal insulation or as a makeshift sled.\n12. **Two .45 Caliber Pistols:** Limited use as a blunt tool or emergency signaling device.\n13. **One Case of Dehydrated Milk:** Suboptimal energy source due to bulk and water requirements.\n14. **Magnetic Compass:** Useless for navigation but not entirely dead weight.\n15. **Box of Matches:** Utterly useless on the Moon due to lack of atmospheric oxygen.\n\n---\n\n### **Final Thoughts**\nThis refined ranking emphasizes survival-critical priorities like oxygen, hydration, and navigation, while factoring in the unique challenges of the lunar environment. Items are ranked based on their utility/weight ratio and alignment with the trek to the rendezvous point. Adjustments were mainly to elevate tools relevant to medical emergencies (first-aid kit) and visibility (signal flares) over less critical or less versatile items.",
          "ranking": [
            "Oxygen tanks",
            "Water",
            "Stellar map",
            "Solar-powered FM receiver-transmitter",
            "Food concentrate",
            "Signal flares",
            "Parachute silk",
            "50 feet of nylon rope",
            "Portable heating unit",
            "Life raft",
            "Two .45 caliber pistols",
            "One case of dehydrated milk",
            "Magnetic compass",
            "Box of matches",
            "First aid kit"
          ]
        }
      ],
      "iterations": [
        {
          "iteration": 0,
          "current_ranking": [
            "Oxygen tanks",
            "Water",
            "Stellar map",
            "Solar-powered FM receiver-transmitter",
            "Food concentrate",
            "Parachute silk",
            "Signal flares",
            "50 feet of nylon rope",
            "Portable heating unit",
            "Two .45 caliber pistols",
            "One case of dehydrated milk",
            "Life raft",
            "Magnetic compass",
            "Box of matches",
            "First aid kit"
          ],
          "current_message": "Survival on the Moon entails addressing life-critical needs: breathable oxygen, temperature regulation, hydration, navigation, communication, and mobility. The lunar environment presents challenges such as lack of air, extreme temperature variation, and no magnetic field, which renders certain Earth-based tools ineffective. Based on these conditions and the scenario provided, here is the ranked list of the 15 items:\n\n---\n\n### **Ranking of Lunar Survival Items**\n1. **Oxygen tanks**  \n   Without a breathable oxygen supply, survival on the Moon is impossible. The Moon\u2019s atmosphere is nearly non-existent, and humans rely entirely on supplemental oxygen. This is the single most critical need.\n\n2. **Water**  \n   After oxygen, water is the next most critical resource for human survival. Dehydration can quickly lead to debilitating health effects, and walking 200 miles in a spacesuit will require adequate hydration.\n\n3. **Stellar map**  \n   Since the Moon has no magnetic field and a magnetic compass won't work, a stellar map is vital for navigation. The map will allow precise orientation using celestial objects as reference points, helping guide the team to the rendezvous point.\n\n4. **Solar-powered FM receiver-transmitter**  \n   A communication device is critical for contacting the mother ship to provide updates, coordinate survival efforts, or signal distress. Solar power ensures functionality given the Moon\u2019s continuous daylight period on one side.\n\n5. **Food concentrate**  \n   Although less urgent than oxygen and hydration, food is important for energy to sustain physical effort. Food concentrate is highly efficient in terms of weight and caloric output, making it ideal for the trek.\n\n6. **First-aid kit**  \n   Injury on the Moon could become life-threatening. A first-aid kit addresses immediate health emergencies such as cuts, abrasions, or spacesuit punctures that could compromise survival.\n\n7. **Parachute silk**  \n   Parachute silk has versatile applications, such as providing sunshade to regulate body temperature in extreme heat, repairing gear, or creating a signaling device. It is lightweight and can easily be carried.\n\n8. **Signal flares**  \n   Signal flares are useful for visually indicating your location to the mother ship or potential rescue teams, especially if the crew approaches the rendezvous point or faces unexpected delays.\n\n9. **50 feet of nylon rope**  \n   Rope is versatile in survival scenarios. It could assist in climbing over obstacles, securing equipment, or even as extra tethering to ensure crew members remain connected during the trek.\n\n10. **Portable heating unit**  \n   While lunar days are warm (up to 250\u00b0F), regions of shadow or lunar nights can drop to extreme cold (-200\u00b0F). If the team becomes stranded in darkness, this could prevent hypothermia, though managing solar day heat is generally the greater priority.\n\n11. **Two .45 caliber pistols**  \n   While a pistol may seem impractical on the Moon\u2019s airless surface, it could serve as a blunt tool for breaking equipment stuck in place or creating a noise signal if needed.\n\n12. **One case of dehydrated milk**  \n   This could serve as a supplemental food resource, but it is bulkier, requires water to reconstitute (which is a highly limited supply), and is far less efficient compared to the food concentrate.\n\n13. **Life raft**  \n   A life raft may seem unnecessary in the lunar environment as there is no water. Its inflated structure could provide thermal insulation or be used as a makeshift sled to drag supplies, at best.\n\n14. **Magnetic compass**  \n   The Moon has no magnetic field, so a magnetic compass would not function. This item is essentially useless for navigation in the lunar environment.\n\n15. **Box of matches**  \n   Matches are entirely useless on the Moon, as there is no oxygen in the atmosphere to sustain combustion. This item has absolutely no survival value.\n\n---\n\n### **Justifications Summary**\n1. Oxygen and water address immediate survival needs.  \n2. Navigation (stellar map), communication (FM transmitter), and energy (food) facilitate the trek.  \n3. Safety items (first-aid kit, parachute silk, signal flares, rope) assist in managing environmental challenges.  \n4. Tools of lesser importance (pistols, heating units) are assigned lower rankings.  \n5. Items that provide no functionality in the lunar environment (magnetic compass, box of matches) are ranked at the bottom.\n\nThis ranking prioritizes the crew's ability to sustain life and successfully navigate 200 miles to the rendezvous point amidst the Moon\u2019s hostile conditions.",
          "current_agent": "science"
        },
        {
          "iteration": 1,
          "current_ranking": [
            "Oxygen tanks",
            "Water",
            "Stellar map",
            "Solar-powered FM receiver-transmitter",
            "Food concentrate",
            "Signal flares",
            "Parachute silk",
            "50 feet of nylon rope",
            "Portable heating unit",
            "Life raft",
            "Two .45 caliber pistols",
            "One case of dehydrated milk",
            "Magnetic compass",
            "Box of matches",
            "First aid kit"
          ],
          "current_message": "### **Refined Lunar Survival Item Ranking**\n\nAfter reevaluating the original rankings, I largely agree with the reasoning behind the prioritizations. However, I suggest a few adjustments based on functionality, resource efficiency, and survival optimization for the 200-mile lunar trek. Here is my refined list:\n\n---\n\n### **1. Oxygen Tanks**  \nUnchanged. Oxygen is the number one life-critical resource. Without it, survival is impossible given the Moon\u2019s lack of atmosphere. \n\n---\n\n### **2. Water**  \nUnchanged. Hydration is critical for survival, particularly for sustaining physical effort during the long trek.\n\n---\n\n### **3. Stellar Map**  \nUnchanged. Navigation using celestial reference points is essential because the Moon lacks a magnetic field. This item ensures the team doesn\u2019t get lost.\n\n---\n\n### **4. Solar-powered FM Receiver-Transmitter**  \nUnchanged. Maintaining communication with the mother ship is vital for updates, coordination, and distress signaling. It is also solar-powered, ensuring functionality during the lunar day.\n\n---\n\n### **5. First-Aid Kit**  \n**Moved up from #6 to #5.** The risk of injuries (cuts, abrasions, punctures to spacesuits) cannot be overstated in the Moon\u2019s unforgiving environment. Addressing even minor injuries quickly is essential, as they can escalate into life-threatening issues without intervention.\n\n---\n\n### **6. Food Concentrate**  \n**Moved down from #5 to #6.** While food is necessary for maintaining energy, it is slightly less urgent compared to tools like the first-aid kit, which addresses life-critical injuries. The body can survive longer without food than without addressing medical emergencies.\n\n---\n\n### **7. Signal Flares**  \n**Moved up from #8 to #7.** Signal flares are extremely valuable for visual signaling as the team approaches the rendezvous point or if unforeseen delays arise. They are lightweight and provide a reliable way to alert rescuers.\n\n---\n\n### **8. Parachute Silk**  \nUnchanged. Its versatility in providing sunshade, gear repair, or as a signaling aid makes it more valuable than items lower on the list.\n\n---\n\n### **9. 50 feet of Nylon Rope**  \nUnchanged. Rope is multifunctional for securing equipment, assisting in climbing, and ensuring the team stays tethered. It is slightly less critical than parachute silk due to the trekking scenario not overtly requiring vertical climbing or other frequent uses for a rope.\n\n---\n\n### **10. Portable Heating Unit**  \nUnchanged. With temperatures on the Moon ranging from extreme heat during the day to extreme cold at night, this item is an essential backup if temperatures drop unexpectedly (e.g., if the team is delayed and nighttime conditions occur).\n\n---\n\n### **11. Life Raft**  \nUnchanged. Though it has minimal usefulness in the lunar environment, there are creative uses like thermal insulation or as a sled for carrying equipment. Its bulky and single-use nature limits its ranking.\n\n---\n\n### **12. Two .45 Caliber Pistols**  \n**Moved down from #11 to #12.** While these could theoretically be used as blunt tools or signaling devices, their utility is significantly overshadowed by other tools like the signal flares or parachute silk.\n\n---\n\n### **13. One Case of Dehydrated Milk**  \nUnchanged. This item has limited usefulness because it requires water to reconstitute, which is a precious resource better reserved for drinking. Food concentrate is a far superior energy source for its weight.\n\n---\n\n### **14. Magnetic Compass**  \nUnchanged. Completely ineffective on the Moon due to the lack of a magnetic field. However, it is ranked higher than the box of matches because it is not an outright deadweight; it can serve as a minor weight to secure other items if needed.\n\n---\n\n### **15. Box of Matches**  \nUnchanged. Entirely useless on the Moon due to the lack of oxygen to sustain combustion.\n\n---\n\n### **Refined Ranked List with Justifications**\n1. **Oxygen Tanks:** Critical for breathing. Immediate survival need.\n2. **Water:** Essential for hydration on the trek. Second most urgent need.\n3. **Stellar Map:** Key navigation tool given the Moon\u2019s lack of a magnetic field.\n4. **Solar-powered FM Receiver-Transmitter:** Maintains vital communication with the mother ship.\n5. **First-Aid Kit:** Essential for treating injuries that could become life-threatening.\n6. **Food Concentrate:** Compact energy source. Less urgent than first-aid but necessary for the trek.\n7. **Signal Flares:** Lightweight and key for visual signaling near the rendezvous point.\n8. **Parachute Silk:** Versatile multi-use tool helpful for sunshade, repairs, or signaling aid.\n9. **50 feet of Nylon Rope:** Useful for securing cargo and assisting in team coordination or navigation.\n10. **Portable Heating Unit:** Necessary backup for extreme cold temperatures during nighttime delays.\n11. **Life Raft:** Minor utility as thermal insulation or as a makeshift sled.\n12. **Two .45 Caliber Pistols:** Limited use as a blunt tool or emergency signaling device.\n13. **One Case of Dehydrated Milk:** Suboptimal energy source due to bulk and water requirements.\n14. **Magnetic Compass:** Useless for navigation but not entirely dead weight.\n15. **Box of Matches:** Utterly useless on the Moon due to lack of atmospheric oxygen.\n\n---\n\n### **Final Thoughts**\nThis refined ranking emphasizes survival-critical priorities like oxygen, hydration, and navigation, while factoring in the unique challenges of the lunar environment. Items are ranked based on their utility/weight ratio and alignment with the trek to the rendezvous point. Adjustments were mainly to elevate tools relevant to medical emergencies (first-aid kit) and visibility (signal flares) over less critical or less versatile items.",
          "current_agent": "resource",
          "difference_score": 6
        }
      ],
      "final_ranking": [
        "Oxygen tanks",
        "Water",
        "Stellar map",
        "Solar-powered FM receiver-transmitter",
        "Food concentrate",
        "Signal flares",
        "Parachute silk",
        "50 feet of nylon rope",
        "Portable heating unit",
        "Life raft",
        "Two .45 caliber pistols",
        "One case of dehydrated milk",
        "Magnetic compass",
        "Box of matches",
        "First aid kit"
      ],
      "final_message": "### **Refined Lunar Survival Item Ranking**\n\nAfter reevaluating the original rankings, I largely agree with the reasoning behind the prioritizations. However, I suggest a few adjustments based on functionality, resource efficiency, and survival optimization for the 200-mile lunar trek. Here is my refined list:\n\n---\n\n### **1. Oxygen Tanks**  \nUnchanged. Oxygen is the number one life-critical resource. Without it, survival is impossible given the Moon\u2019s lack of atmosphere. \n\n---\n\n### **2. Water**  \nUnchanged. Hydration is critical for survival, particularly for sustaining physical effort during the long trek.\n\n---\n\n### **3. Stellar Map**  \nUnchanged. Navigation using celestial reference points is essential because the Moon lacks a magnetic field. This item ensures the team doesn\u2019t get lost.\n\n---\n\n### **4. Solar-powered FM Receiver-Transmitter**  \nUnchanged. Maintaining communication with the mother ship is vital for updates, coordination, and distress signaling. It is also solar-powered, ensuring functionality during the lunar day.\n\n---\n\n### **5. First-Aid Kit**  \n**Moved up from #6 to #5.** The risk of injuries (cuts, abrasions, punctures to spacesuits) cannot be overstated in the Moon\u2019s unforgiving environment. Addressing even minor injuries quickly is essential, as they can escalate into life-threatening issues without intervention.\n\n---\n\n### **6. Food Concentrate**  \n**Moved down from #5 to #6.** While food is necessary for maintaining energy, it is slightly less urgent compared to tools like the first-aid kit, which addresses life-critical injuries. The body can survive longer without food than without addressing medical emergencies.\n\n---\n\n### **7. Signal Flares**  \n**Moved up from #8 to #7.** Signal flares are extremely valuable for visual signaling as the team approaches the rendezvous point or if unforeseen delays arise. They are lightweight and provide a reliable way to alert rescuers.\n\n---\n\n### **8. Parachute Silk**  \nUnchanged. Its versatility in providing sunshade, gear repair, or as a signaling aid makes it more valuable than items lower on the list.\n\n---\n\n### **9. 50 feet of Nylon Rope**  \nUnchanged. Rope is multifunctional for securing equipment, assisting in climbing, and ensuring the team stays tethered. It is slightly less critical than parachute silk due to the trekking scenario not overtly requiring vertical climbing or other frequent uses for a rope.\n\n---\n\n### **10. Portable Heating Unit**  \nUnchanged. With temperatures on the Moon ranging from extreme heat during the day to extreme cold at night, this item is an essential backup if temperatures drop unexpectedly (e.g., if the team is delayed and nighttime conditions occur).\n\n---\n\n### **11. Life Raft**  \nUnchanged. Though it has minimal usefulness in the lunar environment, there are creative uses like thermal insulation or as a sled for carrying equipment. Its bulky and single-use nature limits its ranking.\n\n---\n\n### **12. Two .45 Caliber Pistols**  \n**Moved down from #11 to #12.** While these could theoretically be used as blunt tools or signaling devices, their utility is significantly overshadowed by other tools like the signal flares or parachute silk.\n\n---\n\n### **13. One Case of Dehydrated Milk**  \nUnchanged. This item has limited usefulness because it requires water to reconstitute, which is a precious resource better reserved for drinking. Food concentrate is a far superior energy source for its weight.\n\n---\n\n### **14. Magnetic Compass**  \nUnchanged. Completely ineffective on the Moon due to the lack of a magnetic field. However, it is ranked higher than the box of matches because it is not an outright deadweight; it can serve as a minor weight to secure other items if needed.\n\n---\n\n### **15. Box of Matches**  \nUnchanged. Entirely useless on the Moon due to the lack of oxygen to sustain combustion.\n\n---\n\n### **Refined Ranked List with Justifications**\n1. **Oxygen Tanks:** Critical for breathing. Immediate survival need.\n2. **Water:** Essential for hydration on the trek. Second most urgent need.\n3. **Stellar Map:** Key navigation tool given the Moon\u2019s lack of a magnetic field.\n4. **Solar-powered FM Receiver-Transmitter:** Maintains vital communication with the mother ship.\n5. **First-Aid Kit:** Essential for treating injuries that could become life-threatening.\n6. **Food Concentrate:** Compact energy source. Less urgent than first-aid but necessary for the trek.\n7. **Signal Flares:** Lightweight and key for visual signaling near the rendezvous point.\n8. **Parachute Silk:** Versatile multi-use tool helpful for sunshade, repairs, or signaling aid.\n9. **50 feet of Nylon Rope:** Useful for securing cargo and assisting in team coordination or navigation.\n10. **Portable Heating Unit:** Necessary backup for extreme cold temperatures during nighttime delays.\n11. **Life Raft:** Minor utility as thermal insulation or as a makeshift sled.\n12. **Two .45 Caliber Pistols:** Limited use as a blunt tool or emergency signaling device.\n13. **One Case of Dehydrated Milk:** Suboptimal energy source due to bulk and water requirements.\n14. **Magnetic Compass:** Useless for navigation but not entirely dead weight.\n15. **Box of Matches:** Utterly useless on the Moon due to lack of atmospheric oxygen.\n\n---\n\n### **Final Thoughts**\nThis refined ranking emphasizes survival-critical priorities like oxygen, hydration, and navigation, while factoring in the unique challenges of the lunar environment. Items are ranked based on their utility/weight ratio and alignment with the trek to the rendezvous point. Adjustments were mainly to elevate tools relevant to medical emergencies (first-aid kit) and visibility (signal flares) over less critical or less versatile items.",
      "score": 24
    }
  ],
  "final_ranking": [
    "Oxygen tanks",
    "Water",
    "Stellar map",
    "Solar-powered FM receiver-transmitter",
    "Food concentrate",
    "Signal flares",
    "Parachute silk",
    "50 feet of nylon rope",
    "Portable heating unit",
    "Life raft",
    "Two .45 caliber pistols",
    "One case of dehydrated milk",
    "Magnetic compass",
    "Box of matches",
    "First aid kit"
  ],
  "nasa_ranking": [
    "Oxygen tanks",
    "Water",
    "Stellar map",
    "Food concentrate",
    "Solar-powered FM receiver-transmitter",
    "50 feet of nylon rope",
    "First aid kit",
    "Parachute silk",
    "Life raft",
    "Signal flares",
    "Two .45 caliber pistols",
    "One case of dehydrated milk",
    "Portable heating unit",
    "Magnetic compass",
    "Box of matches"
  ],
  "score": 24,
  "teamwork_metrics": {}
}