{
  "simulation_id": "sim_mutual_monitoring_20250417_150240",
  "config": {
    "use_team_leadership": false,
    "use_closed_loop_comm": false,
    "use_mutual_monitoring": true,
    "use_shared_mental_model": false
  },
  "exchanges": [
    {
      "type": "sequential_refinement",
      "exchanges": [
        {
          "type": "initial_ranking",
          "role": "science",
          "message": "### Lunar Survival Items Ranked for a 200-Mile Trek\n\nThe lunar environment presents unique challenges: no atmosphere (vacuum), extreme temperatures, lack of water and breathable air, low gravity, and the absence of magnetic fields for navigation. The items are ranked based on their ability to address survival priorities such as oxygen, hydration, navigation, communication, protection, and energy needs. Here's the ranking:\n\n---\n\n#### **1. Oxygen Tanks**\n- **Justification:** Oxygen is the absolute priority for survival in the vacuum of the moon. Without breathable air, the crew cannot survive even for a short period. This is the most critical item for the journey.\n\n---\n\n#### **2. Water**\n- **Justification:** Dehydration will quickly impair cognitive and physical functions. Water is essential for hydration during the trek and could also be used for cooling or cleaning purposes in emergencies.\n\n---\n\n#### **3. Stellar Map**\n- **Justification:** Navigation is crucial for reaching the rendezvous point. A stellar map allows the crew to orient themselves using celestial landmarks, as there are no terrestrial features or magnetic fields on the moon.\n\n---\n\n#### **4. Solar-Powered FM Receiver-Transmitter**\n- **Justification:** Communication with the mother ship or other rescue teams is essential for survival. A solar-powered device ensures functionality without reliance on batteries, which may fail during the trek.\n\n---\n\n#### **5. Food Concentrate**\n- **Justification:** While survival without food is possible for several days, physical exertion during the trek requires energy. Food concentrate provides compact, lightweight nutrition.\n\n---\n\n#### **6. First Aid Kit**\n- **Justification:** Injuries or medical emergencies during the trek must be addressed immediately to prevent incapacitation. The first aid kit is vital for treating wounds, stabilizing conditions, and managing health.\n\n---\n\n#### **7. 50 Feet of Nylon Rope**\n- **Justification:** Rope has multiple uses, including securing equipment, assisting in climbing or descending lunar terrain, and potentially creating makeshift tools. Its versatility makes it a valuable survival item.\n\n---\n\n#### **8. Parachute Silk**\n- **Justification:** Parachute silk can be used for shelter, insulation, or protection against abrasive lunar dust. It could also serve as a signaling device due to its reflective properties.\n\n---\n\n#### **9. Signal Flares**\n- **Justification:** Flares can be used for signaling the mother ship or other rescuers, especially if the crew gets lost or delays occur. Visibility is critical in the vast lunar environment.\n\n---\n\n#### **10. Portable Heating Unit**\n- **Justification:** The lunar surface experiences extreme temperature fluctuations. A heating unit can help prevent hypothermia during the cold lunar nights or shaded areas. However, the crew's spacesuits may already provide thermal regulation.\n\n---\n\n#### **11. Life Raft**\n- **Justification:** While a life raft is not designed for lunar use, it could serve as a makeshift sled for carrying equipment or injured crew members. Its utility is limited compared to other items.\n\n---\n\n#### **12. Two .45 Caliber Pistols**\n- **Justification:** Firearms have limited utility on the moon due to the absence of threats like wildlife. They could potentially be used to create noise or vibrations for signaling or to break objects, but their weight and lack of direct survival benefit place them lower on the list.\n\n---\n\n#### **13. One Case of Dehydrated Milk**\n- **Justification:** While food is important, dehydrated milk is less practical than food concentrate for providing immediate energy and nutrition. It also requires water for preparation, which limits its usefulness.\n\n---\n\n#### **14. Magnetic Compass**\n- **Justification:** Magnetic compasses are useless on the moon because there is no magnetic field to interact with. This item has no functional value in the lunar environment.\n\n---\n\n#### **15. Box of Matches**\n- **Justification:** Matches cannot ignite in the vacuum of the moon, as combustion requires oxygen. This item is entirely non-functional in the lunar environment.\n\n---\n\n### Summary:\nThe ranking prioritizes items that address immediate survival needs such as oxygen, hydration, navigation, and communication, followed by items that provide energy, protection, and versatility. Items with limited or no utility in the lunar environment are ranked lowest.",
          "ranking": [
            "Oxygen tanks",
            "Water",
            "Stellar map",
            "Solar-powered FM receiver-transmitter",
            "Food concentrate",
            "First aid kit",
            "50 feet of nylon rope",
            "Parachute silk",
            "Signal flares",
            "Portable heating unit",
            "Life raft",
            "Two .45 caliber pistols",
            "One case of dehydrated milk",
            "Magnetic compass",
            "Box of matches"
          ]
        },
        {
          "type": "refinement",
          "iteration": 1,
          "role": "resource",
          "message": "### Refined Ranking of Lunar Survival Items for a 200-Mile Trek\n\nAs a Resource Manager, I have carefully analyzed the original ranking and adjusted it where necessary based on utility, weight, and survival priorities. The following refined ranking reflects the optimal prioritization of items for survival in the lunar environment:\n\n---\n\n#### **1. Oxygen Tanks**\n- **Justification:** Oxygen is essential for survival in the moon's vacuum. Without it, the crew cannot survive even for a few minutes. This remains the top priority.\n\n---\n\n#### **2. Water**\n- **Justification:** Hydration is critical for maintaining physical and cognitive function. Water also has secondary uses for cooling and cleaning. Its weight is justified by its necessity.\n\n---\n\n#### **3. Stellar Map**\n- **Justification:** Navigation is critical for reaching the rendezvous point. The stellar map is the only reliable tool for orienting the crew in the moon's featureless environment.\n\n---\n\n#### **4. Solar-Powered FM Receiver-Transmitter**\n- **Justification:** Communication with the mother ship or rescue teams is essential for survival. A solar-powered unit ensures reliability without dependence on batteries.\n\n---\n\n#### **5. First Aid Kit**  \n- **Justification:** Injuries or medical emergencies during the trek could incapacitate crew members. The first aid kit is essential for treating wounds, managing health, and ensuring the team can continue the journey.  \n- **Change:** Moved up from 6th to 5th because immediate health management is more critical than food in the short term.\n\n---\n\n#### **6. Food Concentrate**\n- **Justification:** Compact and lightweight, food concentrate provides the energy needed for the physical exertion of the trek. While survival without food is possible for days, energy is required for optimal performance.\n\n---\n\n#### **7. 50 Feet of Nylon Rope**\n- **Justification:** With multiple uses, including securing equipment, aiding in climbing, or creating makeshift tools, the rope is a versatile and lightweight survival tool.\n\n---\n\n#### **8. Signal Flares**\n- **Justification:** Visibility is critical in the vast lunar environment. Flares can help signal the mother ship or rescuers in emergencies.  \n- **Change:** Moved up from 9th to 8th because signaling is more essential than shelter (parachute silk) in survival.\n\n---\n\n#### **9. Parachute Silk**\n- **Justification:** Parachute silk can be used for insulation, shelter, or protection against lunar dust. It also has potential as a signaling device due to its reflective properties.\n\n---\n\n#### **10. Portable Heating Unit**\n- **Justification:** While spacesuits provide thermal regulation, a heating unit could help prevent hypothermia during the cold lunar nights or shaded areas. Its utility is situational but potentially lifesaving.\n\n---\n\n#### **11. Life Raft**\n- **Justification:** The life raft could serve as a sled for carrying equipment or injured crew members, but its utility is limited compared to other items.  \n\n---\n\n#### **12. Two .45 Caliber Pistols**\n- **Justification:** Firearms have minimal utility on the moon. They could be used to create noise or vibrations for signaling or breaking objects, but their weight and lack of direct survival value make them a low priority.\n\n---\n\n#### **13. One Case of Dehydrated Milk**\n- **Justification:** Dehydrated milk is less practical than food concentrate for immediate energy and nutrition. Its dependence on water for preparation further limits its utility.\n\n---\n\n#### **14. Magnetic Compass**\n- **Justification:** A magnetic compass is entirely useless on the moon due to the absence of a magnetic field.  \n\n---\n\n#### **15. Box of Matches**\n- **Justification:** Matches are non-functional in the vacuum of the moon, as combustion requires oxygen. They have no survival value.\n\n---\n\n### Final Refined Ranking:\n1. **Oxygen Tanks** \u2013 Essential for breathing in the vacuum.\n2. **Water** \u2013 Vital for hydration and physical function.\n3. **Stellar Map** \u2013 Critical for navigation to the rendezvous point.\n4. **Solar-Powered FM Receiver-Transmitter** \u2013 Ensures communication and potential rescue.\n5. **First Aid Kit** \u2013 Necessary for treating injuries and stabilizing health.\n6. **Food Concentrate** \u2013 Provides energy for physical exertion.\n7. **50 Feet of Nylon Rope** \u2013 Versatile tool for securing, climbing, and improvisation.\n8. **Signal Flares** \u2013 Increases visibility for rescue efforts.\n9. **Parachute Silk** \u2013 Useful for shelter, insulation, and signaling.\n10. **Portable Heating Unit** \u2013 Helps regulate temperature in extreme conditions.\n11. **Life Raft** \u2013 Can function as a sled for equipment or injured crew.\n12. **Two .45 Caliber Pistols** \u2013 Minimal utility, but possible for signaling or breaking objects.\n13. **One Case of Dehydrated Milk** \u2013 Less practical and requires water for use.\n14. **Magnetic Compass** \u2013 Useless on the moon without a magnetic field.\n15. **Box of Matches** \u2013 Non-functional in the lunar environment.\n\n---\n\n### Key Changes:\n1. **First Aid Kit** moved up to 5th due to its critical role in addressing injuries during the trek.\n2. **Signal Flares** moved up to 8th due to their importance in signaling for rescue.\n3. Other items retain their positions based on their relative utility and necessity.",
          "ranking": [
            "Oxygen tanks",
            "Water",
            "Stellar map",
            "Solar-powered FM receiver-transmitter",
            "First aid kit",
            "Food concentrate",
            "50 feet of nylon rope",
            "Signal flares",
            "Parachute silk",
            "Portable heating unit",
            "Life raft",
            "Two .45 caliber pistols",
            "One case of dehydrated milk",
            "Magnetic compass",
            "Box of matches"
          ]
        }
      ],
      "iterations": [
        {
          "iteration": 0,
          "current_ranking": [
            "Oxygen tanks",
            "Water",
            "Stellar map",
            "Solar-powered FM receiver-transmitter",
            "Food concentrate",
            "First aid kit",
            "50 feet of nylon rope",
            "Parachute silk",
            "Signal flares",
            "Portable heating unit",
            "Life raft",
            "Two .45 caliber pistols",
            "One case of dehydrated milk",
            "Magnetic compass",
            "Box of matches"
          ],
          "current_message": "### Lunar Survival Items Ranked for a 200-Mile Trek\n\nThe lunar environment presents unique challenges: no atmosphere (vacuum), extreme temperatures, lack of water and breathable air, low gravity, and the absence of magnetic fields for navigation. The items are ranked based on their ability to address survival priorities such as oxygen, hydration, navigation, communication, protection, and energy needs. Here's the ranking:\n\n---\n\n#### **1. Oxygen Tanks**\n- **Justification:** Oxygen is the absolute priority for survival in the vacuum of the moon. Without breathable air, the crew cannot survive even for a short period. This is the most critical item for the journey.\n\n---\n\n#### **2. Water**\n- **Justification:** Dehydration will quickly impair cognitive and physical functions. Water is essential for hydration during the trek and could also be used for cooling or cleaning purposes in emergencies.\n\n---\n\n#### **3. Stellar Map**\n- **Justification:** Navigation is crucial for reaching the rendezvous point. A stellar map allows the crew to orient themselves using celestial landmarks, as there are no terrestrial features or magnetic fields on the moon.\n\n---\n\n#### **4. Solar-Powered FM Receiver-Transmitter**\n- **Justification:** Communication with the mother ship or other rescue teams is essential for survival. A solar-powered device ensures functionality without reliance on batteries, which may fail during the trek.\n\n---\n\n#### **5. Food Concentrate**\n- **Justification:** While survival without food is possible for several days, physical exertion during the trek requires energy. Food concentrate provides compact, lightweight nutrition.\n\n---\n\n#### **6. First Aid Kit**\n- **Justification:** Injuries or medical emergencies during the trek must be addressed immediately to prevent incapacitation. The first aid kit is vital for treating wounds, stabilizing conditions, and managing health.\n\n---\n\n#### **7. 50 Feet of Nylon Rope**\n- **Justification:** Rope has multiple uses, including securing equipment, assisting in climbing or descending lunar terrain, and potentially creating makeshift tools. Its versatility makes it a valuable survival item.\n\n---\n\n#### **8. Parachute Silk**\n- **Justification:** Parachute silk can be used for shelter, insulation, or protection against abrasive lunar dust. It could also serve as a signaling device due to its reflective properties.\n\n---\n\n#### **9. Signal Flares**\n- **Justification:** Flares can be used for signaling the mother ship or other rescuers, especially if the crew gets lost or delays occur. Visibility is critical in the vast lunar environment.\n\n---\n\n#### **10. Portable Heating Unit**\n- **Justification:** The lunar surface experiences extreme temperature fluctuations. A heating unit can help prevent hypothermia during the cold lunar nights or shaded areas. However, the crew's spacesuits may already provide thermal regulation.\n\n---\n\n#### **11. Life Raft**\n- **Justification:** While a life raft is not designed for lunar use, it could serve as a makeshift sled for carrying equipment or injured crew members. Its utility is limited compared to other items.\n\n---\n\n#### **12. Two .45 Caliber Pistols**\n- **Justification:** Firearms have limited utility on the moon due to the absence of threats like wildlife. They could potentially be used to create noise or vibrations for signaling or to break objects, but their weight and lack of direct survival benefit place them lower on the list.\n\n---\n\n#### **13. One Case of Dehydrated Milk**\n- **Justification:** While food is important, dehydrated milk is less practical than food concentrate for providing immediate energy and nutrition. It also requires water for preparation, which limits its usefulness.\n\n---\n\n#### **14. Magnetic Compass**\n- **Justification:** Magnetic compasses are useless on the moon because there is no magnetic field to interact with. This item has no functional value in the lunar environment.\n\n---\n\n#### **15. Box of Matches**\n- **Justification:** Matches cannot ignite in the vacuum of the moon, as combustion requires oxygen. This item is entirely non-functional in the lunar environment.\n\n---\n\n### Summary:\nThe ranking prioritizes items that address immediate survival needs such as oxygen, hydration, navigation, and communication, followed by items that provide energy, protection, and versatility. Items with limited or no utility in the lunar environment are ranked lowest.",
          "current_agent": "science"
        },
        {
          "iteration": 1,
          "current_ranking": [
            "Oxygen tanks",
            "Water",
            "Stellar map",
            "Solar-powered FM receiver-transmitter",
            "First aid kit",
            "Food concentrate",
            "50 feet of nylon rope",
            "Signal flares",
            "Parachute silk",
            "Portable heating unit",
            "Life raft",
            "Two .45 caliber pistols",
            "One case of dehydrated milk",
            "Magnetic compass",
            "Box of matches"
          ],
          "current_message": "### Refined Ranking of Lunar Survival Items for a 200-Mile Trek\n\nAs a Resource Manager, I have carefully analyzed the original ranking and adjusted it where necessary based on utility, weight, and survival priorities. The following refined ranking reflects the optimal prioritization of items for survival in the lunar environment:\n\n---\n\n#### **1. Oxygen Tanks**\n- **Justification:** Oxygen is essential for survival in the moon's vacuum. Without it, the crew cannot survive even for a few minutes. This remains the top priority.\n\n---\n\n#### **2. Water**\n- **Justification:** Hydration is critical for maintaining physical and cognitive function. Water also has secondary uses for cooling and cleaning. Its weight is justified by its necessity.\n\n---\n\n#### **3. Stellar Map**\n- **Justification:** Navigation is critical for reaching the rendezvous point. The stellar map is the only reliable tool for orienting the crew in the moon's featureless environment.\n\n---\n\n#### **4. Solar-Powered FM Receiver-Transmitter**\n- **Justification:** Communication with the mother ship or rescue teams is essential for survival. A solar-powered unit ensures reliability without dependence on batteries.\n\n---\n\n#### **5. First Aid Kit**  \n- **Justification:** Injuries or medical emergencies during the trek could incapacitate crew members. The first aid kit is essential for treating wounds, managing health, and ensuring the team can continue the journey.  \n- **Change:** Moved up from 6th to 5th because immediate health management is more critical than food in the short term.\n\n---\n\n#### **6. Food Concentrate**\n- **Justification:** Compact and lightweight, food concentrate provides the energy needed for the physical exertion of the trek. While survival without food is possible for days, energy is required for optimal performance.\n\n---\n\n#### **7. 50 Feet of Nylon Rope**\n- **Justification:** With multiple uses, including securing equipment, aiding in climbing, or creating makeshift tools, the rope is a versatile and lightweight survival tool.\n\n---\n\n#### **8. Signal Flares**\n- **Justification:** Visibility is critical in the vast lunar environment. Flares can help signal the mother ship or rescuers in emergencies.  \n- **Change:** Moved up from 9th to 8th because signaling is more essential than shelter (parachute silk) in survival.\n\n---\n\n#### **9. Parachute Silk**\n- **Justification:** Parachute silk can be used for insulation, shelter, or protection against lunar dust. It also has potential as a signaling device due to its reflective properties.\n\n---\n\n#### **10. Portable Heating Unit**\n- **Justification:** While spacesuits provide thermal regulation, a heating unit could help prevent hypothermia during the cold lunar nights or shaded areas. Its utility is situational but potentially lifesaving.\n\n---\n\n#### **11. Life Raft**\n- **Justification:** The life raft could serve as a sled for carrying equipment or injured crew members, but its utility is limited compared to other items.  \n\n---\n\n#### **12. Two .45 Caliber Pistols**\n- **Justification:** Firearms have minimal utility on the moon. They could be used to create noise or vibrations for signaling or breaking objects, but their weight and lack of direct survival value make them a low priority.\n\n---\n\n#### **13. One Case of Dehydrated Milk**\n- **Justification:** Dehydrated milk is less practical than food concentrate for immediate energy and nutrition. Its dependence on water for preparation further limits its utility.\n\n---\n\n#### **14. Magnetic Compass**\n- **Justification:** A magnetic compass is entirely useless on the moon due to the absence of a magnetic field.  \n\n---\n\n#### **15. Box of Matches**\n- **Justification:** Matches are non-functional in the vacuum of the moon, as combustion requires oxygen. They have no survival value.\n\n---\n\n### Final Refined Ranking:\n1. **Oxygen Tanks** \u2013 Essential for breathing in the vacuum.\n2. **Water** \u2013 Vital for hydration and physical function.\n3. **Stellar Map** \u2013 Critical for navigation to the rendezvous point.\n4. **Solar-Powered FM Receiver-Transmitter** \u2013 Ensures communication and potential rescue.\n5. **First Aid Kit** \u2013 Necessary for treating injuries and stabilizing health.\n6. **Food Concentrate** \u2013 Provides energy for physical exertion.\n7. **50 Feet of Nylon Rope** \u2013 Versatile tool for securing, climbing, and improvisation.\n8. **Signal Flares** \u2013 Increases visibility for rescue efforts.\n9. **Parachute Silk** \u2013 Useful for shelter, insulation, and signaling.\n10. **Portable Heating Unit** \u2013 Helps regulate temperature in extreme conditions.\n11. **Life Raft** \u2013 Can function as a sled for equipment or injured crew.\n12. **Two .45 Caliber Pistols** \u2013 Minimal utility, but possible for signaling or breaking objects.\n13. **One Case of Dehydrated Milk** \u2013 Less practical and requires water for use.\n14. **Magnetic Compass** \u2013 Useless on the moon without a magnetic field.\n15. **Box of Matches** \u2013 Non-functional in the lunar environment.\n\n---\n\n### Key Changes:\n1. **First Aid Kit** moved up to 5th due to its critical role in addressing injuries during the trek.\n2. **Signal Flares** moved up to 8th due to their importance in signaling for rescue.\n3. Other items retain their positions based on their relative utility and necessity.",
          "current_agent": "resource",
          "difference_score": 4
        }
      ],
      "final_ranking": [
        "Oxygen tanks",
        "Water",
        "Stellar map",
        "Solar-powered FM receiver-transmitter",
        "First aid kit",
        "Food concentrate",
        "50 feet of nylon rope",
        "Signal flares",
        "Parachute silk",
        "Portable heating unit",
        "Life raft",
        "Two .45 caliber pistols",
        "One case of dehydrated milk",
        "Magnetic compass",
        "Box of matches"
      ],
      "final_message": "### Refined Ranking of Lunar Survival Items for a 200-Mile Trek\n\nAs a Resource Manager, I have carefully analyzed the original ranking and adjusted it where necessary based on utility, weight, and survival priorities. The following refined ranking reflects the optimal prioritization of items for survival in the lunar environment:\n\n---\n\n#### **1. Oxygen Tanks**\n- **Justification:** Oxygen is essential for survival in the moon's vacuum. Without it, the crew cannot survive even for a few minutes. This remains the top priority.\n\n---\n\n#### **2. Water**\n- **Justification:** Hydration is critical for maintaining physical and cognitive function. Water also has secondary uses for cooling and cleaning. Its weight is justified by its necessity.\n\n---\n\n#### **3. Stellar Map**\n- **Justification:** Navigation is critical for reaching the rendezvous point. The stellar map is the only reliable tool for orienting the crew in the moon's featureless environment.\n\n---\n\n#### **4. Solar-Powered FM Receiver-Transmitter**\n- **Justification:** Communication with the mother ship or rescue teams is essential for survival. A solar-powered unit ensures reliability without dependence on batteries.\n\n---\n\n#### **5. First Aid Kit**  \n- **Justification:** Injuries or medical emergencies during the trek could incapacitate crew members. The first aid kit is essential for treating wounds, managing health, and ensuring the team can continue the journey.  \n- **Change:** Moved up from 6th to 5th because immediate health management is more critical than food in the short term.\n\n---\n\n#### **6. Food Concentrate**\n- **Justification:** Compact and lightweight, food concentrate provides the energy needed for the physical exertion of the trek. While survival without food is possible for days, energy is required for optimal performance.\n\n---\n\n#### **7. 50 Feet of Nylon Rope**\n- **Justification:** With multiple uses, including securing equipment, aiding in climbing, or creating makeshift tools, the rope is a versatile and lightweight survival tool.\n\n---\n\n#### **8. Signal Flares**\n- **Justification:** Visibility is critical in the vast lunar environment. Flares can help signal the mother ship or rescuers in emergencies.  \n- **Change:** Moved up from 9th to 8th because signaling is more essential than shelter (parachute silk) in survival.\n\n---\n\n#### **9. Parachute Silk**\n- **Justification:** Parachute silk can be used for insulation, shelter, or protection against lunar dust. It also has potential as a signaling device due to its reflective properties.\n\n---\n\n#### **10. Portable Heating Unit**\n- **Justification:** While spacesuits provide thermal regulation, a heating unit could help prevent hypothermia during the cold lunar nights or shaded areas. Its utility is situational but potentially lifesaving.\n\n---\n\n#### **11. Life Raft**\n- **Justification:** The life raft could serve as a sled for carrying equipment or injured crew members, but its utility is limited compared to other items.  \n\n---\n\n#### **12. Two .45 Caliber Pistols**\n- **Justification:** Firearms have minimal utility on the moon. They could be used to create noise or vibrations for signaling or breaking objects, but their weight and lack of direct survival value make them a low priority.\n\n---\n\n#### **13. One Case of Dehydrated Milk**\n- **Justification:** Dehydrated milk is less practical than food concentrate for immediate energy and nutrition. Its dependence on water for preparation further limits its utility.\n\n---\n\n#### **14. Magnetic Compass**\n- **Justification:** A magnetic compass is entirely useless on the moon due to the absence of a magnetic field.  \n\n---\n\n#### **15. Box of Matches**\n- **Justification:** Matches are non-functional in the vacuum of the moon, as combustion requires oxygen. They have no survival value.\n\n---\n\n### Final Refined Ranking:\n1. **Oxygen Tanks** \u2013 Essential for breathing in the vacuum.\n2. **Water** \u2013 Vital for hydration and physical function.\n3. **Stellar Map** \u2013 Critical for navigation to the rendezvous point.\n4. **Solar-Powered FM Receiver-Transmitter** \u2013 Ensures communication and potential rescue.\n5. **First Aid Kit** \u2013 Necessary for treating injuries and stabilizing health.\n6. **Food Concentrate** \u2013 Provides energy for physical exertion.\n7. **50 Feet of Nylon Rope** \u2013 Versatile tool for securing, climbing, and improvisation.\n8. **Signal Flares** \u2013 Increases visibility for rescue efforts.\n9. **Parachute Silk** \u2013 Useful for shelter, insulation, and signaling.\n10. **Portable Heating Unit** \u2013 Helps regulate temperature in extreme conditions.\n11. **Life Raft** \u2013 Can function as a sled for equipment or injured crew.\n12. **Two .45 Caliber Pistols** \u2013 Minimal utility, but possible for signaling or breaking objects.\n13. **One Case of Dehydrated Milk** \u2013 Less practical and requires water for use.\n14. **Magnetic Compass** \u2013 Useless on the moon without a magnetic field.\n15. **Box of Matches** \u2013 Non-functional in the lunar environment.\n\n---\n\n### Key Changes:\n1. **First Aid Kit** moved up to 5th due to its critical role in addressing injuries during the trek.\n2. **Signal Flares** moved up to 8th due to their importance in signaling for rescue.\n3. Other items retain their positions based on their relative utility and necessity.",
      "score": 16
    }
  ],
  "final_ranking": [
    "Oxygen tanks",
    "Water",
    "Stellar map",
    "Solar-powered FM receiver-transmitter",
    "First aid kit",
    "Food concentrate",
    "50 feet of nylon rope",
    "Signal flares",
    "Parachute silk",
    "Portable heating unit",
    "Life raft",
    "Two .45 caliber pistols",
    "One case of dehydrated milk",
    "Magnetic compass",
    "Box of matches"
  ],
  "nasa_ranking": [
    "Oxygen tanks",
    "Water",
    "Stellar map",
    "Food concentrate",
    "Solar-powered FM receiver-transmitter",
    "50 feet of nylon rope",
    "First aid kit",
    "Parachute silk",
    "Life raft",
    "Signal flares",
    "Two .45 caliber pistols",
    "One case of dehydrated milk",
    "Portable heating unit",
    "Magnetic compass",
    "Box of matches"
  ],
  "score": 16,
  "teamwork_metrics": {
    "mutual_monitoring": {
      "total_monitoring_exchanges": 0,
      "total_issues_detected": 0,
      "avg_issues_per_exchange": 0.0,
      "issue_types": {},
      "issue_resolution_rate": 0.0,
      "team_monitoring_effectiveness": "low"
    }
  }
}