{
  "simulation_id": "sim_leadership_closed_loop_mutual_monitoring_shared_mental_model_20250417_140145",
  "config": {
    "use_team_leadership": true,
    "use_closed_loop_comm": true,
    "use_mutual_monitoring": true,
    "use_shared_mental_model": true
  },
  "exchanges": [
    {
      "type": "sequential_refinement",
      "exchanges": [
        {
          "type": "initial_ranking",
          "role": "resource",
          "message": "Here is my initial ranking of the lunar survival items, based on the shared understanding of the environment and survival priorities.\n\n### **Ranking of Items**\n\n1. **Oxygen tanks**  \n   Justification: Oxygen is the number one survival priority in a vacuum environment. Without breathable air, survival is impossible, making this the most critical item.\n\n2. **Water**  \n   Justification: Fluid replacement is vital for hydration and bodily functions. On a 200-mile trek with lunar conditions, dehydration would quickly become life-threatening, especially under high radiation exposure.\n\n3. **Stellar map**  \n   Justification: Navigation is critical to reaching the rendezvous point. The lunar surface lacks landmarks, and a stellar map ensures precise orientation and direction, essential in the terrain\u2019s vast expanses.\n\n4. **Solar-powered FM receiver-transmitter**  \n   Justification: Communication with the mother ship or emergency contact is crucial for coordinating rescue efforts or providing updates on progress. Solar power ensures operability.\n\n5. **Food concentrate**  \n   Justification: Energy is required to maintain physical performance during the trek. Food concentrate provides efficient nutrition in a compact form, essential for endurance.\n\n6. **First aid kit**  \n   Justification: Injuries or illnesses are likely during the trek, given the uneven terrain and high radiation exposure. A first aid kit is critical for treating wounds and addressing emergencies.\n\n7. **Portable heating unit**  \n   Justification: Temperature regulation is a key survival priority, especially during the extreme cold of lunar shadows. The heating unit can prevent hypothermia during nighttime travel or shadowed areas.\n\n8. **Signal flares**  \n   Justification: Emergency signaling to the mother ship or other units could aid rescue or help the team communicate their position effectively from a distance.\n\n9. **50 feet of nylon rope**  \n   Justification: Useful for navigating craters or uneven terrain, securing items, or assisting in climbing. Its versatility adds to its value in challenging lunar conditions.\n\n10. **Parachute silk**  \n    Justification: Can be repurposed as shelter or shade (if in sunlight), or used for insulation against extreme temperatures. Lightweight and multi-functional.\n\n11. **Life raft**  \n    Justification: Limited utility on the lunar surface, but could be repurposed for carrying supplies or providing insulation against the ground.\n\n12. **Two .45 caliber pistols**  \n    Justification: Poor utility on the lunar surface due to lack of predators. Could potentially serve as a signaling device or as a tool for creating small craters in the terrain.\n\n13. **Magnetic compass**  \n    Justification: Ineffective on the Moon due to the lack of a global magnetic field and navigational references. Other items are better suited for guidance.\n\n14. **One case of dehydrated milk**  \n    Justification: Provides nutrition but is bulky and less efficient than food concentrate. Water supply would also be needed to reconstitute it, which risks wasting precious fluids.\n\n15. **Box of matches**  \n    Justification: Completely unusable in the vacuum environment and absence of oxygen. No feasible survival utility on the lunar surface.\n\n### **Summary**\nThis ranking prioritizes survival essentials such as oxygen, water, navigation, temperature regulation, and emergency communication, followed by secondary items that offer situationally useful functions. The last few items have either negligible or no utility, given the lunar environment and mission goals.\n\nTeam members, please confirm receipt of this ranking and indicate if clarification is required or additional perspectives should be considered. I will verify and ensure changes are understood and consensus is built.",
          "ranking": [
            "Oxygen tanks",
            "Water",
            "Stellar map",
            "Solar-powered FM receiver-transmitter",
            "Food concentrate",
            "First aid kit",
            "Portable heating unit",
            "Signal flares",
            "50 feet of nylon rope",
            "Parachute silk",
            "Life raft",
            "Two .45 caliber pistols",
            "Magnetic compass",
            "One case of dehydrated milk",
            "Box of matches"
          ]
        },
        {
          "type": "refinement",
          "iteration": 1,
          "role": "science",
          "message": "### **Refined Lunar Survival Item Ranking**\n\nUsing my specialized knowledge as a Science Analyst, I have refined the ranking of the survival items. Where I agree with the current ranking, I acknowledge it. Where I suggest changes, I provide detailed justifications informed by the lunar environment and survival priorities.\n\n---\n\n#### **Refined Ranking**\n---\n\n### **Top-tier essentials (Critical for survival and meeting mission goals)**  \n\n1. **Oxygen tanks**  \n   **Agreed position**: Oxygen remains the highest priority since survival on the Moon without an atmosphere depends on a constant supply of breathable air.\n\n2. **Water**  \n   **Agreed position**: Hydration is essential for human survival, especially given dehydration risks heightened by lunar radiation and exertion during the trek.\n\n3. **Stellar map**  \n   **Agreed position**: Navigation to the rendezvous point is crucial on the featureless lunar surface. The stellar map provides positional awareness and direction orientation, critical for reaching the mother ship.\n\n4. **Solar-powered FM receiver-transmitter**  \n   **Agreed position**: Communication is vital for coordinating rescue efforts and providing status updates during the journey. Its solar-powered capability ensures operation throughout the trek.\n\n5. **Portable heating unit**  \n   **Moved up from position 7 to position 5**  \n   **Reasoning**: Temperature regulation is a higher priority than food concentrate. The extreme cold of lunar shadows can quickly lead to hypothermia, which would incapacitate the crew. The heating unit ensures survival during nighttime or shadowed travel, directly addressing an immediate environmental threat.\n\n6. **Food concentrate**  \n   **Moved down from position 5 to position 6**  \n   **Reasoning**: While necessary for energy, food is secondary to survival threats posed by extreme cold. The crew can survive longer without food than they can in hypothermic conditions.\n\n---\n\n### **Secondary essentials (Support survival in unpredictable or less immediate ways)**  \n\n7. **First aid kit**  \n   **Agreed position**: Treating injuries and medical emergencies is essential\u2014especially given the high probability of accidents on uneven terrain. This ranking reflects its importance but subordinates it to immediate physical survival priorities.\n\n8. **Signal flares**  \n   **Agreed position**: Flares are important for visual signaling to guide rescue or pinpoint the crew's location in emergencies. Their utility is situational but valuable.\n\n9. **50 feet of nylon rope**  \n   **Agreed position**: Versatile for climbing, assisting across craters, securing items, or navigating uneven terrain. Its adaptability makes it useful.\n\n10. **Parachute silk**  \n   **Moved up from position 12 to position 10**  \n   **Reasoning**: Parachute silk can serve as insulation against the lunar ground (which is at extreme temperatures) or for creating shade against sunlight during rest stops. Its multifaceted applications boost its priority compared to items of lesser situational utility.\n\n---\n\n### **Low-tier items (Marginal or repurposable utility)**  \n\n11. **Life raft**  \n   **Agreed position**: While limited in its original function, a life raft can provide insulation against the lunar ground or carry supplies. Secondary utility lifts it slightly above other minimally useful items.\n\n12. **Two .45 caliber pistols**  \n   **Moved up from position 14 to position 12**  \n   **Reasoning**: Although firearms are ineffective for protection against threats on the Moon, their potential use for seismic signaling (e.g., firing into the ground to indicate your position via vibrations) gives them marginal utility.\n\n13. **One case of dehydrated milk**  \n   **Agreed position**: Provides nutrition but is bulky and less practical than food concentrate. Water is required to reconstitute it, making it less efficient in resource usage.\n\n14. **Magnetic compass**  \n   **Agreed position**: Completely ineffective on the Moon due to the lack of a global magnetic field. The stellar map is far superior for navigation.\n\n15. **Box of matches**  \n   **Agreed position**: Absolutely unusable in a vacuum environment, where there is no oxygen to sustain combustion. Completely impractical for lunar survival.\n\n---\n\n### **Refined Summary**\nThis ranking prioritizes immediate survival essentials like oxygen, water, navigation, temperature regulation, and communication, followed by secondary items useful for health and emergency scenarios. Lower-tier items are assessed for marginal or repurposable utility. Each decision is guided by the lunar environment's extreme conditions and the crew's need to successfully survive and complete the 200-mile trek.\n\nTeam members, please confirm receipt of this refined ranking. If clarification is required for any changes, let me know. I will verify understanding and synchronize team agreement on this refined list.",
          "ranking": [
            "Oxygen tanks",
            "Water",
            "Stellar map",
            "Solar-powered FM receiver-transmitter",
            "Portable heating unit",
            "Food concentrate",
            "First aid kit",
            "Signal flares",
            "50 feet of nylon rope",
            "Parachute silk",
            "Life raft",
            "Two .45 caliber pistols",
            "One case of dehydrated milk",
            "Magnetic compass",
            "Box of matches"
          ]
        }
      ],
      "iterations": [
        {
          "iteration": 0,
          "current_ranking": [
            "Oxygen tanks",
            "Water",
            "Stellar map",
            "Solar-powered FM receiver-transmitter",
            "Food concentrate",
            "First aid kit",
            "Portable heating unit",
            "Signal flares",
            "50 feet of nylon rope",
            "Parachute silk",
            "Life raft",
            "Two .45 caliber pistols",
            "Magnetic compass",
            "One case of dehydrated milk",
            "Box of matches"
          ],
          "current_message": "Here is my initial ranking of the lunar survival items, based on the shared understanding of the environment and survival priorities.\n\n### **Ranking of Items**\n\n1. **Oxygen tanks**  \n   Justification: Oxygen is the number one survival priority in a vacuum environment. Without breathable air, survival is impossible, making this the most critical item.\n\n2. **Water**  \n   Justification: Fluid replacement is vital for hydration and bodily functions. On a 200-mile trek with lunar conditions, dehydration would quickly become life-threatening, especially under high radiation exposure.\n\n3. **Stellar map**  \n   Justification: Navigation is critical to reaching the rendezvous point. The lunar surface lacks landmarks, and a stellar map ensures precise orientation and direction, essential in the terrain\u2019s vast expanses.\n\n4. **Solar-powered FM receiver-transmitter**  \n   Justification: Communication with the mother ship or emergency contact is crucial for coordinating rescue efforts or providing updates on progress. Solar power ensures operability.\n\n5. **Food concentrate**  \n   Justification: Energy is required to maintain physical performance during the trek. Food concentrate provides efficient nutrition in a compact form, essential for endurance.\n\n6. **First aid kit**  \n   Justification: Injuries or illnesses are likely during the trek, given the uneven terrain and high radiation exposure. A first aid kit is critical for treating wounds and addressing emergencies.\n\n7. **Portable heating unit**  \n   Justification: Temperature regulation is a key survival priority, especially during the extreme cold of lunar shadows. The heating unit can prevent hypothermia during nighttime travel or shadowed areas.\n\n8. **Signal flares**  \n   Justification: Emergency signaling to the mother ship or other units could aid rescue or help the team communicate their position effectively from a distance.\n\n9. **50 feet of nylon rope**  \n   Justification: Useful for navigating craters or uneven terrain, securing items, or assisting in climbing. Its versatility adds to its value in challenging lunar conditions.\n\n10. **Parachute silk**  \n    Justification: Can be repurposed as shelter or shade (if in sunlight), or used for insulation against extreme temperatures. Lightweight and multi-functional.\n\n11. **Life raft**  \n    Justification: Limited utility on the lunar surface, but could be repurposed for carrying supplies or providing insulation against the ground.\n\n12. **Two .45 caliber pistols**  \n    Justification: Poor utility on the lunar surface due to lack of predators. Could potentially serve as a signaling device or as a tool for creating small craters in the terrain.\n\n13. **Magnetic compass**  \n    Justification: Ineffective on the Moon due to the lack of a global magnetic field and navigational references. Other items are better suited for guidance.\n\n14. **One case of dehydrated milk**  \n    Justification: Provides nutrition but is bulky and less efficient than food concentrate. Water supply would also be needed to reconstitute it, which risks wasting precious fluids.\n\n15. **Box of matches**  \n    Justification: Completely unusable in the vacuum environment and absence of oxygen. No feasible survival utility on the lunar surface.\n\n### **Summary**\nThis ranking prioritizes survival essentials such as oxygen, water, navigation, temperature regulation, and emergency communication, followed by secondary items that offer situationally useful functions. The last few items have either negligible or no utility, given the lunar environment and mission goals.\n\nTeam members, please confirm receipt of this ranking and indicate if clarification is required or additional perspectives should be considered. I will verify and ensure changes are understood and consensus is built.",
          "current_agent": "resource"
        },
        {
          "iteration": 1,
          "current_ranking": [
            "Oxygen tanks",
            "Water",
            "Stellar map",
            "Solar-powered FM receiver-transmitter",
            "Portable heating unit",
            "Food concentrate",
            "First aid kit",
            "Signal flares",
            "50 feet of nylon rope",
            "Parachute silk",
            "Life raft",
            "Two .45 caliber pistols",
            "One case of dehydrated milk",
            "Magnetic compass",
            "Box of matches"
          ],
          "current_message": "### **Refined Lunar Survival Item Ranking**\n\nUsing my specialized knowledge as a Science Analyst, I have refined the ranking of the survival items. Where I agree with the current ranking, I acknowledge it. Where I suggest changes, I provide detailed justifications informed by the lunar environment and survival priorities.\n\n---\n\n#### **Refined Ranking**\n---\n\n### **Top-tier essentials (Critical for survival and meeting mission goals)**  \n\n1. **Oxygen tanks**  \n   **Agreed position**: Oxygen remains the highest priority since survival on the Moon without an atmosphere depends on a constant supply of breathable air.\n\n2. **Water**  \n   **Agreed position**: Hydration is essential for human survival, especially given dehydration risks heightened by lunar radiation and exertion during the trek.\n\n3. **Stellar map**  \n   **Agreed position**: Navigation to the rendezvous point is crucial on the featureless lunar surface. The stellar map provides positional awareness and direction orientation, critical for reaching the mother ship.\n\n4. **Solar-powered FM receiver-transmitter**  \n   **Agreed position**: Communication is vital for coordinating rescue efforts and providing status updates during the journey. Its solar-powered capability ensures operation throughout the trek.\n\n5. **Portable heating unit**  \n   **Moved up from position 7 to position 5**  \n   **Reasoning**: Temperature regulation is a higher priority than food concentrate. The extreme cold of lunar shadows can quickly lead to hypothermia, which would incapacitate the crew. The heating unit ensures survival during nighttime or shadowed travel, directly addressing an immediate environmental threat.\n\n6. **Food concentrate**  \n   **Moved down from position 5 to position 6**  \n   **Reasoning**: While necessary for energy, food is secondary to survival threats posed by extreme cold. The crew can survive longer without food than they can in hypothermic conditions.\n\n---\n\n### **Secondary essentials (Support survival in unpredictable or less immediate ways)**  \n\n7. **First aid kit**  \n   **Agreed position**: Treating injuries and medical emergencies is essential\u2014especially given the high probability of accidents on uneven terrain. This ranking reflects its importance but subordinates it to immediate physical survival priorities.\n\n8. **Signal flares**  \n   **Agreed position**: Flares are important for visual signaling to guide rescue or pinpoint the crew's location in emergencies. Their utility is situational but valuable.\n\n9. **50 feet of nylon rope**  \n   **Agreed position**: Versatile for climbing, assisting across craters, securing items, or navigating uneven terrain. Its adaptability makes it useful.\n\n10. **Parachute silk**  \n   **Moved up from position 12 to position 10**  \n   **Reasoning**: Parachute silk can serve as insulation against the lunar ground (which is at extreme temperatures) or for creating shade against sunlight during rest stops. Its multifaceted applications boost its priority compared to items of lesser situational utility.\n\n---\n\n### **Low-tier items (Marginal or repurposable utility)**  \n\n11. **Life raft**  \n   **Agreed position**: While limited in its original function, a life raft can provide insulation against the lunar ground or carry supplies. Secondary utility lifts it slightly above other minimally useful items.\n\n12. **Two .45 caliber pistols**  \n   **Moved up from position 14 to position 12**  \n   **Reasoning**: Although firearms are ineffective for protection against threats on the Moon, their potential use for seismic signaling (e.g., firing into the ground to indicate your position via vibrations) gives them marginal utility.\n\n13. **One case of dehydrated milk**  \n   **Agreed position**: Provides nutrition but is bulky and less practical than food concentrate. Water is required to reconstitute it, making it less efficient in resource usage.\n\n14. **Magnetic compass**  \n   **Agreed position**: Completely ineffective on the Moon due to the lack of a global magnetic field. The stellar map is far superior for navigation.\n\n15. **Box of matches**  \n   **Agreed position**: Absolutely unusable in a vacuum environment, where there is no oxygen to sustain combustion. Completely impractical for lunar survival.\n\n---\n\n### **Refined Summary**\nThis ranking prioritizes immediate survival essentials like oxygen, water, navigation, temperature regulation, and communication, followed by secondary items useful for health and emergency scenarios. Lower-tier items are assessed for marginal or repurposable utility. Each decision is guided by the lunar environment's extreme conditions and the crew's need to successfully survive and complete the 200-mile trek.\n\nTeam members, please confirm receipt of this refined ranking. If clarification is required for any changes, let me know. I will verify understanding and synchronize team agreement on this refined list.",
          "current_agent": "science",
          "difference_score": 6
        }
      ],
      "final_ranking": [
        "Oxygen tanks",
        "Water",
        "Stellar map",
        "Solar-powered FM receiver-transmitter",
        "Portable heating unit",
        "Food concentrate",
        "First aid kit",
        "Signal flares",
        "50 feet of nylon rope",
        "Parachute silk",
        "Life raft",
        "Two .45 caliber pistols",
        "One case of dehydrated milk",
        "Magnetic compass",
        "Box of matches"
      ],
      "final_message": "### **Refined Lunar Survival Item Ranking**\n\nUsing my specialized knowledge as a Science Analyst, I have refined the ranking of the survival items. Where I agree with the current ranking, I acknowledge it. Where I suggest changes, I provide detailed justifications informed by the lunar environment and survival priorities.\n\n---\n\n#### **Refined Ranking**\n---\n\n### **Top-tier essentials (Critical for survival and meeting mission goals)**  \n\n1. **Oxygen tanks**  \n   **Agreed position**: Oxygen remains the highest priority since survival on the Moon without an atmosphere depends on a constant supply of breathable air.\n\n2. **Water**  \n   **Agreed position**: Hydration is essential for human survival, especially given dehydration risks heightened by lunar radiation and exertion during the trek.\n\n3. **Stellar map**  \n   **Agreed position**: Navigation to the rendezvous point is crucial on the featureless lunar surface. The stellar map provides positional awareness and direction orientation, critical for reaching the mother ship.\n\n4. **Solar-powered FM receiver-transmitter**  \n   **Agreed position**: Communication is vital for coordinating rescue efforts and providing status updates during the journey. Its solar-powered capability ensures operation throughout the trek.\n\n5. **Portable heating unit**  \n   **Moved up from position 7 to position 5**  \n   **Reasoning**: Temperature regulation is a higher priority than food concentrate. The extreme cold of lunar shadows can quickly lead to hypothermia, which would incapacitate the crew. The heating unit ensures survival during nighttime or shadowed travel, directly addressing an immediate environmental threat.\n\n6. **Food concentrate**  \n   **Moved down from position 5 to position 6**  \n   **Reasoning**: While necessary for energy, food is secondary to survival threats posed by extreme cold. The crew can survive longer without food than they can in hypothermic conditions.\n\n---\n\n### **Secondary essentials (Support survival in unpredictable or less immediate ways)**  \n\n7. **First aid kit**  \n   **Agreed position**: Treating injuries and medical emergencies is essential\u2014especially given the high probability of accidents on uneven terrain. This ranking reflects its importance but subordinates it to immediate physical survival priorities.\n\n8. **Signal flares**  \n   **Agreed position**: Flares are important for visual signaling to guide rescue or pinpoint the crew's location in emergencies. Their utility is situational but valuable.\n\n9. **50 feet of nylon rope**  \n   **Agreed position**: Versatile for climbing, assisting across craters, securing items, or navigating uneven terrain. Its adaptability makes it useful.\n\n10. **Parachute silk**  \n   **Moved up from position 12 to position 10**  \n   **Reasoning**: Parachute silk can serve as insulation against the lunar ground (which is at extreme temperatures) or for creating shade against sunlight during rest stops. Its multifaceted applications boost its priority compared to items of lesser situational utility.\n\n---\n\n### **Low-tier items (Marginal or repurposable utility)**  \n\n11. **Life raft**  \n   **Agreed position**: While limited in its original function, a life raft can provide insulation against the lunar ground or carry supplies. Secondary utility lifts it slightly above other minimally useful items.\n\n12. **Two .45 caliber pistols**  \n   **Moved up from position 14 to position 12**  \n   **Reasoning**: Although firearms are ineffective for protection against threats on the Moon, their potential use for seismic signaling (e.g., firing into the ground to indicate your position via vibrations) gives them marginal utility.\n\n13. **One case of dehydrated milk**  \n   **Agreed position**: Provides nutrition but is bulky and less practical than food concentrate. Water is required to reconstitute it, making it less efficient in resource usage.\n\n14. **Magnetic compass**  \n   **Agreed position**: Completely ineffective on the Moon due to the lack of a global magnetic field. The stellar map is far superior for navigation.\n\n15. **Box of matches**  \n   **Agreed position**: Absolutely unusable in a vacuum environment, where there is no oxygen to sustain combustion. Completely impractical for lunar survival.\n\n---\n\n### **Refined Summary**\nThis ranking prioritizes immediate survival essentials like oxygen, water, navigation, temperature regulation, and communication, followed by secondary items useful for health and emergency scenarios. Lower-tier items are assessed for marginal or repurposable utility. Each decision is guided by the lunar environment's extreme conditions and the crew's need to successfully survive and complete the 200-mile trek.\n\nTeam members, please confirm receipt of this refined ranking. If clarification is required for any changes, let me know. I will verify understanding and synchronize team agreement on this refined list.",
      "score": 22
    }
  ],
  "final_ranking": [
    "Oxygen tanks",
    "Water",
    "Stellar map",
    "Solar-powered FM receiver-transmitter",
    "Portable heating unit",
    "Food concentrate",
    "First aid kit",
    "Signal flares",
    "50 feet of nylon rope",
    "Parachute silk",
    "Life raft",
    "Two .45 caliber pistols",
    "One case of dehydrated milk",
    "Magnetic compass",
    "Box of matches"
  ],
  "nasa_ranking": [
    "Oxygen tanks",
    "Water",
    "Stellar map",
    "Food concentrate",
    "Solar-powered FM receiver-transmitter",
    "50 feet of nylon rope",
    "First aid kit",
    "Parachute silk",
    "Life raft",
    "Signal flares",
    "Two .45 caliber pistols",
    "One case of dehydrated milk",
    "Portable heating unit",
    "Magnetic compass",
    "Box of matches"
  ],
  "score": 22,
  "teamwork_metrics": {
    "mutual_monitoring": {
      "total_monitoring_exchanges": 0,
      "total_issues_detected": 0,
      "avg_issues_per_exchange": 0.0,
      "issue_types": {},
      "issue_resolution_rate": 0.0,
      "team_monitoring_effectiveness": "low"
    },
    "shared_mental_model": {
      "convergence_trend": "unknown",
      "final_convergence": 0.6666666666666666,
      "understanding_completeness": {
        "resource": 0.5222222222222223,
        "science": 0.6055555555555555
      },
      "avg_completeness": 0.5638888888888889,
      "effectiveness_rating": "medium"
    }
  }
}