{
  "simulation_id": "sim_mutual_monitoring_20250417_131146",
  "config": {
    "use_team_leadership": false,
    "use_closed_loop_comm": false,
    "use_mutual_monitoring": true,
    "use_shared_mental_model": false
  },
  "exchanges": [
    {
      "type": "sequential_refinement",
      "exchanges": [
        {
          "type": "initial_ranking",
          "role": "science",
          "message": "To ensure the crew's survival during the 200-mile trek across the moon's harsh environment, items must be ranked based on their necessity and utility in addressing the challenges of lunar conditions. These include the lack of an atmosphere, extreme temperature variations, increased radiation exposure, and reduced gravity. Here's the initial ranking:\n\n---\n\n### **1. Oxygen tanks**\n- Justification: The Moon has no breathable atmosphere, making oxygen the most critical item for survival. Without oxygen, survival time is measured in minutes. It is necessary for every step of the journey.\n\n---\n\n### **2. Water**\n- Justification: Although the Moon's lower gravity reduces exertion compared to Earth, astronauts still require hydration to maintain proper bodily function. Dehydration can impair cognitive function and physical performance, both of which are vital for survival and navigation.\n\n---\n\n### **3. Solar-powered FM receiver-transmitter**\n- Justification: Communication with the mother ship is crucial for navigation assistance and potential rescue efforts. This item is a lifeline to the mission control or mother ship for updates on the rendezvous and emergencies.\n\n---\n\n### **4. Stellar map**\n- Justification: Effective navigation is essential for traversing the Moon's barren, featureless landscape. A stellar map allows astronauts to orient themselves using constellations, as compasses are useless on the Moon due to the lack of a magnetic field.\n\n---\n\n### **5. Food concentrate**\n- Justification: Food supplies must be compact and efficient, as the physical exertion caused by the trek will deplete energy reserves. Food concentrate is lightweight and energy-dense, making it critical for maintaining strength and stamina.\n\n---\n\n### **6. Portable heating unit**\n- Justification: The Moon's temperatures fluctuate between extreme cold and heat. A heating unit is crucial to surviving the freezing lunar night (as low as -280\u00b0F) and keeping equipment functioning properly. Since the trek may take several days, temperature control is crucial.\n\n---\n\n### **7. First aid kit**\n- Justification: Injuries or medical issues may arise during the trek, and a first aid kit will be necessary for treating wounds or other health concerns. This ensures that minor medical problems do not escalate into life-threatening situations.\n\n---\n\n### **8. Parachute silk**\n- Justification: Parachute silk can be used for multiple purposes, including as a sunshade to prevent overheating, as insulation during cold periods, or as an emergency repair material for spacesuit tears.\n\n---\n\n### **9. 50 feet of nylon rope**\n- Justification: Rope has a variety of potential uses, from securing equipment to aiding in traversing rough terrain (e.g., craters or slopes). It could also help in emergency situations requiring makeshift solutions.\n\n---\n\n### **10. Signal flares**\n- Justification: Signal flares could be used to attract the attention of rescuers or the mother ship during periods of proximity. However, their utility on the Moon might be limited by the lack of an atmosphere to propagate light or color effectively over long distances.\n\n---\n\n### **11. Two .45 caliber pistols**\n- Justification: While the pistols may seem unnecessary, they could serve as a tool for propulsion in microgravity (if used in an emergency) or for breaking or moving objects. However, these are secondary uses, and their importance is limited.\n\n---\n\n### **12. Life raft**\n- Justification: A life raft is of minimal use on the Moon, where there are no bodies of water. It could provide insulation or be repurposed to carry equipment, but it is otherwise largely a redundant item.\n\n---\n\n### **13. One case of dehydrated milk**\n- Justification: Dehydrated milk provides nutritional value and hydration when reconstituted. However, its bulk and lesser energy density compared to food concentrate make it less important. Water is needed to rehydrate it, which makes it impractical compared to more direct hydration sources.\n\n---\n\n### **14. Magnetic compass**\n- Justification: A compass is useless on the Moon, as there is no global magnetic field to provide orientation. It has no practical application in this environment.\n\n---\n\n### **15. Box of matches**\n- Justification: Fire requires oxygen and an atmosphere to burn, both of which are absent on the Moon. Matches are entirely unusable and serve no survival purpose.\n\n---\n\n### Final Notes:\nThe items were ranked based on how well they address the critical challenges of the lunar environment: lack of breathable air, temperature extremes, hydration and nutrition, navigation, and utility in emergencies. Each item's practicality and relevance to immediate survival were prioritized.",
          "ranking": [
            "Oxygen tanks",
            "Water",
            "Solar-powered FM receiver-transmitter",
            "Stellar map",
            "Food concentrate",
            "Portable heating unit",
            "First aid kit",
            "Parachute silk",
            "50 feet of nylon rope",
            "Signal flares",
            "Two .45 caliber pistols",
            "Life raft",
            "One case of dehydrated milk",
            "Magnetic compass",
            "Box of matches"
          ]
        },
        {
          "type": "refinement",
          "iteration": 1,
          "role": "resource",
          "message": "### Refined Ranking of Lunar Survival Items\n\nAs a Resource Manager, my decisions prioritize utility against weight, survival relevance, and adaptability in critical situations. The following refined ranking adjusts positions based on an in-depth analysis of the lunar environment\u2019s challenges and optimal use of resources.\n\n---\n\n### **1. Oxygen tanks**\n- **Reasoning:** The Moon has no atmosphere, making oxygen absolutely essential. Without oxygen, survival is impossible. This remains the top priority.\n- **Current Position Match:** Agree with original ranking.\n\n---\n\n### **2. Water**\n- **Reasoning:** Hydration is crucial for physiological and cognitive functions, especially on a strenuous 200-mile trek. Water is essential and irreplaceable due to physiological deterioration caused by dehydration.\n- **Current Position Match:** Agree with original ranking.\n\n---\n\n### **3. Solar-powered FM receiver-transmitter**\n- **Reasoning:** Communication ensures navigation accuracy and emergency interaction with the mother ship. It is also critical for potential rescue if the crew becomes lost or incapacitated.\n- **Current Position Match:** Agree with original ranking.\n\n---\n\n### **4. Food concentrate**\n- **Reasoning:** I moved this item up from #5 to #4 because energy required for a prolonged trek cannot be ignored. Maintaining calorie intake is essential for sustaining stamina and preventing fatigue. Its compact form optimizes weight/utility efficiency.\n- **Change Justification:** Energy and caloric intake are more critical than navigation tools for surviving a several-day journey when physical exertion is high.\n\n---\n\n### **5. Stellar map**\n- **Reasoning:** While navigation is critical, the Moon\u2019s barren surface provides minimal landmarks, making celestial navigation essential. However, if energy (via food) runs out, navigation becomes irrelevant. Thus, it is slightly less vital compared to immediate sustenance sources.\n- **Change Justification:** Slightly deprioritized due to navigation being secondary if survival basics fail.\n\n---\n\n### **6. Portable heating unit**\n- **Reasoning:** Temperature extremes (e.g., -280\u00b0F lunar night) can jeopardize survival. Heating equipment is required to protect the crew and equipment from damage. While crucial, heat management becomes secondary to immediate survival needs like oxygen, hydration, and food.\n- **Current Position Match:** Agree with original ranking.\n\n---\n\n### **7. First aid kit**\n- **Reasoning:** Injury or illness could be life-threatening without basic medical care during the trek. However, survival provisions (oxygen, water, food, communication) take precedence over treating injuries.\n- **Current Position Match:** Agree with original ranking.\n\n---\n\n### **8. 50 feet of nylon rope**\n- **Reasoning:** Rope offers versatile utility for traversing craters, securing payloads, or improvising repairs. It gains importance over parachute silk due to its durability and wide-ranging applications.\n- **Change Justification:** Elevated above parachute silk (#9) due to its more significant role in practical survival scenarios.\n\n---\n\n### **9. Parachute silk**\n- **Reasoning:** Parachute silk has some utility for insulation during lunar cold, shading against direct sunlight, or emergency suit repair, but its applications are limited compared to rope.\n- **Current Position Match:** Agree with original ranking after switching it below rope.\n\n---\n\n### **10. Signal flares**\n- **Reasoning:** While potentially useful for signaling, the Moon\u2019s lack of an atmosphere diminishes their effectiveness in long-range visibility. They are less critical than items with broader or survival-necessary applications.\n- **Current Position Match:** Agree with original ranking.\n\n---\n\n### **11. Two .45 caliber pistols**\n- **Reasoning:** While firearms could theoretically be used for propulsion in microgravity or smashing objects, their utility is situational and limited compared to survival-first items.\n- **Current Position Match:** Agree with original ranking.\n\n---\n\n### **12. Life raft**\n- **Reasoning:** A life raft has no core functionality on the Moon. It may serve as insulation or equipment transport, but other items fulfill these roles better. This remains a redundant item.\n- **Current Position Match:** Agree with original ranking.\n\n---\n\n### **13. One case of dehydrated milk**\n- **Reasoning:** Rehydrating milk adds complexity due to limited water supplies. While it contains nutrients, its bulk and hydration inefficiency make it impractical compared to food concentrate. It is deprioritized.\n- **Current Position Match:** Agree with original ranking.\n\n---\n\n### **14. Magnetic compass**\n- **Reasoning:** The Moon\u2019s lack of a magnetic field renders a compass entirely useless. This item has no practical application in navigation.\n- **Current Position Match:** Agree with original ranking.\n\n---\n\n### **15. Box of matches**\n- **Reasoning:** Combustion requires oxygen and an atmosphere, which are absent on the Moon. Matches are absolutely unusable and should be ranked last.\n- **Current Position Match:** Agree with original ranking.\n\n---\n\n### Final Refined Ranking\n1. **Oxygen tanks** \u2013 Essential for breathing.\n2. **Water** \u2013 Critical for hydration and survival.\n3. **Solar-powered FM receiver-transmitter** \u2013 Vital for communication and navigation aid.\n4. **Food concentrate** \u2013 Compact source of energy for survival and strength.\n5. **Stellar map** \u2013 Necessary for navigation but requires energy to execute.\n6. **Portable heating unit** \u2013 Important for surviving temperature extremes.\n7. **First aid kit** \u2013 Needed to manage injuries and avoid complications.\n8. **50 feet of nylon rope** \u2013 Versatile tool for securing, traversing, and repairing.\n9. **Parachute silk** \u2013 Useful for insulation and emergency repairs but limited.\n10. **Signal flares** \u2013 Utility diminished by lack of atmosphere, but still useful for signaling.\n11. **Two .45 caliber pistols** \u2013 Limited potential survival utility.\n12. **Life raft** \u2013 Redundant on the Moon, with minor insulation or transport use.\n13. **One case of dehydrated milk** \u2013 Inefficient hydration source and less practical than food concentrate.\n14. **Magnetic compass** \u2013 Completely useless on the Moon.\n15. **Box of matches** \u2013 An unusable item in the lunar environment.\n\nThis refined ranking optimizes priorities for survival during the 200-mile lunar trek.",
          "ranking": [
            "Oxygen tanks",
            "Water",
            "Solar-powered FM receiver-transmitter",
            "Food concentrate",
            "Stellar map",
            "Portable heating unit",
            "First aid kit",
            "50 feet of nylon rope",
            "Parachute silk",
            "Signal flares",
            "Two .45 caliber pistols",
            "Life raft",
            "One case of dehydrated milk",
            "Magnetic compass",
            "Box of matches"
          ]
        }
      ],
      "iterations": [
        {
          "iteration": 0,
          "current_ranking": [
            "Oxygen tanks",
            "Water",
            "Solar-powered FM receiver-transmitter",
            "Stellar map",
            "Food concentrate",
            "Portable heating unit",
            "First aid kit",
            "Parachute silk",
            "50 feet of nylon rope",
            "Signal flares",
            "Two .45 caliber pistols",
            "Life raft",
            "One case of dehydrated milk",
            "Magnetic compass",
            "Box of matches"
          ],
          "current_message": "To ensure the crew's survival during the 200-mile trek across the moon's harsh environment, items must be ranked based on their necessity and utility in addressing the challenges of lunar conditions. These include the lack of an atmosphere, extreme temperature variations, increased radiation exposure, and reduced gravity. Here's the initial ranking:\n\n---\n\n### **1. Oxygen tanks**\n- Justification: The Moon has no breathable atmosphere, making oxygen the most critical item for survival. Without oxygen, survival time is measured in minutes. It is necessary for every step of the journey.\n\n---\n\n### **2. Water**\n- Justification: Although the Moon's lower gravity reduces exertion compared to Earth, astronauts still require hydration to maintain proper bodily function. Dehydration can impair cognitive function and physical performance, both of which are vital for survival and navigation.\n\n---\n\n### **3. Solar-powered FM receiver-transmitter**\n- Justification: Communication with the mother ship is crucial for navigation assistance and potential rescue efforts. This item is a lifeline to the mission control or mother ship for updates on the rendezvous and emergencies.\n\n---\n\n### **4. Stellar map**\n- Justification: Effective navigation is essential for traversing the Moon's barren, featureless landscape. A stellar map allows astronauts to orient themselves using constellations, as compasses are useless on the Moon due to the lack of a magnetic field.\n\n---\n\n### **5. Food concentrate**\n- Justification: Food supplies must be compact and efficient, as the physical exertion caused by the trek will deplete energy reserves. Food concentrate is lightweight and energy-dense, making it critical for maintaining strength and stamina.\n\n---\n\n### **6. Portable heating unit**\n- Justification: The Moon's temperatures fluctuate between extreme cold and heat. A heating unit is crucial to surviving the freezing lunar night (as low as -280\u00b0F) and keeping equipment functioning properly. Since the trek may take several days, temperature control is crucial.\n\n---\n\n### **7. First aid kit**\n- Justification: Injuries or medical issues may arise during the trek, and a first aid kit will be necessary for treating wounds or other health concerns. This ensures that minor medical problems do not escalate into life-threatening situations.\n\n---\n\n### **8. Parachute silk**\n- Justification: Parachute silk can be used for multiple purposes, including as a sunshade to prevent overheating, as insulation during cold periods, or as an emergency repair material for spacesuit tears.\n\n---\n\n### **9. 50 feet of nylon rope**\n- Justification: Rope has a variety of potential uses, from securing equipment to aiding in traversing rough terrain (e.g., craters or slopes). It could also help in emergency situations requiring makeshift solutions.\n\n---\n\n### **10. Signal flares**\n- Justification: Signal flares could be used to attract the attention of rescuers or the mother ship during periods of proximity. However, their utility on the Moon might be limited by the lack of an atmosphere to propagate light or color effectively over long distances.\n\n---\n\n### **11. Two .45 caliber pistols**\n- Justification: While the pistols may seem unnecessary, they could serve as a tool for propulsion in microgravity (if used in an emergency) or for breaking or moving objects. However, these are secondary uses, and their importance is limited.\n\n---\n\n### **12. Life raft**\n- Justification: A life raft is of minimal use on the Moon, where there are no bodies of water. It could provide insulation or be repurposed to carry equipment, but it is otherwise largely a redundant item.\n\n---\n\n### **13. One case of dehydrated milk**\n- Justification: Dehydrated milk provides nutritional value and hydration when reconstituted. However, its bulk and lesser energy density compared to food concentrate make it less important. Water is needed to rehydrate it, which makes it impractical compared to more direct hydration sources.\n\n---\n\n### **14. Magnetic compass**\n- Justification: A compass is useless on the Moon, as there is no global magnetic field to provide orientation. It has no practical application in this environment.\n\n---\n\n### **15. Box of matches**\n- Justification: Fire requires oxygen and an atmosphere to burn, both of which are absent on the Moon. Matches are entirely unusable and serve no survival purpose.\n\n---\n\n### Final Notes:\nThe items were ranked based on how well they address the critical challenges of the lunar environment: lack of breathable air, temperature extremes, hydration and nutrition, navigation, and utility in emergencies. Each item's practicality and relevance to immediate survival were prioritized.",
          "current_agent": "science"
        },
        {
          "iteration": 1,
          "current_ranking": [
            "Oxygen tanks",
            "Water",
            "Solar-powered FM receiver-transmitter",
            "Food concentrate",
            "Stellar map",
            "Portable heating unit",
            "First aid kit",
            "50 feet of nylon rope",
            "Parachute silk",
            "Signal flares",
            "Two .45 caliber pistols",
            "Life raft",
            "One case of dehydrated milk",
            "Magnetic compass",
            "Box of matches"
          ],
          "current_message": "### Refined Ranking of Lunar Survival Items\n\nAs a Resource Manager, my decisions prioritize utility against weight, survival relevance, and adaptability in critical situations. The following refined ranking adjusts positions based on an in-depth analysis of the lunar environment\u2019s challenges and optimal use of resources.\n\n---\n\n### **1. Oxygen tanks**\n- **Reasoning:** The Moon has no atmosphere, making oxygen absolutely essential. Without oxygen, survival is impossible. This remains the top priority.\n- **Current Position Match:** Agree with original ranking.\n\n---\n\n### **2. Water**\n- **Reasoning:** Hydration is crucial for physiological and cognitive functions, especially on a strenuous 200-mile trek. Water is essential and irreplaceable due to physiological deterioration caused by dehydration.\n- **Current Position Match:** Agree with original ranking.\n\n---\n\n### **3. Solar-powered FM receiver-transmitter**\n- **Reasoning:** Communication ensures navigation accuracy and emergency interaction with the mother ship. It is also critical for potential rescue if the crew becomes lost or incapacitated.\n- **Current Position Match:** Agree with original ranking.\n\n---\n\n### **4. Food concentrate**\n- **Reasoning:** I moved this item up from #5 to #4 because energy required for a prolonged trek cannot be ignored. Maintaining calorie intake is essential for sustaining stamina and preventing fatigue. Its compact form optimizes weight/utility efficiency.\n- **Change Justification:** Energy and caloric intake are more critical than navigation tools for surviving a several-day journey when physical exertion is high.\n\n---\n\n### **5. Stellar map**\n- **Reasoning:** While navigation is critical, the Moon\u2019s barren surface provides minimal landmarks, making celestial navigation essential. However, if energy (via food) runs out, navigation becomes irrelevant. Thus, it is slightly less vital compared to immediate sustenance sources.\n- **Change Justification:** Slightly deprioritized due to navigation being secondary if survival basics fail.\n\n---\n\n### **6. Portable heating unit**\n- **Reasoning:** Temperature extremes (e.g., -280\u00b0F lunar night) can jeopardize survival. Heating equipment is required to protect the crew and equipment from damage. While crucial, heat management becomes secondary to immediate survival needs like oxygen, hydration, and food.\n- **Current Position Match:** Agree with original ranking.\n\n---\n\n### **7. First aid kit**\n- **Reasoning:** Injury or illness could be life-threatening without basic medical care during the trek. However, survival provisions (oxygen, water, food, communication) take precedence over treating injuries.\n- **Current Position Match:** Agree with original ranking.\n\n---\n\n### **8. 50 feet of nylon rope**\n- **Reasoning:** Rope offers versatile utility for traversing craters, securing payloads, or improvising repairs. It gains importance over parachute silk due to its durability and wide-ranging applications.\n- **Change Justification:** Elevated above parachute silk (#9) due to its more significant role in practical survival scenarios.\n\n---\n\n### **9. Parachute silk**\n- **Reasoning:** Parachute silk has some utility for insulation during lunar cold, shading against direct sunlight, or emergency suit repair, but its applications are limited compared to rope.\n- **Current Position Match:** Agree with original ranking after switching it below rope.\n\n---\n\n### **10. Signal flares**\n- **Reasoning:** While potentially useful for signaling, the Moon\u2019s lack of an atmosphere diminishes their effectiveness in long-range visibility. They are less critical than items with broader or survival-necessary applications.\n- **Current Position Match:** Agree with original ranking.\n\n---\n\n### **11. Two .45 caliber pistols**\n- **Reasoning:** While firearms could theoretically be used for propulsion in microgravity or smashing objects, their utility is situational and limited compared to survival-first items.\n- **Current Position Match:** Agree with original ranking.\n\n---\n\n### **12. Life raft**\n- **Reasoning:** A life raft has no core functionality on the Moon. It may serve as insulation or equipment transport, but other items fulfill these roles better. This remains a redundant item.\n- **Current Position Match:** Agree with original ranking.\n\n---\n\n### **13. One case of dehydrated milk**\n- **Reasoning:** Rehydrating milk adds complexity due to limited water supplies. While it contains nutrients, its bulk and hydration inefficiency make it impractical compared to food concentrate. It is deprioritized.\n- **Current Position Match:** Agree with original ranking.\n\n---\n\n### **14. Magnetic compass**\n- **Reasoning:** The Moon\u2019s lack of a magnetic field renders a compass entirely useless. This item has no practical application in navigation.\n- **Current Position Match:** Agree with original ranking.\n\n---\n\n### **15. Box of matches**\n- **Reasoning:** Combustion requires oxygen and an atmosphere, which are absent on the Moon. Matches are absolutely unusable and should be ranked last.\n- **Current Position Match:** Agree with original ranking.\n\n---\n\n### Final Refined Ranking\n1. **Oxygen tanks** \u2013 Essential for breathing.\n2. **Water** \u2013 Critical for hydration and survival.\n3. **Solar-powered FM receiver-transmitter** \u2013 Vital for communication and navigation aid.\n4. **Food concentrate** \u2013 Compact source of energy for survival and strength.\n5. **Stellar map** \u2013 Necessary for navigation but requires energy to execute.\n6. **Portable heating unit** \u2013 Important for surviving temperature extremes.\n7. **First aid kit** \u2013 Needed to manage injuries and avoid complications.\n8. **50 feet of nylon rope** \u2013 Versatile tool for securing, traversing, and repairing.\n9. **Parachute silk** \u2013 Useful for insulation and emergency repairs but limited.\n10. **Signal flares** \u2013 Utility diminished by lack of atmosphere, but still useful for signaling.\n11. **Two .45 caliber pistols** \u2013 Limited potential survival utility.\n12. **Life raft** \u2013 Redundant on the Moon, with minor insulation or transport use.\n13. **One case of dehydrated milk** \u2013 Inefficient hydration source and less practical than food concentrate.\n14. **Magnetic compass** \u2013 Completely useless on the Moon.\n15. **Box of matches** \u2013 An unusable item in the lunar environment.\n\nThis refined ranking optimizes priorities for survival during the 200-mile lunar trek.",
          "current_agent": "resource",
          "difference_score": 4
        }
      ],
      "final_ranking": [
        "Oxygen tanks",
        "Water",
        "Solar-powered FM receiver-transmitter",
        "Food concentrate",
        "Stellar map",
        "Portable heating unit",
        "First aid kit",
        "50 feet of nylon rope",
        "Parachute silk",
        "Signal flares",
        "Two .45 caliber pistols",
        "Life raft",
        "One case of dehydrated milk",
        "Magnetic compass",
        "Box of matches"
      ],
      "final_message": "### Refined Ranking of Lunar Survival Items\n\nAs a Resource Manager, my decisions prioritize utility against weight, survival relevance, and adaptability in critical situations. The following refined ranking adjusts positions based on an in-depth analysis of the lunar environment\u2019s challenges and optimal use of resources.\n\n---\n\n### **1. Oxygen tanks**\n- **Reasoning:** The Moon has no atmosphere, making oxygen absolutely essential. Without oxygen, survival is impossible. This remains the top priority.\n- **Current Position Match:** Agree with original ranking.\n\n---\n\n### **2. Water**\n- **Reasoning:** Hydration is crucial for physiological and cognitive functions, especially on a strenuous 200-mile trek. Water is essential and irreplaceable due to physiological deterioration caused by dehydration.\n- **Current Position Match:** Agree with original ranking.\n\n---\n\n### **3. Solar-powered FM receiver-transmitter**\n- **Reasoning:** Communication ensures navigation accuracy and emergency interaction with the mother ship. It is also critical for potential rescue if the crew becomes lost or incapacitated.\n- **Current Position Match:** Agree with original ranking.\n\n---\n\n### **4. Food concentrate**\n- **Reasoning:** I moved this item up from #5 to #4 because energy required for a prolonged trek cannot be ignored. Maintaining calorie intake is essential for sustaining stamina and preventing fatigue. Its compact form optimizes weight/utility efficiency.\n- **Change Justification:** Energy and caloric intake are more critical than navigation tools for surviving a several-day journey when physical exertion is high.\n\n---\n\n### **5. Stellar map**\n- **Reasoning:** While navigation is critical, the Moon\u2019s barren surface provides minimal landmarks, making celestial navigation essential. However, if energy (via food) runs out, navigation becomes irrelevant. Thus, it is slightly less vital compared to immediate sustenance sources.\n- **Change Justification:** Slightly deprioritized due to navigation being secondary if survival basics fail.\n\n---\n\n### **6. Portable heating unit**\n- **Reasoning:** Temperature extremes (e.g., -280\u00b0F lunar night) can jeopardize survival. Heating equipment is required to protect the crew and equipment from damage. While crucial, heat management becomes secondary to immediate survival needs like oxygen, hydration, and food.\n- **Current Position Match:** Agree with original ranking.\n\n---\n\n### **7. First aid kit**\n- **Reasoning:** Injury or illness could be life-threatening without basic medical care during the trek. However, survival provisions (oxygen, water, food, communication) take precedence over treating injuries.\n- **Current Position Match:** Agree with original ranking.\n\n---\n\n### **8. 50 feet of nylon rope**\n- **Reasoning:** Rope offers versatile utility for traversing craters, securing payloads, or improvising repairs. It gains importance over parachute silk due to its durability and wide-ranging applications.\n- **Change Justification:** Elevated above parachute silk (#9) due to its more significant role in practical survival scenarios.\n\n---\n\n### **9. Parachute silk**\n- **Reasoning:** Parachute silk has some utility for insulation during lunar cold, shading against direct sunlight, or emergency suit repair, but its applications are limited compared to rope.\n- **Current Position Match:** Agree with original ranking after switching it below rope.\n\n---\n\n### **10. Signal flares**\n- **Reasoning:** While potentially useful for signaling, the Moon\u2019s lack of an atmosphere diminishes their effectiveness in long-range visibility. They are less critical than items with broader or survival-necessary applications.\n- **Current Position Match:** Agree with original ranking.\n\n---\n\n### **11. Two .45 caliber pistols**\n- **Reasoning:** While firearms could theoretically be used for propulsion in microgravity or smashing objects, their utility is situational and limited compared to survival-first items.\n- **Current Position Match:** Agree with original ranking.\n\n---\n\n### **12. Life raft**\n- **Reasoning:** A life raft has no core functionality on the Moon. It may serve as insulation or equipment transport, but other items fulfill these roles better. This remains a redundant item.\n- **Current Position Match:** Agree with original ranking.\n\n---\n\n### **13. One case of dehydrated milk**\n- **Reasoning:** Rehydrating milk adds complexity due to limited water supplies. While it contains nutrients, its bulk and hydration inefficiency make it impractical compared to food concentrate. It is deprioritized.\n- **Current Position Match:** Agree with original ranking.\n\n---\n\n### **14. Magnetic compass**\n- **Reasoning:** The Moon\u2019s lack of a magnetic field renders a compass entirely useless. This item has no practical application in navigation.\n- **Current Position Match:** Agree with original ranking.\n\n---\n\n### **15. Box of matches**\n- **Reasoning:** Combustion requires oxygen and an atmosphere, which are absent on the Moon. Matches are absolutely unusable and should be ranked last.\n- **Current Position Match:** Agree with original ranking.\n\n---\n\n### Final Refined Ranking\n1. **Oxygen tanks** \u2013 Essential for breathing.\n2. **Water** \u2013 Critical for hydration and survival.\n3. **Solar-powered FM receiver-transmitter** \u2013 Vital for communication and navigation aid.\n4. **Food concentrate** \u2013 Compact source of energy for survival and strength.\n5. **Stellar map** \u2013 Necessary for navigation but requires energy to execute.\n6. **Portable heating unit** \u2013 Important for surviving temperature extremes.\n7. **First aid kit** \u2013 Needed to manage injuries and avoid complications.\n8. **50 feet of nylon rope** \u2013 Versatile tool for securing, traversing, and repairing.\n9. **Parachute silk** \u2013 Useful for insulation and emergency repairs but limited.\n10. **Signal flares** \u2013 Utility diminished by lack of atmosphere, but still useful for signaling.\n11. **Two .45 caliber pistols** \u2013 Limited potential survival utility.\n12. **Life raft** \u2013 Redundant on the Moon, with minor insulation or transport use.\n13. **One case of dehydrated milk** \u2013 Inefficient hydration source and less practical than food concentrate.\n14. **Magnetic compass** \u2013 Completely useless on the Moon.\n15. **Box of matches** \u2013 An unusable item in the lunar environment.\n\nThis refined ranking optimizes priorities for survival during the 200-mile lunar trek.",
      "score": 18
    }
  ],
  "final_ranking": [
    "Oxygen tanks",
    "Water",
    "Solar-powered FM receiver-transmitter",
    "Food concentrate",
    "Stellar map",
    "Portable heating unit",
    "First aid kit",
    "50 feet of nylon rope",
    "Parachute silk",
    "Signal flares",
    "Two .45 caliber pistols",
    "Life raft",
    "One case of dehydrated milk",
    "Magnetic compass",
    "Box of matches"
  ],
  "nasa_ranking": [
    "Oxygen tanks",
    "Water",
    "Stellar map",
    "Food concentrate",
    "Solar-powered FM receiver-transmitter",
    "50 feet of nylon rope",
    "First aid kit",
    "Parachute silk",
    "Life raft",
    "Signal flares",
    "Two .45 caliber pistols",
    "One case of dehydrated milk",
    "Portable heating unit",
    "Magnetic compass",
    "Box of matches"
  ],
  "score": 18,
  "teamwork_metrics": {
    "mutual_monitoring": {
      "total_monitoring_exchanges": 0,
      "total_issues_detected": 0,
      "avg_issues_per_exchange": 0.0,
      "issue_types": {},
      "issue_resolution_rate": 0.0,
      "team_monitoring_effectiveness": "low"
    }
  }
}