{
  "simulation_id": "sim_closed_loop_20250417_131344",
  "config": {
    "use_team_leadership": false,
    "use_closed_loop_comm": true,
    "use_mutual_monitoring": false,
    "use_shared_mental_model": false
  },
  "exchanges": [
    {
      "type": "sequential_refinement",
      "exchanges": [
        {
          "type": "initial_ranking",
          "role": "science",
          "message": "**Ranking of Lunar Survival Items for the 200-Mile Trek**  \n\nThe following ranking prioritizes items based on the lunar environment (lack of atmosphere, extreme temperatures, and rugged terrain) and survival needs for the trek, such as oxygen, hydration, navigation, and communication.  \n\n---\n\n**1. Oxygen Tanks**  \nJustification: Oxygen is absolutely vital for survival on the moon, as there is no breathable atmosphere. Without sufficient oxygen, you will not survive the journey.  \n\n**2. Water**  \nJustification: Dehydration can impair cognitive and physical performance, both critical to navigating and surviving the trek. Water is essential for maintaining bodily functions.  \n\n**3. Stellar Map**  \nJustification: This is crucial for navigation, as the lunar environment lacks landmarks and GPS functionality. The stellar map ensures crew members can align their position with celestial markers for orientation.  \n\n**4. Solar-Powered FM Receiver-Transmitter**  \nJustification: Communication with the mother ship is critical for potential assistance, updates, or coordination. It also enhances the chances of rescue if equipment fails or the trek is delayed.  \n\n**5. Food Concentrate**  \nJustification: High-calorie food concentrate is vital for maintaining energy levels during the strenuous trek. It is compact, efficient, and designed for space environments.  \n\n**6. First Aid Kit**  \nJustification: Injuries are likely during a 200-mile trek in a rugged and unfamiliar environment. The first aid kit is critical for treating minor wounds or stabilizing more serious injuries.  \n\n**7. Parachute Silk**  \nJustification: Parachute silk can be used effectively for multiple purposes, including creating shade, insulation, or visual signals to improve visibility to the mother ship.  \n\n**8. Signal Flares**  \nJustification: Signal flares may help in emergencies, particularly for visual communication with the mother ship or locating fellow crew members in the lunar terrain.  \n\n**9. Portable Heating Unit**  \nJustification: Lunar temperatures swing wildly between day and night, making temperature regulation essential, especially for survival during the colder lunar night periods.  \n\n**10. 50 Feet of Nylon Rope**  \nJustification: Useful for securing items during the trek, scaling uneven surfaces, or assisting injured crew members. It has multiple practical applications.  \n\n**11. Magnetic Compass**  \nJustification: Due to the lack of a magnetic field on the moon, a compass is not functional for navigation. It is placed lower in the ranking, as it provides little benefit compared to the stellar map.  \n\n**12. Two .45-Caliber Pistols**  \nJustification: These have limited utility, as there are no predators or immediate threats on the moon. They may be useful for breaking open sealed equipment or signaling in emergencies when combined with other items.  \n\n**13. One Case of Dehydrated Milk**  \nJustification: Dehydrated milk is less useful compared to food concentrate, as it requires water to be consumed, thus duplicating limited resources.  \n\n**14. Box of Matches**  \nJustification: Matches are non-functional on the moon due to the lack of oxygen necessary for combustion.  \n\n**15. Life Raft**  \nJustification: While useful on Earth for water survival, the life raft has no practical application for navigating the lunar environment. It is the least useful item.  \n\n---\n\nTeam members should review the ranking and provide confirmation or adjustments based on their specific expertise.",
          "ranking": [
            "Oxygen tanks",
            "Water",
            "Stellar map",
            "Solar-powered FM receiver-transmitter",
            "Food concentrate",
            "First aid kit",
            "Parachute silk",
            "Signal flares",
            "Portable heating unit",
            "50 feet of nylon rope",
            "Magnetic compass",
            "One case of dehydrated milk",
            "Box of matches",
            "Life raft",
            "Two .45 caliber pistols"
          ]
        },
        {
          "type": "refinement",
          "iteration": 1,
          "role": "resource",
          "message": "**Refined Ranking of Lunar Survival Items for the 200-Mile Trek**  \n\nThe updated ranking is based on critical resource efficiency and consideration of the lunar environment (lack of atmosphere, rugged terrain, extreme temperatures, and survival priorities).  \n\n---\n\n**1. Oxygen Tanks**  \n**Justification:** Oxygen is essential, as there is no breathable atmosphere on the moon. Without it, survival is impossible. Confirmed to remain as Rank #1.  \n\n**2. Water**  \n**Justification:** Hydration is critical for physical and cognitive performance, especially during a strenuous trek. No change from current rank.  \n\n**3. Stellar Map**  \n**Justification:** Crucial for navigation in the featureless lunar terrain where GPS and magnetic compasses are non-functional. Accurate celestial navigation ensures reaching the rendezvous point. No change from current rank.  \n\n**4. Solar-Powered FM Receiver-Transmitter**  \n**Justification:** Communication with the mother ship provides updates, emergency coordination, and enhances chances of rescue. Agreed to maintain its position at #4.  \n\n**5. Food Concentrate**  \n**Justification:** Compact and high-calorie food concentrate ensures sustained energy without excess weight. No change from current rank.  \n\n**6. First Aid Kit**  \n**Justification:** Essential for treating injuries or stabilizing crew members during the trek. Medical supplies may make the difference between survival and death in a harsh environment. No change from current rank.  \n\n**7. Signal Flares**  \n**Change:** Signal flares are ranked higher than parachute silk because they provide more reliable communication with the mother ship and can signal the crew's location in emergencies. **Reason for Adjustment:** Visibility in the lunar environment is a higher priority than the multi-purpose utility of parachute silk, making this more immediately useful.  \n\n**8. Parachute Silk**  \n**Justification:** Versatile material useful for shade, insulation, or creating visual signals. Moved to #8 to reflect its utility after signal flares.  \n\n**9. Portable Heating Unit**  \n**Justification:** Temperatures on the moon can swing dramatically, especially during lunar nights. A heating unit helps prevent hypothermia. No change from current rank.  \n\n**10. 50 Feet of Nylon Rope**  \n**Justification:** Versatile and indispensable for various tasks, such as scaling terrain, securing items, or assisting an injured crew member. No change from current rank.  \n\n**11. Magnetic Compass**  \n**Justification:** Non-functional on the moon due to the lack of a magnetic field. Confirmed lower ranking.  \n\n**12. Two .45-Caliber Pistols**  \n**Justification:** Limited application. Suggestions for breaking equipment, signaling emergencies, or possible psychological comfort are secondary. No change from current rank.  \n\n**13. One Case of Dehydrated Milk**  \n**Change:** Ranked higher than matches due to its secondary value as a food item, in case food concentrate runs out. Matches, however, remain completely non-functional on the moon.  \n\n**14. Box of Matches**  \n**Justification:** Matches are non-functional due to the lack of oxygen for combustion. Confirmed lower ranking.  \n\n**15. Life Raft**  \n**Justification:** No practical application in the lunar environment, where there are no bodies of water. Agreed to remain last.  \n\n---\n\n**Updated Ranking of Lunar Survival Items:**  \n1. Oxygen Tanks  \n2. Water  \n3. Stellar Map  \n4. Solar-Powered FM Receiver-Transmitter  \n5. Food Concentrate  \n6. First Aid Kit  \n7. Signal Flares (Adjusted ranking due to higher communication utility)  \n8. Parachute Silk (Moved below Signal Flares)  \n9. Portable Heating Unit  \n10. 50 Feet of Nylon Rope  \n11. Magnetic Compass  \n12. Two .45-Caliber Pistols  \n13. One Case of Dehydrated Milk (Adjusted ranking due to situational secondary value)  \n14. Box of Matches  \n15. Life Raft  \n\n---\n\nPlease confirm my adjustments or provide input! Let me know if anything needs further review.",
          "ranking": [
            "Oxygen tanks",
            "Water",
            "Stellar map",
            "Solar-powered FM receiver-transmitter",
            "Food concentrate",
            "First aid kit",
            "Signal flares",
            "Parachute silk",
            "Portable heating unit",
            "50 feet of nylon rope",
            "Magnetic compass",
            "One case of dehydrated milk",
            "Box of matches",
            "Life raft",
            "Two .45 caliber pistols"
          ]
        }
      ],
      "iterations": [
        {
          "iteration": 0,
          "current_ranking": [
            "Oxygen tanks",
            "Water",
            "Stellar map",
            "Solar-powered FM receiver-transmitter",
            "Food concentrate",
            "First aid kit",
            "Parachute silk",
            "Signal flares",
            "Portable heating unit",
            "50 feet of nylon rope",
            "Magnetic compass",
            "One case of dehydrated milk",
            "Box of matches",
            "Life raft",
            "Two .45 caliber pistols"
          ],
          "current_message": "**Ranking of Lunar Survival Items for the 200-Mile Trek**  \n\nThe following ranking prioritizes items based on the lunar environment (lack of atmosphere, extreme temperatures, and rugged terrain) and survival needs for the trek, such as oxygen, hydration, navigation, and communication.  \n\n---\n\n**1. Oxygen Tanks**  \nJustification: Oxygen is absolutely vital for survival on the moon, as there is no breathable atmosphere. Without sufficient oxygen, you will not survive the journey.  \n\n**2. Water**  \nJustification: Dehydration can impair cognitive and physical performance, both critical to navigating and surviving the trek. Water is essential for maintaining bodily functions.  \n\n**3. Stellar Map**  \nJustification: This is crucial for navigation, as the lunar environment lacks landmarks and GPS functionality. The stellar map ensures crew members can align their position with celestial markers for orientation.  \n\n**4. Solar-Powered FM Receiver-Transmitter**  \nJustification: Communication with the mother ship is critical for potential assistance, updates, or coordination. It also enhances the chances of rescue if equipment fails or the trek is delayed.  \n\n**5. Food Concentrate**  \nJustification: High-calorie food concentrate is vital for maintaining energy levels during the strenuous trek. It is compact, efficient, and designed for space environments.  \n\n**6. First Aid Kit**  \nJustification: Injuries are likely during a 200-mile trek in a rugged and unfamiliar environment. The first aid kit is critical for treating minor wounds or stabilizing more serious injuries.  \n\n**7. Parachute Silk**  \nJustification: Parachute silk can be used effectively for multiple purposes, including creating shade, insulation, or visual signals to improve visibility to the mother ship.  \n\n**8. Signal Flares**  \nJustification: Signal flares may help in emergencies, particularly for visual communication with the mother ship or locating fellow crew members in the lunar terrain.  \n\n**9. Portable Heating Unit**  \nJustification: Lunar temperatures swing wildly between day and night, making temperature regulation essential, especially for survival during the colder lunar night periods.  \n\n**10. 50 Feet of Nylon Rope**  \nJustification: Useful for securing items during the trek, scaling uneven surfaces, or assisting injured crew members. It has multiple practical applications.  \n\n**11. Magnetic Compass**  \nJustification: Due to the lack of a magnetic field on the moon, a compass is not functional for navigation. It is placed lower in the ranking, as it provides little benefit compared to the stellar map.  \n\n**12. Two .45-Caliber Pistols**  \nJustification: These have limited utility, as there are no predators or immediate threats on the moon. They may be useful for breaking open sealed equipment or signaling in emergencies when combined with other items.  \n\n**13. One Case of Dehydrated Milk**  \nJustification: Dehydrated milk is less useful compared to food concentrate, as it requires water to be consumed, thus duplicating limited resources.  \n\n**14. Box of Matches**  \nJustification: Matches are non-functional on the moon due to the lack of oxygen necessary for combustion.  \n\n**15. Life Raft**  \nJustification: While useful on Earth for water survival, the life raft has no practical application for navigating the lunar environment. It is the least useful item.  \n\n---\n\nTeam members should review the ranking and provide confirmation or adjustments based on their specific expertise.",
          "current_agent": "science"
        },
        {
          "iteration": 1,
          "current_ranking": [
            "Oxygen tanks",
            "Water",
            "Stellar map",
            "Solar-powered FM receiver-transmitter",
            "Food concentrate",
            "First aid kit",
            "Signal flares",
            "Parachute silk",
            "Portable heating unit",
            "50 feet of nylon rope",
            "Magnetic compass",
            "One case of dehydrated milk",
            "Box of matches",
            "Life raft",
            "Two .45 caliber pistols"
          ],
          "current_message": "**Refined Ranking of Lunar Survival Items for the 200-Mile Trek**  \n\nThe updated ranking is based on critical resource efficiency and consideration of the lunar environment (lack of atmosphere, rugged terrain, extreme temperatures, and survival priorities).  \n\n---\n\n**1. Oxygen Tanks**  \n**Justification:** Oxygen is essential, as there is no breathable atmosphere on the moon. Without it, survival is impossible. Confirmed to remain as Rank #1.  \n\n**2. Water**  \n**Justification:** Hydration is critical for physical and cognitive performance, especially during a strenuous trek. No change from current rank.  \n\n**3. Stellar Map**  \n**Justification:** Crucial for navigation in the featureless lunar terrain where GPS and magnetic compasses are non-functional. Accurate celestial navigation ensures reaching the rendezvous point. No change from current rank.  \n\n**4. Solar-Powered FM Receiver-Transmitter**  \n**Justification:** Communication with the mother ship provides updates, emergency coordination, and enhances chances of rescue. Agreed to maintain its position at #4.  \n\n**5. Food Concentrate**  \n**Justification:** Compact and high-calorie food concentrate ensures sustained energy without excess weight. No change from current rank.  \n\n**6. First Aid Kit**  \n**Justification:** Essential for treating injuries or stabilizing crew members during the trek. Medical supplies may make the difference between survival and death in a harsh environment. No change from current rank.  \n\n**7. Signal Flares**  \n**Change:** Signal flares are ranked higher than parachute silk because they provide more reliable communication with the mother ship and can signal the crew's location in emergencies. **Reason for Adjustment:** Visibility in the lunar environment is a higher priority than the multi-purpose utility of parachute silk, making this more immediately useful.  \n\n**8. Parachute Silk**  \n**Justification:** Versatile material useful for shade, insulation, or creating visual signals. Moved to #8 to reflect its utility after signal flares.  \n\n**9. Portable Heating Unit**  \n**Justification:** Temperatures on the moon can swing dramatically, especially during lunar nights. A heating unit helps prevent hypothermia. No change from current rank.  \n\n**10. 50 Feet of Nylon Rope**  \n**Justification:** Versatile and indispensable for various tasks, such as scaling terrain, securing items, or assisting an injured crew member. No change from current rank.  \n\n**11. Magnetic Compass**  \n**Justification:** Non-functional on the moon due to the lack of a magnetic field. Confirmed lower ranking.  \n\n**12. Two .45-Caliber Pistols**  \n**Justification:** Limited application. Suggestions for breaking equipment, signaling emergencies, or possible psychological comfort are secondary. No change from current rank.  \n\n**13. One Case of Dehydrated Milk**  \n**Change:** Ranked higher than matches due to its secondary value as a food item, in case food concentrate runs out. Matches, however, remain completely non-functional on the moon.  \n\n**14. Box of Matches**  \n**Justification:** Matches are non-functional due to the lack of oxygen for combustion. Confirmed lower ranking.  \n\n**15. Life Raft**  \n**Justification:** No practical application in the lunar environment, where there are no bodies of water. Agreed to remain last.  \n\n---\n\n**Updated Ranking of Lunar Survival Items:**  \n1. Oxygen Tanks  \n2. Water  \n3. Stellar Map  \n4. Solar-Powered FM Receiver-Transmitter  \n5. Food Concentrate  \n6. First Aid Kit  \n7. Signal Flares (Adjusted ranking due to higher communication utility)  \n8. Parachute Silk (Moved below Signal Flares)  \n9. Portable Heating Unit  \n10. 50 Feet of Nylon Rope  \n11. Magnetic Compass  \n12. Two .45-Caliber Pistols  \n13. One Case of Dehydrated Milk (Adjusted ranking due to situational secondary value)  \n14. Box of Matches  \n15. Life Raft  \n\n---\n\nPlease confirm my adjustments or provide input! Let me know if anything needs further review.",
          "current_agent": "resource",
          "difference_score": 2
        }
      ],
      "final_ranking": [
        "Oxygen tanks",
        "Water",
        "Stellar map",
        "Solar-powered FM receiver-transmitter",
        "Food concentrate",
        "First aid kit",
        "Signal flares",
        "Parachute silk",
        "Portable heating unit",
        "50 feet of nylon rope",
        "Magnetic compass",
        "One case of dehydrated milk",
        "Box of matches",
        "Life raft",
        "Two .45 caliber pistols"
      ],
      "final_message": "**Refined Ranking of Lunar Survival Items for the 200-Mile Trek**  \n\nThe updated ranking is based on critical resource efficiency and consideration of the lunar environment (lack of atmosphere, rugged terrain, extreme temperatures, and survival priorities).  \n\n---\n\n**1. Oxygen Tanks**  \n**Justification:** Oxygen is essential, as there is no breathable atmosphere on the moon. Without it, survival is impossible. Confirmed to remain as Rank #1.  \n\n**2. Water**  \n**Justification:** Hydration is critical for physical and cognitive performance, especially during a strenuous trek. No change from current rank.  \n\n**3. Stellar Map**  \n**Justification:** Crucial for navigation in the featureless lunar terrain where GPS and magnetic compasses are non-functional. Accurate celestial navigation ensures reaching the rendezvous point. No change from current rank.  \n\n**4. Solar-Powered FM Receiver-Transmitter**  \n**Justification:** Communication with the mother ship provides updates, emergency coordination, and enhances chances of rescue. Agreed to maintain its position at #4.  \n\n**5. Food Concentrate**  \n**Justification:** Compact and high-calorie food concentrate ensures sustained energy without excess weight. No change from current rank.  \n\n**6. First Aid Kit**  \n**Justification:** Essential for treating injuries or stabilizing crew members during the trek. Medical supplies may make the difference between survival and death in a harsh environment. No change from current rank.  \n\n**7. Signal Flares**  \n**Change:** Signal flares are ranked higher than parachute silk because they provide more reliable communication with the mother ship and can signal the crew's location in emergencies. **Reason for Adjustment:** Visibility in the lunar environment is a higher priority than the multi-purpose utility of parachute silk, making this more immediately useful.  \n\n**8. Parachute Silk**  \n**Justification:** Versatile material useful for shade, insulation, or creating visual signals. Moved to #8 to reflect its utility after signal flares.  \n\n**9. Portable Heating Unit**  \n**Justification:** Temperatures on the moon can swing dramatically, especially during lunar nights. A heating unit helps prevent hypothermia. No change from current rank.  \n\n**10. 50 Feet of Nylon Rope**  \n**Justification:** Versatile and indispensable for various tasks, such as scaling terrain, securing items, or assisting an injured crew member. No change from current rank.  \n\n**11. Magnetic Compass**  \n**Justification:** Non-functional on the moon due to the lack of a magnetic field. Confirmed lower ranking.  \n\n**12. Two .45-Caliber Pistols**  \n**Justification:** Limited application. Suggestions for breaking equipment, signaling emergencies, or possible psychological comfort are secondary. No change from current rank.  \n\n**13. One Case of Dehydrated Milk**  \n**Change:** Ranked higher than matches due to its secondary value as a food item, in case food concentrate runs out. Matches, however, remain completely non-functional on the moon.  \n\n**14. Box of Matches**  \n**Justification:** Matches are non-functional due to the lack of oxygen for combustion. Confirmed lower ranking.  \n\n**15. Life Raft**  \n**Justification:** No practical application in the lunar environment, where there are no bodies of water. Agreed to remain last.  \n\n---\n\n**Updated Ranking of Lunar Survival Items:**  \n1. Oxygen Tanks  \n2. Water  \n3. Stellar Map  \n4. Solar-Powered FM Receiver-Transmitter  \n5. Food Concentrate  \n6. First Aid Kit  \n7. Signal Flares (Adjusted ranking due to higher communication utility)  \n8. Parachute Silk (Moved below Signal Flares)  \n9. Portable Heating Unit  \n10. 50 Feet of Nylon Rope  \n11. Magnetic Compass  \n12. Two .45-Caliber Pistols  \n13. One Case of Dehydrated Milk (Adjusted ranking due to situational secondary value)  \n14. Box of Matches  \n15. Life Raft  \n\n---\n\nPlease confirm my adjustments or provide input! Let me know if anything needs further review.",
      "score": 28
    }
  ],
  "final_ranking": [
    "Oxygen tanks",
    "Water",
    "Stellar map",
    "Solar-powered FM receiver-transmitter",
    "Food concentrate",
    "First aid kit",
    "Signal flares",
    "Parachute silk",
    "Portable heating unit",
    "50 feet of nylon rope",
    "Magnetic compass",
    "One case of dehydrated milk",
    "Box of matches",
    "Life raft",
    "Two .45 caliber pistols"
  ],
  "nasa_ranking": [
    "Oxygen tanks",
    "Water",
    "Stellar map",
    "Food concentrate",
    "Solar-powered FM receiver-transmitter",
    "50 feet of nylon rope",
    "First aid kit",
    "Parachute silk",
    "Life raft",
    "Signal flares",
    "Two .45 caliber pistols",
    "One case of dehydrated milk",
    "Portable heating unit",
    "Magnetic compass",
    "Box of matches"
  ],
  "score": 28,
  "teamwork_metrics": {}
}