{
  "simulation_id": "sim_leadership_20250417_135959",
  "config": {
    "use_team_leadership": true,
    "use_closed_loop_comm": false,
    "use_mutual_monitoring": false,
    "use_shared_mental_model": false
  },
  "exchanges": [
    {
      "type": "sequential_refinement",
      "exchanges": [
        {
          "type": "initial_ranking",
          "role": "science",
          "message": "The lunar surface presents unique challenges for survival: no breathable atmosphere, extreme temperature fluctuations, exposure to harmful radiation, low gravity, lack of liquid water, and no magnetic field to guide navigation. Our survival priorities for this 200-mile trek to the mother ship are maintaining breathable air, hydration, regulating body temperature, communication, navigation, and addressing any injuries or physical challenges. Here is the ranked list of items with justifications:\n\n---\n\n### **Lunar Survival Item Ranking**\n\n1. **Oxygen Tanks**\n   - **Justification**: The moon has no atmosphere for respiration. Oxygen is the most essential life-support resource; without it, survival would be impossible. Adequate oxygen supply ensures the crew can sustain themselves for the duration of the trek.\n\n2. **Water**\n   - **Justification**: Hydration is critical to survival, more so than food over the short duration of this journey. The lunar environment will dehydrate the body quickly due to its extreme dryness and the bodily stresses of the trek.\n\n3. **Stellar Map**\n   - **Justification**: Navigation on the moon is challenging, as there are no natural landmarks or magnetic poles. A stellar map is critical to determine your position and keep you oriented toward the mother ship, especially given the 200-mile distance.\n\n4. **Solar-Powered FM Receiver-Transmitter**\n   - **Justification**: Communication with the mother ship or other potential rescuers is essential for coordinating aid or updating your position, especially in emergencies. Solar power ensures functionality in the absence of batteries.\n\n5. **Food Concentrate**\n   - **Justification**: While not immediately critical, food provides essential energy for maintaining physical and mental endurance over several days of travel.\n\n6. **First Aid Kit**\n   - **Justification**: Injuries can occur during the trek, and a functioning first aid kit is essential for treating cuts, burns, or other health issues that could otherwise compromise survival.\n\n7. **Portable Heating Unit**\n   - **Justification**: The moon's temperature can vary drastically, dropping to extreme lows at night. A heating unit provides protection against potential hypothermia, especially with the absence of an atmosphere to retain heat.\n\n8. **50 Feet of Nylon Rope**\n   - **Justification**: A versatile tool that can be used for climbing, securing equipment, or aiding in rescue efforts during the trek. It adds flexibility for unforeseen challenges.\n\n9. **Parachute Silk**\n   - **Justification**: Can be used as a makeshift sunshade to reduce heat exposure, carry items, or protect against lunar regolith (fine, abrasive dust). It\u2019s lightweight and multifunctional.\n\n10. **Signal Flares**\n    - **Justification**: Provides a means of visual communication for rescue missions or signaling the mother ship upon approach to the rendezvous point.\n\n11. **One Case of Dehydrated Milk**\n    - **Justification**: While less critical than food concentrate, it provides additional calories and energy. However, rehydrating the milk would require significant water, which is a scarce and more valuable resource.\n\n12. **Two .45 Caliber Pistols**\n    - **Justification**: Due to the moon's lack of wildlife or hostile entities, weapons have limited utility. They could be used to signal in emergencies or as weight/counterbalance engineering tools during a trek.\n\n13. **Life Raft**\n    - **Justification**: Its primary use would be as a carrying device for supplies or as insulation against the lunar surface's heat and cold. However, it is bulky and has limited practical value in this setting.\n\n14. **Magnetic Compass**\n    - **Justification**: A magnetic compass is useless on the moon because there is no magnetic field to interact with it. Stellar navigation is far more reliable.\n\n15. **Box of Matches**\n    - **Justification**: Completely useless in the lunar environment, where there is no oxygen to support combustion.\n\n---\n\n### **Key Considerations:**\nThis ranking reflects the lunar environment's unique conditions and prioritizes life support (oxygen, water), navigation (stellar map), communication, energy/heat maintenance, and sustenance. Items like weapons or matches, which may be helpful on Earth, have little to no use given the lack of atmosphere, magnetic fields, and wildlife on the moon. This approach ensures survival through careful resource allocation and addressing the most immediate threats to life for the trek.",
          "ranking": [
            "Oxygen tanks",
            "Water",
            "Stellar map",
            "Solar-powered FM receiver-transmitter",
            "Food concentrate",
            "First aid kit",
            "Portable heating unit",
            "50 feet of nylon rope",
            "Parachute silk",
            "Signal flares",
            "One case of dehydrated milk",
            "Two .45 caliber pistols",
            "Life raft",
            "Magnetic compass",
            "Box of matches"
          ]
        },
        {
          "type": "refinement",
          "iteration": 1,
          "role": "resource",
          "message": "Here is a refined ranking of the lunar survival items based on an analysis of utility, weight, and adaptability for a 200-mile trek on the moon. In this assessment, I have accounted for the unique environmental challenges of the lunar surface, the group's survival priorities, and the item's comparative utility over the journey.\n\n---\n\n### **Refined Lunar Survival Item Ranking**\n\n1. **Oxygen Tanks**  \n   - **Justification**: Absolutely critical, as the moon lacks a breathable atmosphere. Without oxygen, survival is impossible. Its top rank is undisputed.\n\n2. **Water**  \n   - **Justification**: Dehydration will be a significant challenge due to the dry and harsh environment, especially with the strenuous activity of traveling 200 miles.\n\n3. **Stellar Map**  \n   - **Justification**: Essential for navigation, as there are no natural landmarks or magnetic fields to guide travelers. Orientation is critical over the long journey.\n\n4. **Solar-Powered FM Receiver-Transmitter**  \n   - **Justification**: Communication with the mother ship ensures coordination and the possibility of rescue in emergencies. Its solar-powered aspect is an advantage, guaranteeing functionality over the trip.\n\n5. **First Aid Kit**  \n   - **Reason for Movement**: Moved up from rank #6. Injuries can severely compromise the trek, and immediate treatment could be life-saving. Lunar terrain is harsh and uneven, increasing the chances of accidents.  \n\n6. **Food Concentrate**  \n   - **Justification**: Provides essential energy and sustenance, although hydration is a higher priority over the short duration of this trek. Maintained below the first aid kit due to survivability concerns in case of injury.\n\n7. **Portable Heating Unit**  \n   - **Justification**: Protection against hypothermia during the moon\u2019s drastic nighttime temperature drops is vital. However, it ranks lower than air, water, navigation, and immediate health concerns.\n\n8. **50 Feet of Nylon Rope**  \n   - **Justification**: Versatile for problem-solving and practical uses like securing equipment, crossing obstacles, or aiding team members. Retains its ranking as it can address multiple needs.\n\n9. **Parachute Silk**  \n   - **Justification**: A lightweight, multi-functional resource. Can be used for carrying supplies, as a sunshade, or protection against lunar regolith. Its relatively lower life-critical utility justifies its ranking here.\n\n10. **Signal Flares**  \n    - **Justification**: Useful for visual signaling at short distances, especially upon approaching the rendezvous point. It is less critical early in the trek when communication via transmitter will suffice.\n\n11. **Life Raft**  \n    - **Reason for Movement**: Moved up from rank #13. While bulky, a life raft provides insulation from the lunar surface and a way to carry essential supplies more efficiently over the trek.\n\n12. **One Case of Dehydrated Milk**  \n    - **Justification**: Maintained at a lower rank as rehydration requires water, which is a more precious resource. Provides some extra calories but holds limited value compared to other items.\n\n13. **Two .45 Caliber Pistols**  \n    - **Justification**: Ranked low due to limited utility on the moon. Could theoretically be used to create noise or as a counterweight/tool, but these are non-essential purposes.\n\n14. **Magnetic Compass**  \n    - **Justification**: Completely ineffective due to the moon\u2019s lack of a magnetic field. A stellar map is vastly superior for navigation.\n\n15. **Box of Matches**  \n    - **Justification**: Completely useless on the moon as there is no oxygen to sustain combustion. It holds no practical application for survival in this environment.\n\n---\n\n### **Explanation of Changes**\n\n1. **First Aid Kit Moved from #6 to #5**:  \n   - Injuries or illnesses during a 200-mile trek could be fatal without proper treatment. The moon's difficult terrain increases the likelihood of accidents, making immediate care a priority for survival. My expertise in resource efficiency recognizes that addressing potential injuries early improves overall mission success.\n\n2. **Life Raft Moved from #13 to #11**:  \n   - While bulky, the raft doubles as thermal insulation and can drastically reduce the burden of carrying oxygen tanks, water, or other heavy supplies. Adjusting its position slightly reflects its indirect but significant utility.\n\n3. **Signal Flares Retained #10 Over Dehydrated Milk (#12)**:  \n   - Although emergency signaling is typically situational, flares\u2019 ability to visually alert nearby rescuers positions them above dehydrated milk, given the water-dependence of the latter. Communication and signaling take precedence here.\n\n4. **Two .45 Caliber Pistols Demoted to #13**:  \n   - While pistols retain minor situational utility, their ranking is adjusted lower to reflect their specialized and non-critical use compared to heat insulation or signaled communication.\n\n---\n\n### **Final Refined Ranking**\n\n1. **Oxygen Tanks**  \n2. **Water**  \n3. **Stellar Map**  \n4. **Solar-Powered FM Receiver-Transmitter**  \n5. **First Aid Kit**  \n6. **Food Concentrate**  \n7. **Portable Heating Unit**  \n8. **50 Feet of Nylon Rope**  \n9. **Parachute Silk**  \n10. **Signal Flares**  \n11. **Life Raft**  \n12. **One Case of Dehydrated Milk**  \n13. **Two .45 Caliber Pistols**  \n14. **Magnetic Compass**  \n15. **Box of Matches**\n\nThis refined ranking balances critical survival needs (air, water, navigation) with the logical prioritization of injury treatment, physical endurance, and long-term navigation solutions. This allocation gives your team the best chance of making the 200-mile trek safely to the mother ship.",
          "ranking": [
            "Oxygen tanks",
            "Water",
            "Stellar map",
            "Solar-powered FM receiver-transmitter",
            "First aid kit",
            "Food concentrate",
            "Portable heating unit",
            "50 feet of nylon rope",
            "Parachute silk",
            "Signal flares",
            "Life raft",
            "One case of dehydrated milk",
            "Two .45 caliber pistols",
            "Magnetic compass",
            "Box of matches"
          ]
        }
      ],
      "iterations": [
        {
          "iteration": 0,
          "current_ranking": [
            "Oxygen tanks",
            "Water",
            "Stellar map",
            "Solar-powered FM receiver-transmitter",
            "Food concentrate",
            "First aid kit",
            "Portable heating unit",
            "50 feet of nylon rope",
            "Parachute silk",
            "Signal flares",
            "One case of dehydrated milk",
            "Two .45 caliber pistols",
            "Life raft",
            "Magnetic compass",
            "Box of matches"
          ],
          "current_message": "The lunar surface presents unique challenges for survival: no breathable atmosphere, extreme temperature fluctuations, exposure to harmful radiation, low gravity, lack of liquid water, and no magnetic field to guide navigation. Our survival priorities for this 200-mile trek to the mother ship are maintaining breathable air, hydration, regulating body temperature, communication, navigation, and addressing any injuries or physical challenges. Here is the ranked list of items with justifications:\n\n---\n\n### **Lunar Survival Item Ranking**\n\n1. **Oxygen Tanks**\n   - **Justification**: The moon has no atmosphere for respiration. Oxygen is the most essential life-support resource; without it, survival would be impossible. Adequate oxygen supply ensures the crew can sustain themselves for the duration of the trek.\n\n2. **Water**\n   - **Justification**: Hydration is critical to survival, more so than food over the short duration of this journey. The lunar environment will dehydrate the body quickly due to its extreme dryness and the bodily stresses of the trek.\n\n3. **Stellar Map**\n   - **Justification**: Navigation on the moon is challenging, as there are no natural landmarks or magnetic poles. A stellar map is critical to determine your position and keep you oriented toward the mother ship, especially given the 200-mile distance.\n\n4. **Solar-Powered FM Receiver-Transmitter**\n   - **Justification**: Communication with the mother ship or other potential rescuers is essential for coordinating aid or updating your position, especially in emergencies. Solar power ensures functionality in the absence of batteries.\n\n5. **Food Concentrate**\n   - **Justification**: While not immediately critical, food provides essential energy for maintaining physical and mental endurance over several days of travel.\n\n6. **First Aid Kit**\n   - **Justification**: Injuries can occur during the trek, and a functioning first aid kit is essential for treating cuts, burns, or other health issues that could otherwise compromise survival.\n\n7. **Portable Heating Unit**\n   - **Justification**: The moon's temperature can vary drastically, dropping to extreme lows at night. A heating unit provides protection against potential hypothermia, especially with the absence of an atmosphere to retain heat.\n\n8. **50 Feet of Nylon Rope**\n   - **Justification**: A versatile tool that can be used for climbing, securing equipment, or aiding in rescue efforts during the trek. It adds flexibility for unforeseen challenges.\n\n9. **Parachute Silk**\n   - **Justification**: Can be used as a makeshift sunshade to reduce heat exposure, carry items, or protect against lunar regolith (fine, abrasive dust). It\u2019s lightweight and multifunctional.\n\n10. **Signal Flares**\n    - **Justification**: Provides a means of visual communication for rescue missions or signaling the mother ship upon approach to the rendezvous point.\n\n11. **One Case of Dehydrated Milk**\n    - **Justification**: While less critical than food concentrate, it provides additional calories and energy. However, rehydrating the milk would require significant water, which is a scarce and more valuable resource.\n\n12. **Two .45 Caliber Pistols**\n    - **Justification**: Due to the moon's lack of wildlife or hostile entities, weapons have limited utility. They could be used to signal in emergencies or as weight/counterbalance engineering tools during a trek.\n\n13. **Life Raft**\n    - **Justification**: Its primary use would be as a carrying device for supplies or as insulation against the lunar surface's heat and cold. However, it is bulky and has limited practical value in this setting.\n\n14. **Magnetic Compass**\n    - **Justification**: A magnetic compass is useless on the moon because there is no magnetic field to interact with it. Stellar navigation is far more reliable.\n\n15. **Box of Matches**\n    - **Justification**: Completely useless in the lunar environment, where there is no oxygen to support combustion.\n\n---\n\n### **Key Considerations:**\nThis ranking reflects the lunar environment's unique conditions and prioritizes life support (oxygen, water), navigation (stellar map), communication, energy/heat maintenance, and sustenance. Items like weapons or matches, which may be helpful on Earth, have little to no use given the lack of atmosphere, magnetic fields, and wildlife on the moon. This approach ensures survival through careful resource allocation and addressing the most immediate threats to life for the trek.",
          "current_agent": "science"
        },
        {
          "iteration": 1,
          "current_ranking": [
            "Oxygen tanks",
            "Water",
            "Stellar map",
            "Solar-powered FM receiver-transmitter",
            "First aid kit",
            "Food concentrate",
            "Portable heating unit",
            "50 feet of nylon rope",
            "Parachute silk",
            "Signal flares",
            "Life raft",
            "One case of dehydrated milk",
            "Two .45 caliber pistols",
            "Magnetic compass",
            "Box of matches"
          ],
          "current_message": "Here is a refined ranking of the lunar survival items based on an analysis of utility, weight, and adaptability for a 200-mile trek on the moon. In this assessment, I have accounted for the unique environmental challenges of the lunar surface, the group's survival priorities, and the item's comparative utility over the journey.\n\n---\n\n### **Refined Lunar Survival Item Ranking**\n\n1. **Oxygen Tanks**  \n   - **Justification**: Absolutely critical, as the moon lacks a breathable atmosphere. Without oxygen, survival is impossible. Its top rank is undisputed.\n\n2. **Water**  \n   - **Justification**: Dehydration will be a significant challenge due to the dry and harsh environment, especially with the strenuous activity of traveling 200 miles.\n\n3. **Stellar Map**  \n   - **Justification**: Essential for navigation, as there are no natural landmarks or magnetic fields to guide travelers. Orientation is critical over the long journey.\n\n4. **Solar-Powered FM Receiver-Transmitter**  \n   - **Justification**: Communication with the mother ship ensures coordination and the possibility of rescue in emergencies. Its solar-powered aspect is an advantage, guaranteeing functionality over the trip.\n\n5. **First Aid Kit**  \n   - **Reason for Movement**: Moved up from rank #6. Injuries can severely compromise the trek, and immediate treatment could be life-saving. Lunar terrain is harsh and uneven, increasing the chances of accidents.  \n\n6. **Food Concentrate**  \n   - **Justification**: Provides essential energy and sustenance, although hydration is a higher priority over the short duration of this trek. Maintained below the first aid kit due to survivability concerns in case of injury.\n\n7. **Portable Heating Unit**  \n   - **Justification**: Protection against hypothermia during the moon\u2019s drastic nighttime temperature drops is vital. However, it ranks lower than air, water, navigation, and immediate health concerns.\n\n8. **50 Feet of Nylon Rope**  \n   - **Justification**: Versatile for problem-solving and practical uses like securing equipment, crossing obstacles, or aiding team members. Retains its ranking as it can address multiple needs.\n\n9. **Parachute Silk**  \n   - **Justification**: A lightweight, multi-functional resource. Can be used for carrying supplies, as a sunshade, or protection against lunar regolith. Its relatively lower life-critical utility justifies its ranking here.\n\n10. **Signal Flares**  \n    - **Justification**: Useful for visual signaling at short distances, especially upon approaching the rendezvous point. It is less critical early in the trek when communication via transmitter will suffice.\n\n11. **Life Raft**  \n    - **Reason for Movement**: Moved up from rank #13. While bulky, a life raft provides insulation from the lunar surface and a way to carry essential supplies more efficiently over the trek.\n\n12. **One Case of Dehydrated Milk**  \n    - **Justification**: Maintained at a lower rank as rehydration requires water, which is a more precious resource. Provides some extra calories but holds limited value compared to other items.\n\n13. **Two .45 Caliber Pistols**  \n    - **Justification**: Ranked low due to limited utility on the moon. Could theoretically be used to create noise or as a counterweight/tool, but these are non-essential purposes.\n\n14. **Magnetic Compass**  \n    - **Justification**: Completely ineffective due to the moon\u2019s lack of a magnetic field. A stellar map is vastly superior for navigation.\n\n15. **Box of Matches**  \n    - **Justification**: Completely useless on the moon as there is no oxygen to sustain combustion. It holds no practical application for survival in this environment.\n\n---\n\n### **Explanation of Changes**\n\n1. **First Aid Kit Moved from #6 to #5**:  \n   - Injuries or illnesses during a 200-mile trek could be fatal without proper treatment. The moon's difficult terrain increases the likelihood of accidents, making immediate care a priority for survival. My expertise in resource efficiency recognizes that addressing potential injuries early improves overall mission success.\n\n2. **Life Raft Moved from #13 to #11**:  \n   - While bulky, the raft doubles as thermal insulation and can drastically reduce the burden of carrying oxygen tanks, water, or other heavy supplies. Adjusting its position slightly reflects its indirect but significant utility.\n\n3. **Signal Flares Retained #10 Over Dehydrated Milk (#12)**:  \n   - Although emergency signaling is typically situational, flares\u2019 ability to visually alert nearby rescuers positions them above dehydrated milk, given the water-dependence of the latter. Communication and signaling take precedence here.\n\n4. **Two .45 Caliber Pistols Demoted to #13**:  \n   - While pistols retain minor situational utility, their ranking is adjusted lower to reflect their specialized and non-critical use compared to heat insulation or signaled communication.\n\n---\n\n### **Final Refined Ranking**\n\n1. **Oxygen Tanks**  \n2. **Water**  \n3. **Stellar Map**  \n4. **Solar-Powered FM Receiver-Transmitter**  \n5. **First Aid Kit**  \n6. **Food Concentrate**  \n7. **Portable Heating Unit**  \n8. **50 Feet of Nylon Rope**  \n9. **Parachute Silk**  \n10. **Signal Flares**  \n11. **Life Raft**  \n12. **One Case of Dehydrated Milk**  \n13. **Two .45 Caliber Pistols**  \n14. **Magnetic Compass**  \n15. **Box of Matches**\n\nThis refined ranking balances critical survival needs (air, water, navigation) with the logical prioritization of injury treatment, physical endurance, and long-term navigation solutions. This allocation gives your team the best chance of making the 200-mile trek safely to the mother ship.",
          "current_agent": "resource",
          "difference_score": 6
        }
      ],
      "final_ranking": [
        "Oxygen tanks",
        "Water",
        "Stellar map",
        "Solar-powered FM receiver-transmitter",
        "First aid kit",
        "Food concentrate",
        "Portable heating unit",
        "50 feet of nylon rope",
        "Parachute silk",
        "Signal flares",
        "Life raft",
        "One case of dehydrated milk",
        "Two .45 caliber pistols",
        "Magnetic compass",
        "Box of matches"
      ],
      "final_message": "Here is a refined ranking of the lunar survival items based on an analysis of utility, weight, and adaptability for a 200-mile trek on the moon. In this assessment, I have accounted for the unique environmental challenges of the lunar surface, the group's survival priorities, and the item's comparative utility over the journey.\n\n---\n\n### **Refined Lunar Survival Item Ranking**\n\n1. **Oxygen Tanks**  \n   - **Justification**: Absolutely critical, as the moon lacks a breathable atmosphere. Without oxygen, survival is impossible. Its top rank is undisputed.\n\n2. **Water**  \n   - **Justification**: Dehydration will be a significant challenge due to the dry and harsh environment, especially with the strenuous activity of traveling 200 miles.\n\n3. **Stellar Map**  \n   - **Justification**: Essential for navigation, as there are no natural landmarks or magnetic fields to guide travelers. Orientation is critical over the long journey.\n\n4. **Solar-Powered FM Receiver-Transmitter**  \n   - **Justification**: Communication with the mother ship ensures coordination and the possibility of rescue in emergencies. Its solar-powered aspect is an advantage, guaranteeing functionality over the trip.\n\n5. **First Aid Kit**  \n   - **Reason for Movement**: Moved up from rank #6. Injuries can severely compromise the trek, and immediate treatment could be life-saving. Lunar terrain is harsh and uneven, increasing the chances of accidents.  \n\n6. **Food Concentrate**  \n   - **Justification**: Provides essential energy and sustenance, although hydration is a higher priority over the short duration of this trek. Maintained below the first aid kit due to survivability concerns in case of injury.\n\n7. **Portable Heating Unit**  \n   - **Justification**: Protection against hypothermia during the moon\u2019s drastic nighttime temperature drops is vital. However, it ranks lower than air, water, navigation, and immediate health concerns.\n\n8. **50 Feet of Nylon Rope**  \n   - **Justification**: Versatile for problem-solving and practical uses like securing equipment, crossing obstacles, or aiding team members. Retains its ranking as it can address multiple needs.\n\n9. **Parachute Silk**  \n   - **Justification**: A lightweight, multi-functional resource. Can be used for carrying supplies, as a sunshade, or protection against lunar regolith. Its relatively lower life-critical utility justifies its ranking here.\n\n10. **Signal Flares**  \n    - **Justification**: Useful for visual signaling at short distances, especially upon approaching the rendezvous point. It is less critical early in the trek when communication via transmitter will suffice.\n\n11. **Life Raft**  \n    - **Reason for Movement**: Moved up from rank #13. While bulky, a life raft provides insulation from the lunar surface and a way to carry essential supplies more efficiently over the trek.\n\n12. **One Case of Dehydrated Milk**  \n    - **Justification**: Maintained at a lower rank as rehydration requires water, which is a more precious resource. Provides some extra calories but holds limited value compared to other items.\n\n13. **Two .45 Caliber Pistols**  \n    - **Justification**: Ranked low due to limited utility on the moon. Could theoretically be used to create noise or as a counterweight/tool, but these are non-essential purposes.\n\n14. **Magnetic Compass**  \n    - **Justification**: Completely ineffective due to the moon\u2019s lack of a magnetic field. A stellar map is vastly superior for navigation.\n\n15. **Box of Matches**  \n    - **Justification**: Completely useless on the moon as there is no oxygen to sustain combustion. It holds no practical application for survival in this environment.\n\n---\n\n### **Explanation of Changes**\n\n1. **First Aid Kit Moved from #6 to #5**:  \n   - Injuries or illnesses during a 200-mile trek could be fatal without proper treatment. The moon's difficult terrain increases the likelihood of accidents, making immediate care a priority for survival. My expertise in resource efficiency recognizes that addressing potential injuries early improves overall mission success.\n\n2. **Life Raft Moved from #13 to #11**:  \n   - While bulky, the raft doubles as thermal insulation and can drastically reduce the burden of carrying oxygen tanks, water, or other heavy supplies. Adjusting its position slightly reflects its indirect but significant utility.\n\n3. **Signal Flares Retained #10 Over Dehydrated Milk (#12)**:  \n   - Although emergency signaling is typically situational, flares\u2019 ability to visually alert nearby rescuers positions them above dehydrated milk, given the water-dependence of the latter. Communication and signaling take precedence here.\n\n4. **Two .45 Caliber Pistols Demoted to #13**:  \n   - While pistols retain minor situational utility, their ranking is adjusted lower to reflect their specialized and non-critical use compared to heat insulation or signaled communication.\n\n---\n\n### **Final Refined Ranking**\n\n1. **Oxygen Tanks**  \n2. **Water**  \n3. **Stellar Map**  \n4. **Solar-Powered FM Receiver-Transmitter**  \n5. **First Aid Kit**  \n6. **Food Concentrate**  \n7. **Portable Heating Unit**  \n8. **50 Feet of Nylon Rope**  \n9. **Parachute Silk**  \n10. **Signal Flares**  \n11. **Life Raft**  \n12. **One Case of Dehydrated Milk**  \n13. **Two .45 Caliber Pistols**  \n14. **Magnetic Compass**  \n15. **Box of Matches**\n\nThis refined ranking balances critical survival needs (air, water, navigation) with the logical prioritization of injury treatment, physical endurance, and long-term navigation solutions. This allocation gives your team the best chance of making the 200-mile trek safely to the mother ship.",
      "score": 18
    }
  ],
  "final_ranking": [
    "Oxygen tanks",
    "Water",
    "Stellar map",
    "Solar-powered FM receiver-transmitter",
    "First aid kit",
    "Food concentrate",
    "Portable heating unit",
    "50 feet of nylon rope",
    "Parachute silk",
    "Signal flares",
    "Life raft",
    "One case of dehydrated milk",
    "Two .45 caliber pistols",
    "Magnetic compass",
    "Box of matches"
  ],
  "nasa_ranking": [
    "Oxygen tanks",
    "Water",
    "Stellar map",
    "Food concentrate",
    "Solar-powered FM receiver-transmitter",
    "50 feet of nylon rope",
    "First aid kit",
    "Parachute silk",
    "Life raft",
    "Signal flares",
    "Two .45 caliber pistols",
    "One case of dehydrated milk",
    "Portable heating unit",
    "Magnetic compass",
    "Box of matches"
  ],
  "score": 18,
  "teamwork_metrics": {}
}