{
  "simulation_id": "sim_mutual_monitoring_20250417_135624",
  "config": {
    "use_team_leadership": false,
    "use_closed_loop_comm": false,
    "use_mutual_monitoring": true,
    "use_shared_mental_model": false
  },
  "exchanges": [
    {
      "type": "sequential_refinement",
      "exchanges": [
        {
          "type": "initial_ranking",
          "role": "resource",
          "message": "Here is the ranking of the 15 lunar survival items for the 200-mile trek to the rendezvous point, along with explicit justifications for each:\n\n---\n\n### **Ranking of Lunar Survival Items**\n\n---\n\n### **1. Oxygen Tanks**\n   - **Justification**: Oxygen is the most critical resource for survival on the Moon, as the Moon has no atmosphere. Without it, survival is impossible. Multiple tanks ensure sufficient supply for the 200-mile journey to the rendezvous point.\n\n---\n\n### **2. Water**\n   - **Justification**: Water is vital for hydration and regulating body temperature during the trek. Dehydration becomes a major issue, especially in the harsh lunar environment where conditions can rapidly dehydrate a person.\n\n---\n\n### **3. Stellar Map (of the Moon\u2019s constellations)**\n   - **Justification**: Navigation is crucial for reaching the rendezvous point. A stellar map would help the crew orient themselves and determine the correct 200-mile path across the unmarked, barren lunar terrain.\n\n---\n\n### **4. Solar-Powered FM Receiver-Transmitter**\n   - **Justification**: This is essential for communication with the mother ship or rescue teams. Staying in contact increases the crew's chances of being located in case they go off course or encounter an emergency.\n\n---\n\n### **5. Food Concentrate**\n   - **Justification**: Although humans can survive longer without food than water, sustained energy is crucial for the physical demands of the journey. Food concentrate is lightweight and provides high nutritional value.\n\n---\n\n### **6. 50 Feet of Nylon Rope**\n   - **Justification**: Rope has multiple uses, such as assisting in climbing over craters and rough lunar terrain, securing items, or helping team members navigate difficult sections safely.\n\n---\n\n### **7. First Aid Kit**\n   - **Justification**: Injuries or health issues during the trek are likely. A first aid kit enables treatment of minor wounds or health conditions, which could otherwise impair progress or prove fatal.\n\n---\n\n### **8. Portable Heating Unit**\n   - **Justification**: The Moon experiences extreme temperature fluctuations, and the dark side can become extremely cold. A heating unit would protect the crew from hypothermia during colder periods but isn't ranked higher because heat can also be generated through movement or additional clothing layers.\n\n---\n\n### **9. Signal Flares**\n   - **Justification**: Flares could help attract the attention of the mother ship or other rescuers if the team gets lost or when approaching the destination. They are less critical than other navigation or survival tools but still useful for signaling.\n\n---\n\n### **10. Parachute Silk**\n   - **Justification**: This can serve multiple purposes, including use as a sunshade, insulating material, or additional protection. However, its utility is secondary to more pressing survival needs.\n\n---\n\n### **11. Life Raft**\n   - **Justification**: While it seems out of context for the Moon, the raft's reflective surface could help with signaling, and it could serve as a makeshift carrier for equipment. Its usefulness is relatively low compared to other items.\n\n---\n\n### **12. One Case of Dehydrated Milk**\n   - **Justification**: While a source of nutrition, dehydrated milk requires water to be rehydrated, which makes it less practical given the limited water supplies. Food concentrate is a more efficient energy source.\n\n---\n\n### **13. Magnetic Compass**\n   - **Justification**: A compass is useless on the Moon because the Moon lacks a significant magnetic field to provide orientation. Navigation would rely entirely on the stellar map instead.\n\n---\n\n### **14. Two .45-Caliber Pistols**\n   - **Justification**: Firearms have no practical use on the Moon, where there is no wildlife or threats requiring defense. They add unnecessary weight and consume resources for transport.\n\n---\n\n### **15. Box of Matches**\n   - **Justification**: Matches are completely useless in the Moon\u2019s oxygen-free environment, as fires cannot be lit. They provide no survival value for the journey.\n\n---\n\n### Final Thoughts:\nEach item's ranking is based on its utility, weight-to-importance ratio, and relevance to the conditions on the Moon. The most critical resources (oxygen, water, navigation tools, and communication equipment) are prioritized highest to ensure survival and a successful journey.",
          "ranking": [
            "Oxygen tanks",
            "Water",
            "Stellar map",
            "Solar-powered FM receiver-transmitter",
            "Food concentrate",
            "50 feet of nylon rope",
            "First aid kit",
            "Portable heating unit",
            "Signal flares",
            "Parachute silk",
            "Life raft",
            "One case of dehydrated milk",
            "Magnetic compass",
            "Box of matches",
            "Two .45 caliber pistols"
          ]
        },
        {
          "type": "refinement",
          "iteration": 1,
          "role": "science",
          "message": "### **Refined Ranking of Lunar Survival Items (200-mile trek)**\n\n---\n\n### **1. Oxygen Tanks**\n   - **Justification**: Oxygen remains the most vital resource for survival, as the Moon lacks breathable atmosphere. Without sufficient oxygen, death is inevitable. Ranked highest in importance as life cannot exist without it.\n\n---\n\n### **2. Water**\n   - **Justification**: Adequate hydration is crucial for physical endurance and temperature regulation during the trek. Water's importance is near-equivalent to oxygen, with scarcity being a major limitation in the lunar environment.\n\n---\n\n### **3. Stellar Map (of the Moon\u2019s constellations)**\n   - **Justification**: Navigation is essential to reaching the rendezvous point. Knowledge of the Moon\u2019s constellations will be the primary method of orientation since there are no landmarks on the lunar surface. I agree with the original ranking here.\n\n---\n\n### **4. Solar-Powered FM Receiver-Transmitter**\n   - **Justification**: Communication with the mother ship will be key for receiving guidance, potential rescue coordination, and confirming arrival. Its ranking remains unchanged as uninterrupted communication could also help locate the crew in an emergency.\n\n---\n\n### **5. Food Concentrate**\n   - **Justification**: Lightweight, nutrient-dense food provides critical energy required for the physically demanding journey on foot. It is ranked below oxygen, water, navigation, and communication due to their higher survival priority.\n\n---\n\n### **6. First Aid Kit**\n   - **Justification for Elevating**: Injuries during the trek are highly probable, and untreated wounds could become fatal (limits mobility, increases infection risk). Lunar terrain is sharp and irregular, increasing chances of injuries. This item is slightly re-prioritized over the nylon rope due to its direct life-saving utility.\n\n---\n\n### **7. 50 Feet of Nylon Rope**\n   - **Explanation for Demotion**: Rope\u2019s versatility is undeniable, but its primary benefit is for physical maneuvering over the terrain or securing items. While critical, it is less immediately life-preserving than the first aid kit.\n\n---\n\n### **8. Portable Heating Unit**\n   - **Justification**: Extreme drops in lunar temperature, especially on the dark side, make hypothermia a real concern during the journey. However, movement and specialized suits reduce the immediate necessity of portable heating compared to other survival tools.\n\n---\n\n### **9. Signal Flares**\n   - **Justification**: While not as essential as navigation tools, flares remain important for signaling the mother ship when the crew is approaching the rendezvous point or if lost. Their ranking holds steady.\n\n---\n\n### **10. Life Raft**\n   - **Justification**: A life raft's reflective surface can assist in signaling, and it offers some utility as a makeshift sled for carrying heavier equipment. Its usability makes it more valuable than parachute silk but still secondary to other tools.\n\n---\n\n### **11. Parachute Silk**\n   - **Justification**: Parachute silk's multiple potential uses (as a sunshade, insulating material, or protective fabric) make it moderately useful but secondary compared to other survival items.\n\n---\n\n### **12. One Case of Dehydrated Milk**\n   - **Justification**: Dehydrated milk requires water to rehydrate, which limits its practicality in a resource-scarce environment. It has some nutritional value but is more cumbersome than the food concentrate.\n\n---\n\n### **13. Magnetic Compass**\n   - **Justification**: A compass is essentially useless on the Moon because there is no significant magnetic field to work with. The stellar map fulfills the navigation needs completely, rendering this item ineffective.\n\n---\n\n### **14. Two .45-Caliber Pistols**\n   - **Justification**: Firearms have no practical purpose on the Moon because there is no wildlife or hostile entities. They only add unnecessary weight and might distract from focusing on actual survival needs.\n\n---\n\n### **15. Box of Matches**\n   - **Justification**: Matches are completely inoperative on the Moon as combustion requires oxygen in the ambient environment. This item serves no purpose for the mission and remains ranked last.\n\n---\n\n### **Final Ranking Order**\n1. Oxygen Tanks  \n2. Water  \n3. Stellar Map  \n4. Solar-Powered FM Receiver-Transmitter  \n5. Food Concentrate  \n6. First Aid Kit  \n7. 50 Feet of Nylon Rope  \n8. Portable Heating Unit  \n9. Signal Flares  \n10. Life Raft  \n11. Parachute Silk  \n12. One Case of Dehydrated Milk  \n13. Magnetic Compass  \n14. Two .45-Caliber Pistols  \n15. Box of Matches  \n\n### **Adjustments Summary**\n- Elevated **First Aid Kit** due to its direct life-saving potential.\n- Demoted **Nylon Rope** slightly to prioritize immediate medical needs over physical maneuvering tools.\n- Refined justifications to emphasize survival requirements in the specific technical context of the lunar environment.",
          "ranking": [
            "Oxygen tanks",
            "Water",
            "Stellar map",
            "Solar-powered FM receiver-transmitter",
            "Food concentrate",
            "First aid kit",
            "50 feet of nylon rope",
            "Portable heating unit",
            "Signal flares",
            "Life raft",
            "Parachute silk",
            "One case of dehydrated milk",
            "Magnetic compass",
            "Box of matches",
            "Two .45 caliber pistols"
          ]
        }
      ],
      "iterations": [
        {
          "iteration": 0,
          "current_ranking": [
            "Oxygen tanks",
            "Water",
            "Stellar map",
            "Solar-powered FM receiver-transmitter",
            "Food concentrate",
            "50 feet of nylon rope",
            "First aid kit",
            "Portable heating unit",
            "Signal flares",
            "Parachute silk",
            "Life raft",
            "One case of dehydrated milk",
            "Magnetic compass",
            "Box of matches",
            "Two .45 caliber pistols"
          ],
          "current_message": "Here is the ranking of the 15 lunar survival items for the 200-mile trek to the rendezvous point, along with explicit justifications for each:\n\n---\n\n### **Ranking of Lunar Survival Items**\n\n---\n\n### **1. Oxygen Tanks**\n   - **Justification**: Oxygen is the most critical resource for survival on the Moon, as the Moon has no atmosphere. Without it, survival is impossible. Multiple tanks ensure sufficient supply for the 200-mile journey to the rendezvous point.\n\n---\n\n### **2. Water**\n   - **Justification**: Water is vital for hydration and regulating body temperature during the trek. Dehydration becomes a major issue, especially in the harsh lunar environment where conditions can rapidly dehydrate a person.\n\n---\n\n### **3. Stellar Map (of the Moon\u2019s constellations)**\n   - **Justification**: Navigation is crucial for reaching the rendezvous point. A stellar map would help the crew orient themselves and determine the correct 200-mile path across the unmarked, barren lunar terrain.\n\n---\n\n### **4. Solar-Powered FM Receiver-Transmitter**\n   - **Justification**: This is essential for communication with the mother ship or rescue teams. Staying in contact increases the crew's chances of being located in case they go off course or encounter an emergency.\n\n---\n\n### **5. Food Concentrate**\n   - **Justification**: Although humans can survive longer without food than water, sustained energy is crucial for the physical demands of the journey. Food concentrate is lightweight and provides high nutritional value.\n\n---\n\n### **6. 50 Feet of Nylon Rope**\n   - **Justification**: Rope has multiple uses, such as assisting in climbing over craters and rough lunar terrain, securing items, or helping team members navigate difficult sections safely.\n\n---\n\n### **7. First Aid Kit**\n   - **Justification**: Injuries or health issues during the trek are likely. A first aid kit enables treatment of minor wounds or health conditions, which could otherwise impair progress or prove fatal.\n\n---\n\n### **8. Portable Heating Unit**\n   - **Justification**: The Moon experiences extreme temperature fluctuations, and the dark side can become extremely cold. A heating unit would protect the crew from hypothermia during colder periods but isn't ranked higher because heat can also be generated through movement or additional clothing layers.\n\n---\n\n### **9. Signal Flares**\n   - **Justification**: Flares could help attract the attention of the mother ship or other rescuers if the team gets lost or when approaching the destination. They are less critical than other navigation or survival tools but still useful for signaling.\n\n---\n\n### **10. Parachute Silk**\n   - **Justification**: This can serve multiple purposes, including use as a sunshade, insulating material, or additional protection. However, its utility is secondary to more pressing survival needs.\n\n---\n\n### **11. Life Raft**\n   - **Justification**: While it seems out of context for the Moon, the raft's reflective surface could help with signaling, and it could serve as a makeshift carrier for equipment. Its usefulness is relatively low compared to other items.\n\n---\n\n### **12. One Case of Dehydrated Milk**\n   - **Justification**: While a source of nutrition, dehydrated milk requires water to be rehydrated, which makes it less practical given the limited water supplies. Food concentrate is a more efficient energy source.\n\n---\n\n### **13. Magnetic Compass**\n   - **Justification**: A compass is useless on the Moon because the Moon lacks a significant magnetic field to provide orientation. Navigation would rely entirely on the stellar map instead.\n\n---\n\n### **14. Two .45-Caliber Pistols**\n   - **Justification**: Firearms have no practical use on the Moon, where there is no wildlife or threats requiring defense. They add unnecessary weight and consume resources for transport.\n\n---\n\n### **15. Box of Matches**\n   - **Justification**: Matches are completely useless in the Moon\u2019s oxygen-free environment, as fires cannot be lit. They provide no survival value for the journey.\n\n---\n\n### Final Thoughts:\nEach item's ranking is based on its utility, weight-to-importance ratio, and relevance to the conditions on the Moon. The most critical resources (oxygen, water, navigation tools, and communication equipment) are prioritized highest to ensure survival and a successful journey.",
          "current_agent": "resource"
        },
        {
          "iteration": 1,
          "current_ranking": [
            "Oxygen tanks",
            "Water",
            "Stellar map",
            "Solar-powered FM receiver-transmitter",
            "Food concentrate",
            "First aid kit",
            "50 feet of nylon rope",
            "Portable heating unit",
            "Signal flares",
            "Life raft",
            "Parachute silk",
            "One case of dehydrated milk",
            "Magnetic compass",
            "Box of matches",
            "Two .45 caliber pistols"
          ],
          "current_message": "### **Refined Ranking of Lunar Survival Items (200-mile trek)**\n\n---\n\n### **1. Oxygen Tanks**\n   - **Justification**: Oxygen remains the most vital resource for survival, as the Moon lacks breathable atmosphere. Without sufficient oxygen, death is inevitable. Ranked highest in importance as life cannot exist without it.\n\n---\n\n### **2. Water**\n   - **Justification**: Adequate hydration is crucial for physical endurance and temperature regulation during the trek. Water's importance is near-equivalent to oxygen, with scarcity being a major limitation in the lunar environment.\n\n---\n\n### **3. Stellar Map (of the Moon\u2019s constellations)**\n   - **Justification**: Navigation is essential to reaching the rendezvous point. Knowledge of the Moon\u2019s constellations will be the primary method of orientation since there are no landmarks on the lunar surface. I agree with the original ranking here.\n\n---\n\n### **4. Solar-Powered FM Receiver-Transmitter**\n   - **Justification**: Communication with the mother ship will be key for receiving guidance, potential rescue coordination, and confirming arrival. Its ranking remains unchanged as uninterrupted communication could also help locate the crew in an emergency.\n\n---\n\n### **5. Food Concentrate**\n   - **Justification**: Lightweight, nutrient-dense food provides critical energy required for the physically demanding journey on foot. It is ranked below oxygen, water, navigation, and communication due to their higher survival priority.\n\n---\n\n### **6. First Aid Kit**\n   - **Justification for Elevating**: Injuries during the trek are highly probable, and untreated wounds could become fatal (limits mobility, increases infection risk). Lunar terrain is sharp and irregular, increasing chances of injuries. This item is slightly re-prioritized over the nylon rope due to its direct life-saving utility.\n\n---\n\n### **7. 50 Feet of Nylon Rope**\n   - **Explanation for Demotion**: Rope\u2019s versatility is undeniable, but its primary benefit is for physical maneuvering over the terrain or securing items. While critical, it is less immediately life-preserving than the first aid kit.\n\n---\n\n### **8. Portable Heating Unit**\n   - **Justification**: Extreme drops in lunar temperature, especially on the dark side, make hypothermia a real concern during the journey. However, movement and specialized suits reduce the immediate necessity of portable heating compared to other survival tools.\n\n---\n\n### **9. Signal Flares**\n   - **Justification**: While not as essential as navigation tools, flares remain important for signaling the mother ship when the crew is approaching the rendezvous point or if lost. Their ranking holds steady.\n\n---\n\n### **10. Life Raft**\n   - **Justification**: A life raft's reflective surface can assist in signaling, and it offers some utility as a makeshift sled for carrying heavier equipment. Its usability makes it more valuable than parachute silk but still secondary to other tools.\n\n---\n\n### **11. Parachute Silk**\n   - **Justification**: Parachute silk's multiple potential uses (as a sunshade, insulating material, or protective fabric) make it moderately useful but secondary compared to other survival items.\n\n---\n\n### **12. One Case of Dehydrated Milk**\n   - **Justification**: Dehydrated milk requires water to rehydrate, which limits its practicality in a resource-scarce environment. It has some nutritional value but is more cumbersome than the food concentrate.\n\n---\n\n### **13. Magnetic Compass**\n   - **Justification**: A compass is essentially useless on the Moon because there is no significant magnetic field to work with. The stellar map fulfills the navigation needs completely, rendering this item ineffective.\n\n---\n\n### **14. Two .45-Caliber Pistols**\n   - **Justification**: Firearms have no practical purpose on the Moon because there is no wildlife or hostile entities. They only add unnecessary weight and might distract from focusing on actual survival needs.\n\n---\n\n### **15. Box of Matches**\n   - **Justification**: Matches are completely inoperative on the Moon as combustion requires oxygen in the ambient environment. This item serves no purpose for the mission and remains ranked last.\n\n---\n\n### **Final Ranking Order**\n1. Oxygen Tanks  \n2. Water  \n3. Stellar Map  \n4. Solar-Powered FM Receiver-Transmitter  \n5. Food Concentrate  \n6. First Aid Kit  \n7. 50 Feet of Nylon Rope  \n8. Portable Heating Unit  \n9. Signal Flares  \n10. Life Raft  \n11. Parachute Silk  \n12. One Case of Dehydrated Milk  \n13. Magnetic Compass  \n14. Two .45-Caliber Pistols  \n15. Box of Matches  \n\n### **Adjustments Summary**\n- Elevated **First Aid Kit** due to its direct life-saving potential.\n- Demoted **Nylon Rope** slightly to prioritize immediate medical needs over physical maneuvering tools.\n- Refined justifications to emphasize survival requirements in the specific technical context of the lunar environment.",
          "current_agent": "science",
          "difference_score": 4
        }
      ],
      "final_ranking": [
        "Oxygen tanks",
        "Water",
        "Stellar map",
        "Solar-powered FM receiver-transmitter",
        "Food concentrate",
        "First aid kit",
        "50 feet of nylon rope",
        "Portable heating unit",
        "Signal flares",
        "Life raft",
        "Parachute silk",
        "One case of dehydrated milk",
        "Magnetic compass",
        "Box of matches",
        "Two .45 caliber pistols"
      ],
      "final_message": "### **Refined Ranking of Lunar Survival Items (200-mile trek)**\n\n---\n\n### **1. Oxygen Tanks**\n   - **Justification**: Oxygen remains the most vital resource for survival, as the Moon lacks breathable atmosphere. Without sufficient oxygen, death is inevitable. Ranked highest in importance as life cannot exist without it.\n\n---\n\n### **2. Water**\n   - **Justification**: Adequate hydration is crucial for physical endurance and temperature regulation during the trek. Water's importance is near-equivalent to oxygen, with scarcity being a major limitation in the lunar environment.\n\n---\n\n### **3. Stellar Map (of the Moon\u2019s constellations)**\n   - **Justification**: Navigation is essential to reaching the rendezvous point. Knowledge of the Moon\u2019s constellations will be the primary method of orientation since there are no landmarks on the lunar surface. I agree with the original ranking here.\n\n---\n\n### **4. Solar-Powered FM Receiver-Transmitter**\n   - **Justification**: Communication with the mother ship will be key for receiving guidance, potential rescue coordination, and confirming arrival. Its ranking remains unchanged as uninterrupted communication could also help locate the crew in an emergency.\n\n---\n\n### **5. Food Concentrate**\n   - **Justification**: Lightweight, nutrient-dense food provides critical energy required for the physically demanding journey on foot. It is ranked below oxygen, water, navigation, and communication due to their higher survival priority.\n\n---\n\n### **6. First Aid Kit**\n   - **Justification for Elevating**: Injuries during the trek are highly probable, and untreated wounds could become fatal (limits mobility, increases infection risk). Lunar terrain is sharp and irregular, increasing chances of injuries. This item is slightly re-prioritized over the nylon rope due to its direct life-saving utility.\n\n---\n\n### **7. 50 Feet of Nylon Rope**\n   - **Explanation for Demotion**: Rope\u2019s versatility is undeniable, but its primary benefit is for physical maneuvering over the terrain or securing items. While critical, it is less immediately life-preserving than the first aid kit.\n\n---\n\n### **8. Portable Heating Unit**\n   - **Justification**: Extreme drops in lunar temperature, especially on the dark side, make hypothermia a real concern during the journey. However, movement and specialized suits reduce the immediate necessity of portable heating compared to other survival tools.\n\n---\n\n### **9. Signal Flares**\n   - **Justification**: While not as essential as navigation tools, flares remain important for signaling the mother ship when the crew is approaching the rendezvous point or if lost. Their ranking holds steady.\n\n---\n\n### **10. Life Raft**\n   - **Justification**: A life raft's reflective surface can assist in signaling, and it offers some utility as a makeshift sled for carrying heavier equipment. Its usability makes it more valuable than parachute silk but still secondary to other tools.\n\n---\n\n### **11. Parachute Silk**\n   - **Justification**: Parachute silk's multiple potential uses (as a sunshade, insulating material, or protective fabric) make it moderately useful but secondary compared to other survival items.\n\n---\n\n### **12. One Case of Dehydrated Milk**\n   - **Justification**: Dehydrated milk requires water to rehydrate, which limits its practicality in a resource-scarce environment. It has some nutritional value but is more cumbersome than the food concentrate.\n\n---\n\n### **13. Magnetic Compass**\n   - **Justification**: A compass is essentially useless on the Moon because there is no significant magnetic field to work with. The stellar map fulfills the navigation needs completely, rendering this item ineffective.\n\n---\n\n### **14. Two .45-Caliber Pistols**\n   - **Justification**: Firearms have no practical purpose on the Moon because there is no wildlife or hostile entities. They only add unnecessary weight and might distract from focusing on actual survival needs.\n\n---\n\n### **15. Box of Matches**\n   - **Justification**: Matches are completely inoperative on the Moon as combustion requires oxygen in the ambient environment. This item serves no purpose for the mission and remains ranked last.\n\n---\n\n### **Final Ranking Order**\n1. Oxygen Tanks  \n2. Water  \n3. Stellar Map  \n4. Solar-Powered FM Receiver-Transmitter  \n5. Food Concentrate  \n6. First Aid Kit  \n7. 50 Feet of Nylon Rope  \n8. Portable Heating Unit  \n9. Signal Flares  \n10. Life Raft  \n11. Parachute Silk  \n12. One Case of Dehydrated Milk  \n13. Magnetic Compass  \n14. Two .45-Caliber Pistols  \n15. Box of Matches  \n\n### **Adjustments Summary**\n- Elevated **First Aid Kit** due to its direct life-saving potential.\n- Demoted **Nylon Rope** slightly to prioritize immediate medical needs over physical maneuvering tools.\n- Refined justifications to emphasize survival requirements in the specific technical context of the lunar environment.",
      "score": 20
    }
  ],
  "final_ranking": [
    "Oxygen tanks",
    "Water",
    "Stellar map",
    "Solar-powered FM receiver-transmitter",
    "Food concentrate",
    "First aid kit",
    "50 feet of nylon rope",
    "Portable heating unit",
    "Signal flares",
    "Life raft",
    "Parachute silk",
    "One case of dehydrated milk",
    "Magnetic compass",
    "Box of matches",
    "Two .45 caliber pistols"
  ],
  "nasa_ranking": [
    "Oxygen tanks",
    "Water",
    "Stellar map",
    "Food concentrate",
    "Solar-powered FM receiver-transmitter",
    "50 feet of nylon rope",
    "First aid kit",
    "Parachute silk",
    "Life raft",
    "Signal flares",
    "Two .45 caliber pistols",
    "One case of dehydrated milk",
    "Portable heating unit",
    "Magnetic compass",
    "Box of matches"
  ],
  "score": 20,
  "teamwork_metrics": {
    "mutual_monitoring": {
      "total_monitoring_exchanges": 0,
      "total_issues_detected": 0,
      "avg_issues_per_exchange": 0.0,
      "issue_types": {},
      "issue_resolution_rate": 0.0,
      "team_monitoring_effectiveness": "low"
    }
  }
}