{
  "simulation_id": "sim_baseline_20250417_131728",
  "config": {
    "use_team_leadership": false,
    "use_closed_loop_comm": false,
    "use_mutual_monitoring": false,
    "use_shared_mental_model": false
  },
  "exchanges": [
    {
      "type": "sequential_refinement",
      "exchanges": [
        {
          "type": "initial_ranking",
          "role": "science",
          "message": "Here is my scientific analysis of the lunar environment and survival priorities during a 200-mile trek to the rendezvous point, with items ranked accordingly:\n\n### **Conditions Considered**\n- **Lack of Atmosphere:** The Moon has no atmosphere, meaning no breathable air and no weather conditions such as wind, but extreme temperature variations are a concern.\n- **Gravity:** Lunar gravity is 1/6th of Earth's, which may slightly reduce physical exertion but increases carrying challenges.\n- **Temperature Extremes:** Surface temperatures range from -173\u00b0C (-280\u00b0F) at night to 127\u00b0C (260\u00b0F) during the day.\n- **Lack of Liquid Water:** No water exists on the surface; hydration is a priority.\n- **No Magnetic Field:** A magnetic compass won\u2019t work on the Moon.\n- **Solar Navigation:** Navigation using the Sun, stars, and landmarks is possible.\n\n### **Ranked List of Items**\n1. **Oxygen Tanks**  \n   - **Justification:** Oxygen is essential for life support as there is no breathable air on the Moon. Without sufficient oxygen, survival is impossible. \n\n2. **Water**  \n   - **Justification:** Dehydration will quickly become life-threatening, especially when traversing the harsh lunar surface over a 200-mile trek. Supplementary hydration is critical.\n\n3. **Stellar Map**  \n   - **Justification:** GPS systems aren't operational on the Moon, so a stellar map provides the best method for navigation. Celestial bodies serve as reliable fixed reference points.\n\n4. **Solar-Powered FM Receiver-Transmitter**  \n   - **Justification:** This device can communicate with the mother ship in case of emergencies and assist with receiving critical guidance or status updates.\n\n5. **Food Concentrate**  \n   - **Justification:** Compact food provides necessary calories and nutrients for maintaining physical energy during the trek. Limited food is needed, as the journey is relatively short at 200 miles under minimal gravity.\n\n6. **First Aid Kit**  \n   - **Justification:** Injuries, even minor ones, can become significant in hostile environments. A first aid kit ensures basic medical needs can be addressed.\n\n7. **Portable Heating Unit**  \n   - **Justification:** Lunar nights are extremely cold, and temperatures can drop to life-threatening levels. A heating unit is essential to maintain body temperature during extreme cold periods.\n\n8. **50 Feet of Nylon Rope**  \n   - **Justification:** Rope can assist in traversing craters or uneven terrain, or securing items. It\u2019s versatile and lightweight, making it useful in multiple survival scenarios.\n\n9. **Signal Flares**  \n   - **Justification:** These can be used to signal the mother ship or any rescue party. Their usage opportunities are limited but could prove vital for location identification.\n\n10. **Parachute Silk**  \n   - **Justification:** The silk can be used for insulation, sun protection, or as a carrying sling to manage gear. It has some survival utility but is not critical.\n\n11. **Two .45-Caliber Pistols**  \n   - **Justification:** While they have no practical use in space (no oxygen for combustion), they might serve as a hammer for assembling or breaking objects, or as a potential signaling tool through sound or impact.\n\n12. **Life Raft**  \n   - **Justification:** This item has limited purpose on the Moon, except possibly for providing insulation if sealed or for carrying supplies. Otherwise, its weight is a hindrance.\n\n13. **One Case of Dehydrated Milk**  \n   - **Justification:** Dehydrated milk is less compact and less calorie-efficient than food concentrate, making it a lower-priority food source.\n\n14. **Magnetic Compass**  \n   - **Justification:** The Moon lacks a magnetic field, rendering a magnetic compass completely useless for navigation purposes on the lunar surface.\n\n15. **Box of Matches**  \n   - **Justification:** Matches require oxygen to ignite, and there is none on the Moon. This item has no functional value.\n\n---\n\n### **Summary**\nThe top priorities revolve around breathing, hydration, navigation, and communication, followed by thermal insulation, medical readiness, and energy sustenance. Tools such as rope or flares are helpful but secondary. Items like the magnetic compass and matches, which are entirely non-functional in the Moon\u2019s environment, are ranked lowest.",
          "ranking": [
            "Oxygen tanks",
            "Water",
            "Stellar map",
            "Solar-powered FM receiver-transmitter",
            "Food concentrate",
            "First aid kit",
            "Portable heating unit",
            "50 feet of nylon rope",
            "Signal flares",
            "Parachute silk",
            "Life raft",
            "One case of dehydrated milk",
            "Magnetic compass",
            "Box of matches",
            "Two .45 caliber pistols"
          ]
        },
        {
          "type": "refinement",
          "iteration": 1,
          "role": "resource",
          "message": "### **Refined Ranking of Lunar Survival Items**\n\nAs a Resource Manager focused on optimizing survival resources, I have reviewed the list, incorporating considerations of utility, weight-to-value ratio, and lunar environmental constraints. Below is my refined ranking, including adjustments where necessary, as well as brief justifications.\n\n---\n\n### **Refined Ranked List**\n\n1. **Oxygen Tanks**  \n   - **Justification:** Absolutely critical for survival on the Moon. Without breathable air, oxygen is the single most essential item.  \n   **Current Rank Agreed: No Change.**\n\n2. **Water**  \n   - **Justification:** Hydration is vital for survival. Dehydration can cause physical and cognitive impairments, which would compromise the ability to navigate and trek 200 miles.  \n   **Current Rank Agreed: No Change.**\n\n3. **Stellar Map**  \n   - **Justification:** The primary tool for navigation in the absence of GPS. Fixed celestial reference points will ensure accurate directional progress toward the rendezvous point.  \n   **Current Rank Agreed: No Change.**\n\n4. **Solar-Powered FM Receiver-Transmitter**  \n   - **Justification:** Communication with the mother ship or rescue team can be critical for adjustments in the route, contingency planning, or emergency coordination.  \n   **Current Rank Agreed: No Change.**\n\n5. **Portable Heating Unit**  \n   - **Justification for Change:** The current rank of 7 is too low. Lunar night temperatures are life-threatening (-173\u00b0C/-280\u00b0F), making thermal regulation essential. This item would be critical during resting periods or if delays occur en route. It deserves a higher ranking than food concentrate because surviving extreme cold takes precedence over calorie intake if temperatures become immediately hostile.  \n   **New Rank: 5 (Moved up).**\n\n6. **Food Concentrate**  \n   - **Justification for Change:** Compact and calorie-dense food is essential; however, the provisions required for a trip of this duration are limited compared to the more immediate needs for thermal regulation, navigation, hydration, and oxygen.  \n   **Current rank adjusted from 5 down to 6.**\n\n7. **First Aid Kit**  \n   - **Justification:** Remaining healthy and mobile is crucial. Even minor injuries can lead to serious complications in a hostile environment. The first aid kit ensures basic medical survival needs.  \n   **Current Rank Agreed: No Change.**\n\n8. **50 Feet of Nylon Rope**  \n   - **Justification:** Extremely versatile for traversing craters, securing equipment, or assisting in movement over uneven terrain. Lightweight and easy to carry.  \n   **Current Rank Agreed: No Change.**\n\n9. **Signal Flares**  \n   - **Justification:** A vital tool for signaling the mother ship or a rescue operation, particularly if you veer off course or need to highlight your location.  \n   **Current Rank Agreed: No Change.**\n\n10. **Parachute Silk**  \n   - **Justification:** Useful for insulation, sun protection, or fabricating a carrying sling for gear. While versatile, its utility is less immediately critical than items ranked higher.  \n   **Current Rank Agreed: No Change.**\n\n11. **Two .45-Caliber Pistols**  \n   - **Justification:** The only realistic uses for the pistols\u2014impact tools for breaking objects or potential signaling (via sound/impact)\u2014are highly situational. Limited utility places this item low on the list.  \n   **Current Rank Agreed: No Change.**\n\n12. **Life Raft**  \n   - **Justification:** Lacks direct utility for most lunar survival scenarios. Potentially could be used to carry gear or as insulation if sealed, but it's bulky and of lower priority compared to similarly flexible tools like parachute silk.  \n   **Current Rank Agreed: No Change.**\n\n13. **One Case of Dehydrated Milk**  \n   - **Justification:** Provides limited calorie return for its weight relative to food concentrate. Nutritional redundancy places it low on the priority list.  \n   **Current Rank Agreed: No Change.**\n\n14. **Magnetic Compass**  \n   - **Justification:** The Moon lacks a magnetic field, making the compass entirely non-functional for navigation.  \n   **Current Rank Agreed: No Change.**\n\n15. **Box of Matches**  \n   - **Justification:** Matches require oxygen to ignite, and there is no oxygen in the lunar environment. Completely useless.  \n   **Current Rank Agreed: No Change.**\n\n---\n\n### **Summary of Changes**\n- **Portable Heating Unit** is elevated from rank 7 to rank 5 due to the immediate necessity of thermal regulation during lunar night conditions.\n- **Food Concentrate** is adjusted downward from rank 5 to rank 6, as calorie requirements, while important, take lower priority than combatting extreme cold survival threats.\n\n---\n\n### **Final Ranking**\n1. Oxygen Tanks  \n2. Water  \n3. Stellar Map  \n4. Solar-Powered FM Receiver-Transmitter  \n5. Portable Heating Unit  \n6. Food Concentrate  \n7. First Aid Kit  \n8. 50 Feet of Nylon Rope  \n9. Signal Flares  \n10. Parachute Silk  \n11. Two .45-Caliber Pistols  \n12. Life Raft  \n13. One Case of Dehydrated Milk  \n14. Magnetic Compass  \n15. Box of Matches  \n\nThis refined order prioritizes physiological survival (oxygen, hydration, thermal regulation), navigational accuracy, and emergency communication, followed by tools for injury management, terrain navigation, and secondary needs.",
          "ranking": [
            "Oxygen tanks",
            "Water",
            "Stellar map",
            "Solar-powered FM receiver-transmitter",
            "Portable heating unit",
            "Food concentrate",
            "First aid kit",
            "50 feet of nylon rope",
            "Signal flares",
            "Parachute silk",
            "Life raft",
            "One case of dehydrated milk",
            "Magnetic compass",
            "Box of matches",
            "Two .45 caliber pistols"
          ]
        }
      ],
      "iterations": [
        {
          "iteration": 0,
          "current_ranking": [
            "Oxygen tanks",
            "Water",
            "Stellar map",
            "Solar-powered FM receiver-transmitter",
            "Food concentrate",
            "First aid kit",
            "Portable heating unit",
            "50 feet of nylon rope",
            "Signal flares",
            "Parachute silk",
            "Life raft",
            "One case of dehydrated milk",
            "Magnetic compass",
            "Box of matches",
            "Two .45 caliber pistols"
          ],
          "current_message": "Here is my scientific analysis of the lunar environment and survival priorities during a 200-mile trek to the rendezvous point, with items ranked accordingly:\n\n### **Conditions Considered**\n- **Lack of Atmosphere:** The Moon has no atmosphere, meaning no breathable air and no weather conditions such as wind, but extreme temperature variations are a concern.\n- **Gravity:** Lunar gravity is 1/6th of Earth's, which may slightly reduce physical exertion but increases carrying challenges.\n- **Temperature Extremes:** Surface temperatures range from -173\u00b0C (-280\u00b0F) at night to 127\u00b0C (260\u00b0F) during the day.\n- **Lack of Liquid Water:** No water exists on the surface; hydration is a priority.\n- **No Magnetic Field:** A magnetic compass won\u2019t work on the Moon.\n- **Solar Navigation:** Navigation using the Sun, stars, and landmarks is possible.\n\n### **Ranked List of Items**\n1. **Oxygen Tanks**  \n   - **Justification:** Oxygen is essential for life support as there is no breathable air on the Moon. Without sufficient oxygen, survival is impossible. \n\n2. **Water**  \n   - **Justification:** Dehydration will quickly become life-threatening, especially when traversing the harsh lunar surface over a 200-mile trek. Supplementary hydration is critical.\n\n3. **Stellar Map**  \n   - **Justification:** GPS systems aren't operational on the Moon, so a stellar map provides the best method for navigation. Celestial bodies serve as reliable fixed reference points.\n\n4. **Solar-Powered FM Receiver-Transmitter**  \n   - **Justification:** This device can communicate with the mother ship in case of emergencies and assist with receiving critical guidance or status updates.\n\n5. **Food Concentrate**  \n   - **Justification:** Compact food provides necessary calories and nutrients for maintaining physical energy during the trek. Limited food is needed, as the journey is relatively short at 200 miles under minimal gravity.\n\n6. **First Aid Kit**  \n   - **Justification:** Injuries, even minor ones, can become significant in hostile environments. A first aid kit ensures basic medical needs can be addressed.\n\n7. **Portable Heating Unit**  \n   - **Justification:** Lunar nights are extremely cold, and temperatures can drop to life-threatening levels. A heating unit is essential to maintain body temperature during extreme cold periods.\n\n8. **50 Feet of Nylon Rope**  \n   - **Justification:** Rope can assist in traversing craters or uneven terrain, or securing items. It\u2019s versatile and lightweight, making it useful in multiple survival scenarios.\n\n9. **Signal Flares**  \n   - **Justification:** These can be used to signal the mother ship or any rescue party. Their usage opportunities are limited but could prove vital for location identification.\n\n10. **Parachute Silk**  \n   - **Justification:** The silk can be used for insulation, sun protection, or as a carrying sling to manage gear. It has some survival utility but is not critical.\n\n11. **Two .45-Caliber Pistols**  \n   - **Justification:** While they have no practical use in space (no oxygen for combustion), they might serve as a hammer for assembling or breaking objects, or as a potential signaling tool through sound or impact.\n\n12. **Life Raft**  \n   - **Justification:** This item has limited purpose on the Moon, except possibly for providing insulation if sealed or for carrying supplies. Otherwise, its weight is a hindrance.\n\n13. **One Case of Dehydrated Milk**  \n   - **Justification:** Dehydrated milk is less compact and less calorie-efficient than food concentrate, making it a lower-priority food source.\n\n14. **Magnetic Compass**  \n   - **Justification:** The Moon lacks a magnetic field, rendering a magnetic compass completely useless for navigation purposes on the lunar surface.\n\n15. **Box of Matches**  \n   - **Justification:** Matches require oxygen to ignite, and there is none on the Moon. This item has no functional value.\n\n---\n\n### **Summary**\nThe top priorities revolve around breathing, hydration, navigation, and communication, followed by thermal insulation, medical readiness, and energy sustenance. Tools such as rope or flares are helpful but secondary. Items like the magnetic compass and matches, which are entirely non-functional in the Moon\u2019s environment, are ranked lowest.",
          "current_agent": "science"
        },
        {
          "iteration": 1,
          "current_ranking": [
            "Oxygen tanks",
            "Water",
            "Stellar map",
            "Solar-powered FM receiver-transmitter",
            "Portable heating unit",
            "Food concentrate",
            "First aid kit",
            "50 feet of nylon rope",
            "Signal flares",
            "Parachute silk",
            "Life raft",
            "One case of dehydrated milk",
            "Magnetic compass",
            "Box of matches",
            "Two .45 caliber pistols"
          ],
          "current_message": "### **Refined Ranking of Lunar Survival Items**\n\nAs a Resource Manager focused on optimizing survival resources, I have reviewed the list, incorporating considerations of utility, weight-to-value ratio, and lunar environmental constraints. Below is my refined ranking, including adjustments where necessary, as well as brief justifications.\n\n---\n\n### **Refined Ranked List**\n\n1. **Oxygen Tanks**  \n   - **Justification:** Absolutely critical for survival on the Moon. Without breathable air, oxygen is the single most essential item.  \n   **Current Rank Agreed: No Change.**\n\n2. **Water**  \n   - **Justification:** Hydration is vital for survival. Dehydration can cause physical and cognitive impairments, which would compromise the ability to navigate and trek 200 miles.  \n   **Current Rank Agreed: No Change.**\n\n3. **Stellar Map**  \n   - **Justification:** The primary tool for navigation in the absence of GPS. Fixed celestial reference points will ensure accurate directional progress toward the rendezvous point.  \n   **Current Rank Agreed: No Change.**\n\n4. **Solar-Powered FM Receiver-Transmitter**  \n   - **Justification:** Communication with the mother ship or rescue team can be critical for adjustments in the route, contingency planning, or emergency coordination.  \n   **Current Rank Agreed: No Change.**\n\n5. **Portable Heating Unit**  \n   - **Justification for Change:** The current rank of 7 is too low. Lunar night temperatures are life-threatening (-173\u00b0C/-280\u00b0F), making thermal regulation essential. This item would be critical during resting periods or if delays occur en route. It deserves a higher ranking than food concentrate because surviving extreme cold takes precedence over calorie intake if temperatures become immediately hostile.  \n   **New Rank: 5 (Moved up).**\n\n6. **Food Concentrate**  \n   - **Justification for Change:** Compact and calorie-dense food is essential; however, the provisions required for a trip of this duration are limited compared to the more immediate needs for thermal regulation, navigation, hydration, and oxygen.  \n   **Current rank adjusted from 5 down to 6.**\n\n7. **First Aid Kit**  \n   - **Justification:** Remaining healthy and mobile is crucial. Even minor injuries can lead to serious complications in a hostile environment. The first aid kit ensures basic medical survival needs.  \n   **Current Rank Agreed: No Change.**\n\n8. **50 Feet of Nylon Rope**  \n   - **Justification:** Extremely versatile for traversing craters, securing equipment, or assisting in movement over uneven terrain. Lightweight and easy to carry.  \n   **Current Rank Agreed: No Change.**\n\n9. **Signal Flares**  \n   - **Justification:** A vital tool for signaling the mother ship or a rescue operation, particularly if you veer off course or need to highlight your location.  \n   **Current Rank Agreed: No Change.**\n\n10. **Parachute Silk**  \n   - **Justification:** Useful for insulation, sun protection, or fabricating a carrying sling for gear. While versatile, its utility is less immediately critical than items ranked higher.  \n   **Current Rank Agreed: No Change.**\n\n11. **Two .45-Caliber Pistols**  \n   - **Justification:** The only realistic uses for the pistols\u2014impact tools for breaking objects or potential signaling (via sound/impact)\u2014are highly situational. Limited utility places this item low on the list.  \n   **Current Rank Agreed: No Change.**\n\n12. **Life Raft**  \n   - **Justification:** Lacks direct utility for most lunar survival scenarios. Potentially could be used to carry gear or as insulation if sealed, but it's bulky and of lower priority compared to similarly flexible tools like parachute silk.  \n   **Current Rank Agreed: No Change.**\n\n13. **One Case of Dehydrated Milk**  \n   - **Justification:** Provides limited calorie return for its weight relative to food concentrate. Nutritional redundancy places it low on the priority list.  \n   **Current Rank Agreed: No Change.**\n\n14. **Magnetic Compass**  \n   - **Justification:** The Moon lacks a magnetic field, making the compass entirely non-functional for navigation.  \n   **Current Rank Agreed: No Change.**\n\n15. **Box of Matches**  \n   - **Justification:** Matches require oxygen to ignite, and there is no oxygen in the lunar environment. Completely useless.  \n   **Current Rank Agreed: No Change.**\n\n---\n\n### **Summary of Changes**\n- **Portable Heating Unit** is elevated from rank 7 to rank 5 due to the immediate necessity of thermal regulation during lunar night conditions.\n- **Food Concentrate** is adjusted downward from rank 5 to rank 6, as calorie requirements, while important, take lower priority than combatting extreme cold survival threats.\n\n---\n\n### **Final Ranking**\n1. Oxygen Tanks  \n2. Water  \n3. Stellar Map  \n4. Solar-Powered FM Receiver-Transmitter  \n5. Portable Heating Unit  \n6. Food Concentrate  \n7. First Aid Kit  \n8. 50 Feet of Nylon Rope  \n9. Signal Flares  \n10. Parachute Silk  \n11. Two .45-Caliber Pistols  \n12. Life Raft  \n13. One Case of Dehydrated Milk  \n14. Magnetic Compass  \n15. Box of Matches  \n\nThis refined order prioritizes physiological survival (oxygen, hydration, thermal regulation), navigational accuracy, and emergency communication, followed by tools for injury management, terrain navigation, and secondary needs.",
          "current_agent": "resource",
          "difference_score": 4
        }
      ],
      "final_ranking": [
        "Oxygen tanks",
        "Water",
        "Stellar map",
        "Solar-powered FM receiver-transmitter",
        "Portable heating unit",
        "Food concentrate",
        "First aid kit",
        "50 feet of nylon rope",
        "Signal flares",
        "Parachute silk",
        "Life raft",
        "One case of dehydrated milk",
        "Magnetic compass",
        "Box of matches",
        "Two .45 caliber pistols"
      ],
      "final_message": "### **Refined Ranking of Lunar Survival Items**\n\nAs a Resource Manager focused on optimizing survival resources, I have reviewed the list, incorporating considerations of utility, weight-to-value ratio, and lunar environmental constraints. Below is my refined ranking, including adjustments where necessary, as well as brief justifications.\n\n---\n\n### **Refined Ranked List**\n\n1. **Oxygen Tanks**  \n   - **Justification:** Absolutely critical for survival on the Moon. Without breathable air, oxygen is the single most essential item.  \n   **Current Rank Agreed: No Change.**\n\n2. **Water**  \n   - **Justification:** Hydration is vital for survival. Dehydration can cause physical and cognitive impairments, which would compromise the ability to navigate and trek 200 miles.  \n   **Current Rank Agreed: No Change.**\n\n3. **Stellar Map**  \n   - **Justification:** The primary tool for navigation in the absence of GPS. Fixed celestial reference points will ensure accurate directional progress toward the rendezvous point.  \n   **Current Rank Agreed: No Change.**\n\n4. **Solar-Powered FM Receiver-Transmitter**  \n   - **Justification:** Communication with the mother ship or rescue team can be critical for adjustments in the route, contingency planning, or emergency coordination.  \n   **Current Rank Agreed: No Change.**\n\n5. **Portable Heating Unit**  \n   - **Justification for Change:** The current rank of 7 is too low. Lunar night temperatures are life-threatening (-173\u00b0C/-280\u00b0F), making thermal regulation essential. This item would be critical during resting periods or if delays occur en route. It deserves a higher ranking than food concentrate because surviving extreme cold takes precedence over calorie intake if temperatures become immediately hostile.  \n   **New Rank: 5 (Moved up).**\n\n6. **Food Concentrate**  \n   - **Justification for Change:** Compact and calorie-dense food is essential; however, the provisions required for a trip of this duration are limited compared to the more immediate needs for thermal regulation, navigation, hydration, and oxygen.  \n   **Current rank adjusted from 5 down to 6.**\n\n7. **First Aid Kit**  \n   - **Justification:** Remaining healthy and mobile is crucial. Even minor injuries can lead to serious complications in a hostile environment. The first aid kit ensures basic medical survival needs.  \n   **Current Rank Agreed: No Change.**\n\n8. **50 Feet of Nylon Rope**  \n   - **Justification:** Extremely versatile for traversing craters, securing equipment, or assisting in movement over uneven terrain. Lightweight and easy to carry.  \n   **Current Rank Agreed: No Change.**\n\n9. **Signal Flares**  \n   - **Justification:** A vital tool for signaling the mother ship or a rescue operation, particularly if you veer off course or need to highlight your location.  \n   **Current Rank Agreed: No Change.**\n\n10. **Parachute Silk**  \n   - **Justification:** Useful for insulation, sun protection, or fabricating a carrying sling for gear. While versatile, its utility is less immediately critical than items ranked higher.  \n   **Current Rank Agreed: No Change.**\n\n11. **Two .45-Caliber Pistols**  \n   - **Justification:** The only realistic uses for the pistols\u2014impact tools for breaking objects or potential signaling (via sound/impact)\u2014are highly situational. Limited utility places this item low on the list.  \n   **Current Rank Agreed: No Change.**\n\n12. **Life Raft**  \n   - **Justification:** Lacks direct utility for most lunar survival scenarios. Potentially could be used to carry gear or as insulation if sealed, but it's bulky and of lower priority compared to similarly flexible tools like parachute silk.  \n   **Current Rank Agreed: No Change.**\n\n13. **One Case of Dehydrated Milk**  \n   - **Justification:** Provides limited calorie return for its weight relative to food concentrate. Nutritional redundancy places it low on the priority list.  \n   **Current Rank Agreed: No Change.**\n\n14. **Magnetic Compass**  \n   - **Justification:** The Moon lacks a magnetic field, making the compass entirely non-functional for navigation.  \n   **Current Rank Agreed: No Change.**\n\n15. **Box of Matches**  \n   - **Justification:** Matches require oxygen to ignite, and there is no oxygen in the lunar environment. Completely useless.  \n   **Current Rank Agreed: No Change.**\n\n---\n\n### **Summary of Changes**\n- **Portable Heating Unit** is elevated from rank 7 to rank 5 due to the immediate necessity of thermal regulation during lunar night conditions.\n- **Food Concentrate** is adjusted downward from rank 5 to rank 6, as calorie requirements, while important, take lower priority than combatting extreme cold survival threats.\n\n---\n\n### **Final Ranking**\n1. Oxygen Tanks  \n2. Water  \n3. Stellar Map  \n4. Solar-Powered FM Receiver-Transmitter  \n5. Portable Heating Unit  \n6. Food Concentrate  \n7. First Aid Kit  \n8. 50 Feet of Nylon Rope  \n9. Signal Flares  \n10. Parachute Silk  \n11. Two .45-Caliber Pistols  \n12. Life Raft  \n13. One Case of Dehydrated Milk  \n14. Magnetic Compass  \n15. Box of Matches  \n\nThis refined order prioritizes physiological survival (oxygen, hydration, thermal regulation), navigational accuracy, and emergency communication, followed by tools for injury management, terrain navigation, and secondary needs.",
      "score": 24
    }
  ],
  "final_ranking": [
    "Oxygen tanks",
    "Water",
    "Stellar map",
    "Solar-powered FM receiver-transmitter",
    "Portable heating unit",
    "Food concentrate",
    "First aid kit",
    "50 feet of nylon rope",
    "Signal flares",
    "Parachute silk",
    "Life raft",
    "One case of dehydrated milk",
    "Magnetic compass",
    "Box of matches",
    "Two .45 caliber pistols"
  ],
  "nasa_ranking": [
    "Oxygen tanks",
    "Water",
    "Stellar map",
    "Food concentrate",
    "Solar-powered FM receiver-transmitter",
    "50 feet of nylon rope",
    "First aid kit",
    "Parachute silk",
    "Life raft",
    "Signal flares",
    "Two .45 caliber pistols",
    "One case of dehydrated milk",
    "Portable heating unit",
    "Magnetic compass",
    "Box of matches"
  ],
  "score": 24,
  "teamwork_metrics": {}
}