{
  "simulation_id": "sim_leadership_closed_loop_mutual_monitoring_shared_mental_model_20250417_135917",
  "config": {
    "use_team_leadership": true,
    "use_closed_loop_comm": true,
    "use_mutual_monitoring": true,
    "use_shared_mental_model": true
  },
  "exchanges": [
    {
      "type": "sequential_refinement",
      "exchanges": [
        {
          "type": "initial_ranking",
          "role": "science",
          "message": "### **Initial Ranking of Lunar Survival Items**\n\nBased on the lunar environment and survival priorities outlined, here is the proposed ranking of the items, accompanied by scientific justifications:\n\n#### **1. Oxygen Tanks**\n- **Justification:** Oxygen is the highest priority on the Moon due to the vacuum environment; survival is impossible without it. A reliable supply is needed to sustain life during the 200-mile trek.\n\n#### **2. Water**\n- **Justification:** Water is critical for hydration, regulating body temperature, and survival. In a low-humidity environment such as the Moon, fluid loss can quickly lead to dehydration and impaired physiological function.\n\n#### **3. Stellar Map**\n- **Justification:** Navigation is crucial to reach the rendezvous point 200 miles away. A stellar map can help orient the team using celestial objects since GPS systems cannot be used in a lunar environment.\n\n#### **4. Solar-Powered FM Receiver-Transmitter**\n- **Justification:** Communication with the mother ship is vital for coordination, emergencies, and guidance. A solar-powered unit ensures operation during the trek without dependence on battery life.\n\n#### **5. Portable Heating Unit**\n- **Justification:** Temperature regulation is critical to avoid hypothermia during periods of shadow where temperatures can plunge to -250\u00b0F. While spacesuits provide insulation, additional heating may be necessary to maintain functionality.\n\n#### **6. Food Concentrate**\n- **Justification:** High-energy food concentrate is essential to sustain physical performance during the trek. Given the Moon\u2019s low gravity, movement requires less energy than on Earth but will still consume significant calories.\n\n#### **7. 50 Feet of Nylon Rope**\n- **Justification:** A rope is versatile and can aid in climbing craters, securing equipment, or assisting injured team members. Its strength and light weight make it practical for lunar exploration.\n\n#### **8. First Aid Kit**\n- **Justification:** The lunar environment poses physical hazards like falls, injuries, or radiation exposure. Basic medical supplies can address minor injuries, prevent infection, and stabilize conditions during the journey.\n\n#### **9. Signal Flares**\n- **Justification:** Though visibility is high during the day on the Moon\u2019s illuminated side, signal flares could help the mother ship locate the team upon arrival or in an emergency.\n\n#### **10. Parachute Silk**\n- **Justification:** Parachute silk can provide shade during high temperatures or protection from direct solar radiation. It could also be used for carrying items or creating a makeshift shelter.\n\n#### **11. Magnetic Compass**\n- **Justification:** A compass has limited utility on the Moon due to the absence of a global magnetic field. Navigation on the Moon must rely on visual references like craters and celestial objects.\n\n#### **12. One Case of Dehydrated Milk**\n- **Justification:** While it provides sustenance, dehydrated milk is bulky and requires water to rehydrate, reducing its practicality compared to food concentrate. It ranks lower due to logistical challenges.\n\n#### **13. Life Raft**\n- **Justification:** A life raft has limited utility on the Moon's solid surface. It could theoretically be used to transport items, but its weight and bulkiness make it less practical for a trek.\n\n#### **14. Two .45 Caliber Pistols**\n- **Justification:** Firearms have virtually no utility in the lunar environment since there are no predators or threats. They add unnecessary weight and complexity to the trek.\n\n#### **15. Box of Matches**\n- **Justification:** Matches are completely useless in the lunar vacuum, as combustion requires oxygen. This item has no scientific practicality and ranks last.\n\n---\n\n### **Summary of Approach**\nThis ranking prioritizes survival essentials such as oxygen, water, and navigation tools while de-emphasizing items with limited or no utility in the lunar environment (e.g., matches, firearms). Extreme conditions such as vacuum, radiation, and temperature swings, combined with the need for mobility during the 200-mile trek, informed the choices.\n\nI welcome team feedback and discussion to refine this ranking further. Please confirm receipt and understanding of this list, and provide any alternative perspectives or input for consideration.",
          "ranking": [
            "Oxygen tanks",
            "Water",
            "Stellar map",
            "Solar-powered FM receiver-transmitter",
            "Portable heating unit",
            "Food concentrate",
            "50 feet of nylon rope",
            "First aid kit",
            "Signal flares",
            "Parachute silk",
            "Magnetic compass",
            "One case of dehydrated milk",
            "Life raft",
            "Two .45 caliber pistols",
            "Box of matches"
          ]
        },
        {
          "type": "refinement",
          "iteration": 1,
          "role": "resource",
          "message": "### **Refined Ranking of Lunar Survival Items**\n\nBased on my expertise as a Resource Manager, I have carefully analyzed each item\u2019s utility, weight, and practicality for the survival trek. Below is my refined ranking and brief justifications for each position, including adjustments where necessary.\n\n---\n\n#### **1. Oxygen Tanks**\n**Justification:** Oxygen is non-negotiable for survival in the vacuum of the lunar environment. It should remain the highest priority.  \n**No change from original ranking.**\n\n#### **2. Water**\n**Justification:** Hydration is vital, particularly in the Moon\u2019s low-humidity conditions, which can exacerbate fluid loss. Water is critical for thermal regulation, physiological function, and rehydration of dehydrated food if necessary.  \n**No change from original ranking.**\n\n#### **3. Solar-Powered FM Receiver-Transmitter**\n**Change Explanation:** Communication with the mother ship is paramount for coordination, guidance, and emergency support during the trek. I suggest moving this item up from position #4 to #3, as communication can impact survival directly by facilitating rescue operations or troubleshooting during navigation. **Specialized Insight:** The benefit of active communication outweighs even the stellar map; if the trek is disoriented, guidance via communication could save lives.  \n\n#### **4. Stellar Map**  \n**Change Explanation:** While navigation is crucial, it becomes secondary to real-time communication support. I propose moving this down from position #3 to #4. **Specialized Insight:** The stellar map\u2019s passive nature (visual reference only) is less dynamic than active communication methods.  \n\n#### **5. Portable Heating Unit**\n**Justification:** Temperature regulation is critical for survival, especially during prolonged shadow periods where temperatures can plunge to extreme lows. Spacesuits provide insulation but are not sufficient alone in these conditions.  \n**No change from original ranking.**\n\n#### **6. Food Concentrate**\n**Justification:** High-energy food concentrate is compact and efficient for physical sustenance, especially given the calorie expenditure required for an extended trek.  \n**No change from original ranking.**\n\n#### **7. First Aid Kit**\n**Change Explanation:** I suggest moving this item up from position #8 to #7. **Specialized Insight:** The lunar environment\u2019s physical hazards (falls, injuries, radiation exposure) pose significant risks, making immediate access to medical supplies more important than nylon rope. Staging first aid supplies higher reflects its direct impact on crew health during emergencies.  \n\n#### **8. 50 Feet of Nylon Rope**\n**Justification:** Nylon rope remains highly versatile for securing or repairing equipment, assisting injured crew, or dealing with the lunar terrain during the trek.  \n**Moved down from position #7 to #8 to prioritize first aid kit.**\n\n#### **9. Signal Flares**\n**Justification:** Signal flares provide additional visibility and could aid the mother ship in locating the crew. While less critical during the trek itself, this item is important for rendezvous.  \n**No change from original ranking.**\n\n#### **10. Parachute Silk**\n**Justification:** Parachute silk provides utility as a shade against intense solar radiation, a lightweight carry-all, or a makeshift shelter. Its utility makes this suitable for mid-tier prioritization.  \n**No change from original ranking.**\n\n#### **11. Life Raft**\n**Change Explanation:** While it may provide limited use for transporting supplies, its size and bulk make it less practical during the trek. I propose moving this item down from position #13 to #11, above items with even lower utility. **Specialized Insight:** The raft edges out dehydrated milk in terms of logistical flexibility despite its inefficiency.  \n\n#### **12. One Case of Dehydrated Milk**\n**Justification:** While dehydrated milk can provide sustenance, it is bulky and requires water to prepare, which drains essential resources. Its below-average utility places it lower in ranking.  \n**No change from original ranking.**\n\n#### **13. Two .45 Caliber Pistols**\n**Change Explanation:** These firearms have virtually no survival utility but rank marginally above matches due to potential use for crafting tools or securing items. They remain near the bottom of the list but could hypothetically serve as a last-resort functionality. **Specialized Insight:** Suggest moving pistols up from position #14 to #13.  \n\n#### **14. Magnetic Compass**\n**Change Explanation:** The compass is non-functional in the Moon's environment due to the lack of a magnetic field, but it is less actively useless than the matches. Suggest moving this down from position #11 to #14. **Specialized Insight:** Visual references render the compass irrelevant.  \n\n#### **15. Box of Matches**\n**Justification:** Matches remain completely useless in the lunar vacuum as combustion requires oxygen. This item ranks the lowest.  \n**No change from original ranking.**\n\n---\n\n### **Refined Ranking of Items**\n1. Oxygen Tanks  \n2. Water  \n3. Solar-Powered FM Receiver-Transmitter  \n4. Stellar Map  \n5. Portable Heating Unit  \n6. Food Concentrate  \n7. First Aid Kit  \n8. 50 Feet of Nylon Rope  \n9. Signal Flares  \n10. Parachute Silk  \n11. Life Raft  \n12. One Case of Dehydrated Milk  \n13. Two .45 Caliber Pistols  \n14. Magnetic Compass  \n15. Box of Matches  \n\n---  \n\n### **Summary of Changes**\n- Moved the **Solar-Powered FM Receiver-Transmitter** up to #3 to prioritize active communication.  \n- Swapped positions of **First Aid Kit** (#7) and **Nylon Rope** (#8) to reflect medical emergency priorities.\n- Moved up **Life Raft** (#11) for its marginal utility above dehydrated milk.  \n- Reordered **Two .45 Caliber Pistols** (#13) and **Magnetic Compass** (#14).  \n\nI welcome feedback and discussion to further refine this ranking. Please confirm receipt of this information, and let me know if further clarification is needed.",
          "ranking": [
            "Oxygen tanks",
            "Water",
            "Solar-powered FM receiver-transmitter",
            "Stellar map",
            "Portable heating unit",
            "Food concentrate",
            "First aid kit",
            "50 feet of nylon rope",
            "Signal flares",
            "Parachute silk",
            "Life raft",
            "One case of dehydrated milk",
            "Two .45 caliber pistols",
            "Magnetic compass",
            "Box of matches"
          ]
        }
      ],
      "iterations": [
        {
          "iteration": 0,
          "current_ranking": [
            "Oxygen tanks",
            "Water",
            "Stellar map",
            "Solar-powered FM receiver-transmitter",
            "Portable heating unit",
            "Food concentrate",
            "50 feet of nylon rope",
            "First aid kit",
            "Signal flares",
            "Parachute silk",
            "Magnetic compass",
            "One case of dehydrated milk",
            "Life raft",
            "Two .45 caliber pistols",
            "Box of matches"
          ],
          "current_message": "### **Initial Ranking of Lunar Survival Items**\n\nBased on the lunar environment and survival priorities outlined, here is the proposed ranking of the items, accompanied by scientific justifications:\n\n#### **1. Oxygen Tanks**\n- **Justification:** Oxygen is the highest priority on the Moon due to the vacuum environment; survival is impossible without it. A reliable supply is needed to sustain life during the 200-mile trek.\n\n#### **2. Water**\n- **Justification:** Water is critical for hydration, regulating body temperature, and survival. In a low-humidity environment such as the Moon, fluid loss can quickly lead to dehydration and impaired physiological function.\n\n#### **3. Stellar Map**\n- **Justification:** Navigation is crucial to reach the rendezvous point 200 miles away. A stellar map can help orient the team using celestial objects since GPS systems cannot be used in a lunar environment.\n\n#### **4. Solar-Powered FM Receiver-Transmitter**\n- **Justification:** Communication with the mother ship is vital for coordination, emergencies, and guidance. A solar-powered unit ensures operation during the trek without dependence on battery life.\n\n#### **5. Portable Heating Unit**\n- **Justification:** Temperature regulation is critical to avoid hypothermia during periods of shadow where temperatures can plunge to -250\u00b0F. While spacesuits provide insulation, additional heating may be necessary to maintain functionality.\n\n#### **6. Food Concentrate**\n- **Justification:** High-energy food concentrate is essential to sustain physical performance during the trek. Given the Moon\u2019s low gravity, movement requires less energy than on Earth but will still consume significant calories.\n\n#### **7. 50 Feet of Nylon Rope**\n- **Justification:** A rope is versatile and can aid in climbing craters, securing equipment, or assisting injured team members. Its strength and light weight make it practical for lunar exploration.\n\n#### **8. First Aid Kit**\n- **Justification:** The lunar environment poses physical hazards like falls, injuries, or radiation exposure. Basic medical supplies can address minor injuries, prevent infection, and stabilize conditions during the journey.\n\n#### **9. Signal Flares**\n- **Justification:** Though visibility is high during the day on the Moon\u2019s illuminated side, signal flares could help the mother ship locate the team upon arrival or in an emergency.\n\n#### **10. Parachute Silk**\n- **Justification:** Parachute silk can provide shade during high temperatures or protection from direct solar radiation. It could also be used for carrying items or creating a makeshift shelter.\n\n#### **11. Magnetic Compass**\n- **Justification:** A compass has limited utility on the Moon due to the absence of a global magnetic field. Navigation on the Moon must rely on visual references like craters and celestial objects.\n\n#### **12. One Case of Dehydrated Milk**\n- **Justification:** While it provides sustenance, dehydrated milk is bulky and requires water to rehydrate, reducing its practicality compared to food concentrate. It ranks lower due to logistical challenges.\n\n#### **13. Life Raft**\n- **Justification:** A life raft has limited utility on the Moon's solid surface. It could theoretically be used to transport items, but its weight and bulkiness make it less practical for a trek.\n\n#### **14. Two .45 Caliber Pistols**\n- **Justification:** Firearms have virtually no utility in the lunar environment since there are no predators or threats. They add unnecessary weight and complexity to the trek.\n\n#### **15. Box of Matches**\n- **Justification:** Matches are completely useless in the lunar vacuum, as combustion requires oxygen. This item has no scientific practicality and ranks last.\n\n---\n\n### **Summary of Approach**\nThis ranking prioritizes survival essentials such as oxygen, water, and navigation tools while de-emphasizing items with limited or no utility in the lunar environment (e.g., matches, firearms). Extreme conditions such as vacuum, radiation, and temperature swings, combined with the need for mobility during the 200-mile trek, informed the choices.\n\nI welcome team feedback and discussion to refine this ranking further. Please confirm receipt and understanding of this list, and provide any alternative perspectives or input for consideration.",
          "current_agent": "science"
        },
        {
          "iteration": 1,
          "current_ranking": [
            "Oxygen tanks",
            "Water",
            "Solar-powered FM receiver-transmitter",
            "Stellar map",
            "Portable heating unit",
            "Food concentrate",
            "First aid kit",
            "50 feet of nylon rope",
            "Signal flares",
            "Parachute silk",
            "Life raft",
            "One case of dehydrated milk",
            "Two .45 caliber pistols",
            "Magnetic compass",
            "Box of matches"
          ],
          "current_message": "### **Refined Ranking of Lunar Survival Items**\n\nBased on my expertise as a Resource Manager, I have carefully analyzed each item\u2019s utility, weight, and practicality for the survival trek. Below is my refined ranking and brief justifications for each position, including adjustments where necessary.\n\n---\n\n#### **1. Oxygen Tanks**\n**Justification:** Oxygen is non-negotiable for survival in the vacuum of the lunar environment. It should remain the highest priority.  \n**No change from original ranking.**\n\n#### **2. Water**\n**Justification:** Hydration is vital, particularly in the Moon\u2019s low-humidity conditions, which can exacerbate fluid loss. Water is critical for thermal regulation, physiological function, and rehydration of dehydrated food if necessary.  \n**No change from original ranking.**\n\n#### **3. Solar-Powered FM Receiver-Transmitter**\n**Change Explanation:** Communication with the mother ship is paramount for coordination, guidance, and emergency support during the trek. I suggest moving this item up from position #4 to #3, as communication can impact survival directly by facilitating rescue operations or troubleshooting during navigation. **Specialized Insight:** The benefit of active communication outweighs even the stellar map; if the trek is disoriented, guidance via communication could save lives.  \n\n#### **4. Stellar Map**  \n**Change Explanation:** While navigation is crucial, it becomes secondary to real-time communication support. I propose moving this down from position #3 to #4. **Specialized Insight:** The stellar map\u2019s passive nature (visual reference only) is less dynamic than active communication methods.  \n\n#### **5. Portable Heating Unit**\n**Justification:** Temperature regulation is critical for survival, especially during prolonged shadow periods where temperatures can plunge to extreme lows. Spacesuits provide insulation but are not sufficient alone in these conditions.  \n**No change from original ranking.**\n\n#### **6. Food Concentrate**\n**Justification:** High-energy food concentrate is compact and efficient for physical sustenance, especially given the calorie expenditure required for an extended trek.  \n**No change from original ranking.**\n\n#### **7. First Aid Kit**\n**Change Explanation:** I suggest moving this item up from position #8 to #7. **Specialized Insight:** The lunar environment\u2019s physical hazards (falls, injuries, radiation exposure) pose significant risks, making immediate access to medical supplies more important than nylon rope. Staging first aid supplies higher reflects its direct impact on crew health during emergencies.  \n\n#### **8. 50 Feet of Nylon Rope**\n**Justification:** Nylon rope remains highly versatile for securing or repairing equipment, assisting injured crew, or dealing with the lunar terrain during the trek.  \n**Moved down from position #7 to #8 to prioritize first aid kit.**\n\n#### **9. Signal Flares**\n**Justification:** Signal flares provide additional visibility and could aid the mother ship in locating the crew. While less critical during the trek itself, this item is important for rendezvous.  \n**No change from original ranking.**\n\n#### **10. Parachute Silk**\n**Justification:** Parachute silk provides utility as a shade against intense solar radiation, a lightweight carry-all, or a makeshift shelter. Its utility makes this suitable for mid-tier prioritization.  \n**No change from original ranking.**\n\n#### **11. Life Raft**\n**Change Explanation:** While it may provide limited use for transporting supplies, its size and bulk make it less practical during the trek. I propose moving this item down from position #13 to #11, above items with even lower utility. **Specialized Insight:** The raft edges out dehydrated milk in terms of logistical flexibility despite its inefficiency.  \n\n#### **12. One Case of Dehydrated Milk**\n**Justification:** While dehydrated milk can provide sustenance, it is bulky and requires water to prepare, which drains essential resources. Its below-average utility places it lower in ranking.  \n**No change from original ranking.**\n\n#### **13. Two .45 Caliber Pistols**\n**Change Explanation:** These firearms have virtually no survival utility but rank marginally above matches due to potential use for crafting tools or securing items. They remain near the bottom of the list but could hypothetically serve as a last-resort functionality. **Specialized Insight:** Suggest moving pistols up from position #14 to #13.  \n\n#### **14. Magnetic Compass**\n**Change Explanation:** The compass is non-functional in the Moon's environment due to the lack of a magnetic field, but it is less actively useless than the matches. Suggest moving this down from position #11 to #14. **Specialized Insight:** Visual references render the compass irrelevant.  \n\n#### **15. Box of Matches**\n**Justification:** Matches remain completely useless in the lunar vacuum as combustion requires oxygen. This item ranks the lowest.  \n**No change from original ranking.**\n\n---\n\n### **Refined Ranking of Items**\n1. Oxygen Tanks  \n2. Water  \n3. Solar-Powered FM Receiver-Transmitter  \n4. Stellar Map  \n5. Portable Heating Unit  \n6. Food Concentrate  \n7. First Aid Kit  \n8. 50 Feet of Nylon Rope  \n9. Signal Flares  \n10. Parachute Silk  \n11. Life Raft  \n12. One Case of Dehydrated Milk  \n13. Two .45 Caliber Pistols  \n14. Magnetic Compass  \n15. Box of Matches  \n\n---  \n\n### **Summary of Changes**\n- Moved the **Solar-Powered FM Receiver-Transmitter** up to #3 to prioritize active communication.  \n- Swapped positions of **First Aid Kit** (#7) and **Nylon Rope** (#8) to reflect medical emergency priorities.\n- Moved up **Life Raft** (#11) for its marginal utility above dehydrated milk.  \n- Reordered **Two .45 Caliber Pistols** (#13) and **Magnetic Compass** (#14).  \n\nI welcome feedback and discussion to further refine this ranking. Please confirm receipt of this information, and let me know if further clarification is needed.",
          "current_agent": "resource",
          "difference_score": 10
        }
      ],
      "final_ranking": [
        "Oxygen tanks",
        "Water",
        "Solar-powered FM receiver-transmitter",
        "Stellar map",
        "Portable heating unit",
        "Food concentrate",
        "First aid kit",
        "50 feet of nylon rope",
        "Signal flares",
        "Parachute silk",
        "Life raft",
        "One case of dehydrated milk",
        "Two .45 caliber pistols",
        "Magnetic compass",
        "Box of matches"
      ],
      "final_message": "### **Refined Ranking of Lunar Survival Items**\n\nBased on my expertise as a Resource Manager, I have carefully analyzed each item\u2019s utility, weight, and practicality for the survival trek. Below is my refined ranking and brief justifications for each position, including adjustments where necessary.\n\n---\n\n#### **1. Oxygen Tanks**\n**Justification:** Oxygen is non-negotiable for survival in the vacuum of the lunar environment. It should remain the highest priority.  \n**No change from original ranking.**\n\n#### **2. Water**\n**Justification:** Hydration is vital, particularly in the Moon\u2019s low-humidity conditions, which can exacerbate fluid loss. Water is critical for thermal regulation, physiological function, and rehydration of dehydrated food if necessary.  \n**No change from original ranking.**\n\n#### **3. Solar-Powered FM Receiver-Transmitter**\n**Change Explanation:** Communication with the mother ship is paramount for coordination, guidance, and emergency support during the trek. I suggest moving this item up from position #4 to #3, as communication can impact survival directly by facilitating rescue operations or troubleshooting during navigation. **Specialized Insight:** The benefit of active communication outweighs even the stellar map; if the trek is disoriented, guidance via communication could save lives.  \n\n#### **4. Stellar Map**  \n**Change Explanation:** While navigation is crucial, it becomes secondary to real-time communication support. I propose moving this down from position #3 to #4. **Specialized Insight:** The stellar map\u2019s passive nature (visual reference only) is less dynamic than active communication methods.  \n\n#### **5. Portable Heating Unit**\n**Justification:** Temperature regulation is critical for survival, especially during prolonged shadow periods where temperatures can plunge to extreme lows. Spacesuits provide insulation but are not sufficient alone in these conditions.  \n**No change from original ranking.**\n\n#### **6. Food Concentrate**\n**Justification:** High-energy food concentrate is compact and efficient for physical sustenance, especially given the calorie expenditure required for an extended trek.  \n**No change from original ranking.**\n\n#### **7. First Aid Kit**\n**Change Explanation:** I suggest moving this item up from position #8 to #7. **Specialized Insight:** The lunar environment\u2019s physical hazards (falls, injuries, radiation exposure) pose significant risks, making immediate access to medical supplies more important than nylon rope. Staging first aid supplies higher reflects its direct impact on crew health during emergencies.  \n\n#### **8. 50 Feet of Nylon Rope**\n**Justification:** Nylon rope remains highly versatile for securing or repairing equipment, assisting injured crew, or dealing with the lunar terrain during the trek.  \n**Moved down from position #7 to #8 to prioritize first aid kit.**\n\n#### **9. Signal Flares**\n**Justification:** Signal flares provide additional visibility and could aid the mother ship in locating the crew. While less critical during the trek itself, this item is important for rendezvous.  \n**No change from original ranking.**\n\n#### **10. Parachute Silk**\n**Justification:** Parachute silk provides utility as a shade against intense solar radiation, a lightweight carry-all, or a makeshift shelter. Its utility makes this suitable for mid-tier prioritization.  \n**No change from original ranking.**\n\n#### **11. Life Raft**\n**Change Explanation:** While it may provide limited use for transporting supplies, its size and bulk make it less practical during the trek. I propose moving this item down from position #13 to #11, above items with even lower utility. **Specialized Insight:** The raft edges out dehydrated milk in terms of logistical flexibility despite its inefficiency.  \n\n#### **12. One Case of Dehydrated Milk**\n**Justification:** While dehydrated milk can provide sustenance, it is bulky and requires water to prepare, which drains essential resources. Its below-average utility places it lower in ranking.  \n**No change from original ranking.**\n\n#### **13. Two .45 Caliber Pistols**\n**Change Explanation:** These firearms have virtually no survival utility but rank marginally above matches due to potential use for crafting tools or securing items. They remain near the bottom of the list but could hypothetically serve as a last-resort functionality. **Specialized Insight:** Suggest moving pistols up from position #14 to #13.  \n\n#### **14. Magnetic Compass**\n**Change Explanation:** The compass is non-functional in the Moon's environment due to the lack of a magnetic field, but it is less actively useless than the matches. Suggest moving this down from position #11 to #14. **Specialized Insight:** Visual references render the compass irrelevant.  \n\n#### **15. Box of Matches**\n**Justification:** Matches remain completely useless in the lunar vacuum as combustion requires oxygen. This item ranks the lowest.  \n**No change from original ranking.**\n\n---\n\n### **Refined Ranking of Items**\n1. Oxygen Tanks  \n2. Water  \n3. Solar-Powered FM Receiver-Transmitter  \n4. Stellar Map  \n5. Portable Heating Unit  \n6. Food Concentrate  \n7. First Aid Kit  \n8. 50 Feet of Nylon Rope  \n9. Signal Flares  \n10. Parachute Silk  \n11. Life Raft  \n12. One Case of Dehydrated Milk  \n13. Two .45 Caliber Pistols  \n14. Magnetic Compass  \n15. Box of Matches  \n\n---  \n\n### **Summary of Changes**\n- Moved the **Solar-Powered FM Receiver-Transmitter** up to #3 to prioritize active communication.  \n- Swapped positions of **First Aid Kit** (#7) and **Nylon Rope** (#8) to reflect medical emergency priorities.\n- Moved up **Life Raft** (#11) for its marginal utility above dehydrated milk.  \n- Reordered **Two .45 Caliber Pistols** (#13) and **Magnetic Compass** (#14).  \n\nI welcome feedback and discussion to further refine this ranking. Please confirm receipt of this information, and let me know if further clarification is needed.",
      "score": 22
    }
  ],
  "final_ranking": [
    "Oxygen tanks",
    "Water",
    "Solar-powered FM receiver-transmitter",
    "Stellar map",
    "Portable heating unit",
    "Food concentrate",
    "First aid kit",
    "50 feet of nylon rope",
    "Signal flares",
    "Parachute silk",
    "Life raft",
    "One case of dehydrated milk",
    "Two .45 caliber pistols",
    "Magnetic compass",
    "Box of matches"
  ],
  "nasa_ranking": [
    "Oxygen tanks",
    "Water",
    "Stellar map",
    "Food concentrate",
    "Solar-powered FM receiver-transmitter",
    "50 feet of nylon rope",
    "First aid kit",
    "Parachute silk",
    "Life raft",
    "Signal flares",
    "Two .45 caliber pistols",
    "One case of dehydrated milk",
    "Portable heating unit",
    "Magnetic compass",
    "Box of matches"
  ],
  "score": 22,
  "teamwork_metrics": {
    "mutual_monitoring": {
      "total_monitoring_exchanges": 0,
      "total_issues_detected": 0,
      "avg_issues_per_exchange": 0.0,
      "issue_types": {},
      "issue_resolution_rate": 0.0,
      "team_monitoring_effectiveness": "low"
    },
    "shared_mental_model": {
      "convergence_trend": "unknown",
      "final_convergence": 0.3939393939393939,
      "understanding_completeness": {
        "science": 0.6055555555555555,
        "resource": 0.5196078431372549
      },
      "avg_completeness": 0.5625816993464052,
      "effectiveness_rating": "low"
    }
  }
}