{
  "simulation_id": "sim_leadership_closed_loop_mutual_monitoring_shared_mental_model_20250417_135708",
  "config": {
    "use_team_leadership": true,
    "use_closed_loop_comm": true,
    "use_mutual_monitoring": true,
    "use_shared_mental_model": true
  },
  "exchanges": [
    {
      "type": "sequential_refinement",
      "exchanges": [
        {
          "type": "initial_ranking",
          "role": "science",
          "message": "Here is the **initial ranking of the 15 lunar survival items**, organized based on the shared understanding of lunar conditions, survival priorities, and my technical expertise. Each item's ranking is justified with its relevance to the specific conditions of the Moon and the 200-mile trek to the rendezvous point. \n\n---\n\n### **Ranked List of Lunar Survival Items**\n\n1. **Oxygen Tanks**  \n   - Justification: The Moon has no atmosphere, and oxygen is critical to survival in the vacuum environment. Without breathable air, survival is impossible. This is the absolute highest priority.\n\n2. **Water**  \n   - Justification: Human bodies require water for critical physiological functions. Dehydration would lead to debilitation long before starvation. Though temperatures are extreme, water for hydration is essential for survival during the journey.\n\n3. **Stellar Map**  \n   - Justification: Navigation is critical to reaching the rendezvous point. A stellar map will help align with visible celestial markers to navigate the 200-mile trek accurately, as there is no GPS system or natural landmarks on the Moon.\n\n4. **Solar-Powered FM Receiver-Transmitter**  \n   - Justification: Maintaining communication with the mother ship is vital for updates, status reporting, and to call for aid in case of an emergency. The Moon\u2019s surface offers no means of natural communication, so this item is highly important.\n\n5. **Portable Heating Unit**  \n   - Justification: Lunar nights and shadows can plunge to temperatures of -250\u00b0F. Without atmosphere, temperature regulation is entirely dependent on equipment. A heating unit is necessary, particularly for survival during extended travel in shaded terrain.\n\n6. **First Aid Kit**  \n   - Justification: Injuries could occur due to falls on the uneven, cratered terrain or from radiation exposure. Bandages, disinfectants, and basic medical supplies in the first aid kit could be life-saving for maintaining physical functionality during the trek.\n\n7. **Food Concentrate**  \n   - Justification: While food is not as immediately critical as oxygen and water, energy reserves are necessary for maintaining strength and cognitive function throughout the 200-mile journey. The food concentrate is efficient, requiring minimal space and weight.\n\n8. **50 Feet of Nylon Rope**  \n   - Justification: The Moon's surface is rocky and cratered, and rope could be used to secure equipment, assist in climbing, or tether crew members together to avoid separation. It\u2019s lightweight and operationally versatile in such an environment.\n\n9. **Signal Flares**  \n   - Justification: Signal flares could be used for visual communication with the mother ship or search efforts during rescue operations in case the team is lost or delayed.\n\n10. **Parachute Silk**  \n    - Justification: Parachute silk could serve as thermal insulation, sun protection, or as a makeshift shelter. Its use in temperature regulation or shielding in harsh sunlight could be valuable, though secondary compared to a heating unit.\n\n11. **Magnetic Compass**  \n    - Justification: Compasses rely on magnetic fields, which are weak and inconsistent on the Moon due to its lack of a global magnetic field. This makes a magnetic compass almost useless for navigation compared to the stellar map.\n\n12. **Two .45 Caliber Pistols**  \n    - Justification: While they might have limited utility for propulsion (e.g., firing the gun as a makeshift propellant in an emergency), the Moon's environment has no predators or threats, making firearms largely impractical. Weight should be conserved for more critical items.\n\n13. **Life Raft**  \n    - Justification: The life raft has negligible utility on the Moon's surface. While it could provide insulation or an emergency carrying device, there are lighter and more practical alternatives for these purposes (e.g., parachute silk).\n\n14. **One Case of Dehydrated Milk**  \n    - Justification: While it could supplement nutrition, the emphasis should be on compact, efficient, and space-saving food sources like the food concentrate. Dehydrated milk is bulky and impractical without abundant water to rehydrate it.\n\n15. **Box of Matches**  \n    - Justification: Matches are entirely useless on the Moon due to the absence of an atmosphere to support combustion. This item has no survival utility and should not be brought.\n\n---\n\n### **Summary of the Ranking**\n#### Top Priorities:\nThe most important items directly address the core survival priorities: breathable air, hydration, navigation, temperature regulation, and communication.\n\n#### Lowest Priorities:  \nItems like a box of matches, dehydrated milk, life raft, and firearms have limited or no functionality in the lunar environment and during the 200-mile trek.\n\n---\n\n### **Team Alignment Proposal**\nI propose this ranking as a baseline for discussion, grounded in the shared understanding of the environment and survival priorities. Please provide any feedback or rationale for re-prioritizing items based on your expertise. Let\u2019s work toward consensus through evidence-based reasoning.",
          "ranking": [
            "Oxygen tanks",
            "Water",
            "Stellar map",
            "Solar-powered FM receiver-transmitter",
            "Portable heating unit",
            "First aid kit",
            "Food concentrate",
            "50 feet of nylon rope",
            "Signal flares",
            "Parachute silk",
            "Magnetic compass",
            "Two .45 caliber pistols",
            "Life raft",
            "One case of dehydrated milk",
            "Box of matches"
          ]
        },
        {
          "type": "refinement",
          "iteration": 1,
          "role": "resource",
          "message": "### **Refined Ranking of Lunar Survival Items**\n\nThe original ranking is well-grounded and generally aligns with survival priorities established by the team. Below is my refined ranking of the 15 lunar survival items, incorporating my expertise as a Resource Manager to assess their weight-to-utility ratio and their relevance to the lunar environment and 200-mile journey. Changes are noted where applicable.\n\n---\n\n#### **1. Oxygen Tanks**\n   - **No Change**\n   - Justification: Oxygen is the single most critical resource for survival. Without it, no human can survive the Moon's vacuum. This item's weight is irrelevant given its necessity. \n\n#### **2. Water**\n   - **No Change**\n   - Justification: Hydration is essential for physiological functions and energy. Given the 200-mile trek, a constant supply of water is important for survival on this journey.\n\n#### **3. Stellar Map**\n   - **No Change**\n   - Justification: Navigation is critical to reaching the rendezvous point, and the stellar map is the best tool available for the Moon's terrain. Its importance supersedes all but life-critical supplies.\n\n#### **4. Solar-Powered FM Receiver-Transmitter**\n   - **No Change**\n   - Justification: Communication could be life-saving in the event of getting off-course, encountering an emergency, or receiving updates from the mother ship.\n\n#### **5. Portable Heating Unit**\n   - **No Change**\n   - Justification: With the potential for freezing temperatures on the Moon in shaded areas, the heating unit addresses critical thermal regulation.\n\n#### **6. First Aid Kit**\n   - **No Change**\n   - Justification: Injuries from falls, radiation exposure, or other hazards are possible. Basic medical care is necessary to prevent debilitation during the trek.\n\n#### **7. Food Concentrate**\n   - **No Change**\n   - Justification: Vital for maintaining strength and cognitive function. The compact nature of the food concentrate makes it an efficient energy source compared to bulkier options like dehydrated milk.\n\n#### **8. 50 Feet of Nylon Rope**\n   - **No Change**\n   - Justification: Lightweight yet versatile. Useful for tethering, climbing, or securing gear. Its utility on rocky and uneven terrain justifies its ranking.\n\n#### **9. Signal Flares**\n   - **No Change**\n   - Justification: The flares provide a reliable, lightweight signaling mechanism for alerting the mother ship or rescuers in case of a misstep during the trek.\n\n#### **10. Parachute Silk**\n   - **No Change**\n   - Justification: Multipurpose and lightweight. Can be used for sun protection, insulation, or as a makeshift shelter.\n\n#### **11. Magnetic Compass**\n   - **No Change**\n   - Justification: In the absence of a global magnetic field on the Moon, the compass is nearly useless. The stellar map is far more reliable for navigation.\n\n#### **12. Two .45 Caliber Pistols**\n   - **No Change**\n   - Justification: Limited utility on the Moon. Their main survival use would be as a last-resort propulsion tool (firing bullets as a makeshift impulse). The cost-benefit ratio (weight vs. utility) doesn't justify a higher ranking.\n\n#### **13. Life Raft**\n   - **No Change**\n   - Justification: Bulky and impractical. While it could theoretically serve as insulation or a means to carry supplies, these functions are already fulfilled by other items like parachute silk and the rope.\n\n#### **14. One Case of Dehydrated Milk**\n   - **No Change**\n   - Justification: Requires water to rehydrate, which would deplete the already limited water supply. Poor weight-to-utility ratio compared to food concentrate, making this not worth carrying.\n\n#### **15. Box of Matches**\n   - **No Change**\n   - Justification: Completely useless in the Moon's vacuum with no atmosphere to support combustion. This item serves no purpose.\n\n---\n\n### **Refined & Final Ranking**\n\n1. **Oxygen Tanks** \u2013 Absolutely essential for survival.\n2. **Water** \u2013 Needed for hydration and physiological health.\n3. **Stellar Map** \u2013 Navigation is key to reaching the rendezvous point.\n4. **Solar-Powered FM Receiver-Transmitter** \u2013 Critical for communication and potential rescue.\n5. **Portable Heating Unit** \u2013 Essential for temperature regulation in extreme cold.\n6. **First Aid Kit** \u2013 Treats injuries and prevents long-term incapacitation.\n7. **Food Concentrate** \u2013 Compact, energy-dense nutrition.\n8. **50 Feet of Nylon Rope** \u2013 Versatile and lightweight; useful for securing and climbing.\n9. **Signal Flares** \u2013 Lightweight and important for signaling rescue.\n10. **Parachute Silk** \u2013 Multipurpose; useful for insulation, shelter, and sun protection.\n11. **Magnetic Compass** \u2013 Nearly useless on the Moon; superseded by the stellar map.\n12. **Two .45 Caliber Pistols** \u2013 Limited propulsion utility; no other real use.\n13. **Life Raft** \u2013 Low utility with bulky and redundant functionality.\n14. **One Case of Dehydrated Milk** \u2013 Poor weight-to-utility ratio; not practical for the trip.\n15. **Box of Matches** \u2013 Utterly useless in the vacuum environment.\n\n---\n\n### **Justification Summary**\n\nThis ranking prioritizes life-critical essentials (oxygen, water, navigation tools, temperature regulation, and communication) while placing items with negligible utility (matches, milk, pistols, and life raft) at the bottom. Moderate survival aids such as the first aid kit and food concentrate are ranked based on their practicality and relative importance to long-term survival over the 200-mile trek.\n\n---\n\n**Confirmation Request**: Please confirm that this ranking and reasoning align with your understanding of the lunar environment and our shared survival priorities. If any clarification or further adjustments are needed, I\u2019m happy to discuss.",
          "ranking": [
            "Oxygen tanks",
            "Water",
            "Stellar map",
            "Solar-powered FM receiver-transmitter",
            "Portable heating unit",
            "First aid kit",
            "Food concentrate",
            "50 feet of nylon rope",
            "Signal flares",
            "Parachute silk",
            "Magnetic compass",
            "Two .45 caliber pistols",
            "Life raft",
            "One case of dehydrated milk",
            "Box of matches"
          ]
        }
      ],
      "iterations": [
        {
          "iteration": 0,
          "current_ranking": [
            "Oxygen tanks",
            "Water",
            "Stellar map",
            "Solar-powered FM receiver-transmitter",
            "Portable heating unit",
            "First aid kit",
            "Food concentrate",
            "50 feet of nylon rope",
            "Signal flares",
            "Parachute silk",
            "Magnetic compass",
            "Two .45 caliber pistols",
            "Life raft",
            "One case of dehydrated milk",
            "Box of matches"
          ],
          "current_message": "Here is the **initial ranking of the 15 lunar survival items**, organized based on the shared understanding of lunar conditions, survival priorities, and my technical expertise. Each item's ranking is justified with its relevance to the specific conditions of the Moon and the 200-mile trek to the rendezvous point. \n\n---\n\n### **Ranked List of Lunar Survival Items**\n\n1. **Oxygen Tanks**  \n   - Justification: The Moon has no atmosphere, and oxygen is critical to survival in the vacuum environment. Without breathable air, survival is impossible. This is the absolute highest priority.\n\n2. **Water**  \n   - Justification: Human bodies require water for critical physiological functions. Dehydration would lead to debilitation long before starvation. Though temperatures are extreme, water for hydration is essential for survival during the journey.\n\n3. **Stellar Map**  \n   - Justification: Navigation is critical to reaching the rendezvous point. A stellar map will help align with visible celestial markers to navigate the 200-mile trek accurately, as there is no GPS system or natural landmarks on the Moon.\n\n4. **Solar-Powered FM Receiver-Transmitter**  \n   - Justification: Maintaining communication with the mother ship is vital for updates, status reporting, and to call for aid in case of an emergency. The Moon\u2019s surface offers no means of natural communication, so this item is highly important.\n\n5. **Portable Heating Unit**  \n   - Justification: Lunar nights and shadows can plunge to temperatures of -250\u00b0F. Without atmosphere, temperature regulation is entirely dependent on equipment. A heating unit is necessary, particularly for survival during extended travel in shaded terrain.\n\n6. **First Aid Kit**  \n   - Justification: Injuries could occur due to falls on the uneven, cratered terrain or from radiation exposure. Bandages, disinfectants, and basic medical supplies in the first aid kit could be life-saving for maintaining physical functionality during the trek.\n\n7. **Food Concentrate**  \n   - Justification: While food is not as immediately critical as oxygen and water, energy reserves are necessary for maintaining strength and cognitive function throughout the 200-mile journey. The food concentrate is efficient, requiring minimal space and weight.\n\n8. **50 Feet of Nylon Rope**  \n   - Justification: The Moon's surface is rocky and cratered, and rope could be used to secure equipment, assist in climbing, or tether crew members together to avoid separation. It\u2019s lightweight and operationally versatile in such an environment.\n\n9. **Signal Flares**  \n   - Justification: Signal flares could be used for visual communication with the mother ship or search efforts during rescue operations in case the team is lost or delayed.\n\n10. **Parachute Silk**  \n    - Justification: Parachute silk could serve as thermal insulation, sun protection, or as a makeshift shelter. Its use in temperature regulation or shielding in harsh sunlight could be valuable, though secondary compared to a heating unit.\n\n11. **Magnetic Compass**  \n    - Justification: Compasses rely on magnetic fields, which are weak and inconsistent on the Moon due to its lack of a global magnetic field. This makes a magnetic compass almost useless for navigation compared to the stellar map.\n\n12. **Two .45 Caliber Pistols**  \n    - Justification: While they might have limited utility for propulsion (e.g., firing the gun as a makeshift propellant in an emergency), the Moon's environment has no predators or threats, making firearms largely impractical. Weight should be conserved for more critical items.\n\n13. **Life Raft**  \n    - Justification: The life raft has negligible utility on the Moon's surface. While it could provide insulation or an emergency carrying device, there are lighter and more practical alternatives for these purposes (e.g., parachute silk).\n\n14. **One Case of Dehydrated Milk**  \n    - Justification: While it could supplement nutrition, the emphasis should be on compact, efficient, and space-saving food sources like the food concentrate. Dehydrated milk is bulky and impractical without abundant water to rehydrate it.\n\n15. **Box of Matches**  \n    - Justification: Matches are entirely useless on the Moon due to the absence of an atmosphere to support combustion. This item has no survival utility and should not be brought.\n\n---\n\n### **Summary of the Ranking**\n#### Top Priorities:\nThe most important items directly address the core survival priorities: breathable air, hydration, navigation, temperature regulation, and communication.\n\n#### Lowest Priorities:  \nItems like a box of matches, dehydrated milk, life raft, and firearms have limited or no functionality in the lunar environment and during the 200-mile trek.\n\n---\n\n### **Team Alignment Proposal**\nI propose this ranking as a baseline for discussion, grounded in the shared understanding of the environment and survival priorities. Please provide any feedback or rationale for re-prioritizing items based on your expertise. Let\u2019s work toward consensus through evidence-based reasoning.",
          "current_agent": "science"
        },
        {
          "iteration": 1,
          "current_ranking": [
            "Oxygen tanks",
            "Water",
            "Stellar map",
            "Solar-powered FM receiver-transmitter",
            "Portable heating unit",
            "First aid kit",
            "Food concentrate",
            "50 feet of nylon rope",
            "Signal flares",
            "Parachute silk",
            "Magnetic compass",
            "Two .45 caliber pistols",
            "Life raft",
            "One case of dehydrated milk",
            "Box of matches"
          ],
          "current_message": "### **Refined Ranking of Lunar Survival Items**\n\nThe original ranking is well-grounded and generally aligns with survival priorities established by the team. Below is my refined ranking of the 15 lunar survival items, incorporating my expertise as a Resource Manager to assess their weight-to-utility ratio and their relevance to the lunar environment and 200-mile journey. Changes are noted where applicable.\n\n---\n\n#### **1. Oxygen Tanks**\n   - **No Change**\n   - Justification: Oxygen is the single most critical resource for survival. Without it, no human can survive the Moon's vacuum. This item's weight is irrelevant given its necessity. \n\n#### **2. Water**\n   - **No Change**\n   - Justification: Hydration is essential for physiological functions and energy. Given the 200-mile trek, a constant supply of water is important for survival on this journey.\n\n#### **3. Stellar Map**\n   - **No Change**\n   - Justification: Navigation is critical to reaching the rendezvous point, and the stellar map is the best tool available for the Moon's terrain. Its importance supersedes all but life-critical supplies.\n\n#### **4. Solar-Powered FM Receiver-Transmitter**\n   - **No Change**\n   - Justification: Communication could be life-saving in the event of getting off-course, encountering an emergency, or receiving updates from the mother ship.\n\n#### **5. Portable Heating Unit**\n   - **No Change**\n   - Justification: With the potential for freezing temperatures on the Moon in shaded areas, the heating unit addresses critical thermal regulation.\n\n#### **6. First Aid Kit**\n   - **No Change**\n   - Justification: Injuries from falls, radiation exposure, or other hazards are possible. Basic medical care is necessary to prevent debilitation during the trek.\n\n#### **7. Food Concentrate**\n   - **No Change**\n   - Justification: Vital for maintaining strength and cognitive function. The compact nature of the food concentrate makes it an efficient energy source compared to bulkier options like dehydrated milk.\n\n#### **8. 50 Feet of Nylon Rope**\n   - **No Change**\n   - Justification: Lightweight yet versatile. Useful for tethering, climbing, or securing gear. Its utility on rocky and uneven terrain justifies its ranking.\n\n#### **9. Signal Flares**\n   - **No Change**\n   - Justification: The flares provide a reliable, lightweight signaling mechanism for alerting the mother ship or rescuers in case of a misstep during the trek.\n\n#### **10. Parachute Silk**\n   - **No Change**\n   - Justification: Multipurpose and lightweight. Can be used for sun protection, insulation, or as a makeshift shelter.\n\n#### **11. Magnetic Compass**\n   - **No Change**\n   - Justification: In the absence of a global magnetic field on the Moon, the compass is nearly useless. The stellar map is far more reliable for navigation.\n\n#### **12. Two .45 Caliber Pistols**\n   - **No Change**\n   - Justification: Limited utility on the Moon. Their main survival use would be as a last-resort propulsion tool (firing bullets as a makeshift impulse). The cost-benefit ratio (weight vs. utility) doesn't justify a higher ranking.\n\n#### **13. Life Raft**\n   - **No Change**\n   - Justification: Bulky and impractical. While it could theoretically serve as insulation or a means to carry supplies, these functions are already fulfilled by other items like parachute silk and the rope.\n\n#### **14. One Case of Dehydrated Milk**\n   - **No Change**\n   - Justification: Requires water to rehydrate, which would deplete the already limited water supply. Poor weight-to-utility ratio compared to food concentrate, making this not worth carrying.\n\n#### **15. Box of Matches**\n   - **No Change**\n   - Justification: Completely useless in the Moon's vacuum with no atmosphere to support combustion. This item serves no purpose.\n\n---\n\n### **Refined & Final Ranking**\n\n1. **Oxygen Tanks** \u2013 Absolutely essential for survival.\n2. **Water** \u2013 Needed for hydration and physiological health.\n3. **Stellar Map** \u2013 Navigation is key to reaching the rendezvous point.\n4. **Solar-Powered FM Receiver-Transmitter** \u2013 Critical for communication and potential rescue.\n5. **Portable Heating Unit** \u2013 Essential for temperature regulation in extreme cold.\n6. **First Aid Kit** \u2013 Treats injuries and prevents long-term incapacitation.\n7. **Food Concentrate** \u2013 Compact, energy-dense nutrition.\n8. **50 Feet of Nylon Rope** \u2013 Versatile and lightweight; useful for securing and climbing.\n9. **Signal Flares** \u2013 Lightweight and important for signaling rescue.\n10. **Parachute Silk** \u2013 Multipurpose; useful for insulation, shelter, and sun protection.\n11. **Magnetic Compass** \u2013 Nearly useless on the Moon; superseded by the stellar map.\n12. **Two .45 Caliber Pistols** \u2013 Limited propulsion utility; no other real use.\n13. **Life Raft** \u2013 Low utility with bulky and redundant functionality.\n14. **One Case of Dehydrated Milk** \u2013 Poor weight-to-utility ratio; not practical for the trip.\n15. **Box of Matches** \u2013 Utterly useless in the vacuum environment.\n\n---\n\n### **Justification Summary**\n\nThis ranking prioritizes life-critical essentials (oxygen, water, navigation tools, temperature regulation, and communication) while placing items with negligible utility (matches, milk, pistols, and life raft) at the bottom. Moderate survival aids such as the first aid kit and food concentrate are ranked based on their practicality and relative importance to long-term survival over the 200-mile trek.\n\n---\n\n**Confirmation Request**: Please confirm that this ranking and reasoning align with your understanding of the lunar environment and our shared survival priorities. If any clarification or further adjustments are needed, I\u2019m happy to discuss.",
          "current_agent": "resource",
          "difference_score": 0
        }
      ],
      "final_ranking": [
        "Oxygen tanks",
        "Water",
        "Stellar map",
        "Solar-powered FM receiver-transmitter",
        "Portable heating unit",
        "First aid kit",
        "Food concentrate",
        "50 feet of nylon rope",
        "Signal flares",
        "Parachute silk",
        "Magnetic compass",
        "Two .45 caliber pistols",
        "Life raft",
        "One case of dehydrated milk",
        "Box of matches"
      ],
      "final_message": "### **Refined Ranking of Lunar Survival Items**\n\nThe original ranking is well-grounded and generally aligns with survival priorities established by the team. Below is my refined ranking of the 15 lunar survival items, incorporating my expertise as a Resource Manager to assess their weight-to-utility ratio and their relevance to the lunar environment and 200-mile journey. Changes are noted where applicable.\n\n---\n\n#### **1. Oxygen Tanks**\n   - **No Change**\n   - Justification: Oxygen is the single most critical resource for survival. Without it, no human can survive the Moon's vacuum. This item's weight is irrelevant given its necessity. \n\n#### **2. Water**\n   - **No Change**\n   - Justification: Hydration is essential for physiological functions and energy. Given the 200-mile trek, a constant supply of water is important for survival on this journey.\n\n#### **3. Stellar Map**\n   - **No Change**\n   - Justification: Navigation is critical to reaching the rendezvous point, and the stellar map is the best tool available for the Moon's terrain. Its importance supersedes all but life-critical supplies.\n\n#### **4. Solar-Powered FM Receiver-Transmitter**\n   - **No Change**\n   - Justification: Communication could be life-saving in the event of getting off-course, encountering an emergency, or receiving updates from the mother ship.\n\n#### **5. Portable Heating Unit**\n   - **No Change**\n   - Justification: With the potential for freezing temperatures on the Moon in shaded areas, the heating unit addresses critical thermal regulation.\n\n#### **6. First Aid Kit**\n   - **No Change**\n   - Justification: Injuries from falls, radiation exposure, or other hazards are possible. Basic medical care is necessary to prevent debilitation during the trek.\n\n#### **7. Food Concentrate**\n   - **No Change**\n   - Justification: Vital for maintaining strength and cognitive function. The compact nature of the food concentrate makes it an efficient energy source compared to bulkier options like dehydrated milk.\n\n#### **8. 50 Feet of Nylon Rope**\n   - **No Change**\n   - Justification: Lightweight yet versatile. Useful for tethering, climbing, or securing gear. Its utility on rocky and uneven terrain justifies its ranking.\n\n#### **9. Signal Flares**\n   - **No Change**\n   - Justification: The flares provide a reliable, lightweight signaling mechanism for alerting the mother ship or rescuers in case of a misstep during the trek.\n\n#### **10. Parachute Silk**\n   - **No Change**\n   - Justification: Multipurpose and lightweight. Can be used for sun protection, insulation, or as a makeshift shelter.\n\n#### **11. Magnetic Compass**\n   - **No Change**\n   - Justification: In the absence of a global magnetic field on the Moon, the compass is nearly useless. The stellar map is far more reliable for navigation.\n\n#### **12. Two .45 Caliber Pistols**\n   - **No Change**\n   - Justification: Limited utility on the Moon. Their main survival use would be as a last-resort propulsion tool (firing bullets as a makeshift impulse). The cost-benefit ratio (weight vs. utility) doesn't justify a higher ranking.\n\n#### **13. Life Raft**\n   - **No Change**\n   - Justification: Bulky and impractical. While it could theoretically serve as insulation or a means to carry supplies, these functions are already fulfilled by other items like parachute silk and the rope.\n\n#### **14. One Case of Dehydrated Milk**\n   - **No Change**\n   - Justification: Requires water to rehydrate, which would deplete the already limited water supply. Poor weight-to-utility ratio compared to food concentrate, making this not worth carrying.\n\n#### **15. Box of Matches**\n   - **No Change**\n   - Justification: Completely useless in the Moon's vacuum with no atmosphere to support combustion. This item serves no purpose.\n\n---\n\n### **Refined & Final Ranking**\n\n1. **Oxygen Tanks** \u2013 Absolutely essential for survival.\n2. **Water** \u2013 Needed for hydration and physiological health.\n3. **Stellar Map** \u2013 Navigation is key to reaching the rendezvous point.\n4. **Solar-Powered FM Receiver-Transmitter** \u2013 Critical for communication and potential rescue.\n5. **Portable Heating Unit** \u2013 Essential for temperature regulation in extreme cold.\n6. **First Aid Kit** \u2013 Treats injuries and prevents long-term incapacitation.\n7. **Food Concentrate** \u2013 Compact, energy-dense nutrition.\n8. **50 Feet of Nylon Rope** \u2013 Versatile and lightweight; useful for securing and climbing.\n9. **Signal Flares** \u2013 Lightweight and important for signaling rescue.\n10. **Parachute Silk** \u2013 Multipurpose; useful for insulation, shelter, and sun protection.\n11. **Magnetic Compass** \u2013 Nearly useless on the Moon; superseded by the stellar map.\n12. **Two .45 Caliber Pistols** \u2013 Limited propulsion utility; no other real use.\n13. **Life Raft** \u2013 Low utility with bulky and redundant functionality.\n14. **One Case of Dehydrated Milk** \u2013 Poor weight-to-utility ratio; not practical for the trip.\n15. **Box of Matches** \u2013 Utterly useless in the vacuum environment.\n\n---\n\n### **Justification Summary**\n\nThis ranking prioritizes life-critical essentials (oxygen, water, navigation tools, temperature regulation, and communication) while placing items with negligible utility (matches, milk, pistols, and life raft) at the bottom. Moderate survival aids such as the first aid kit and food concentrate are ranked based on their practicality and relative importance to long-term survival over the 200-mile trek.\n\n---\n\n**Confirmation Request**: Please confirm that this ranking and reasoning align with your understanding of the lunar environment and our shared survival priorities. If any clarification or further adjustments are needed, I\u2019m happy to discuss.",
      "score": 28
    }
  ],
  "final_ranking": [
    "Oxygen tanks",
    "Water",
    "Stellar map",
    "Solar-powered FM receiver-transmitter",
    "Portable heating unit",
    "First aid kit",
    "Food concentrate",
    "50 feet of nylon rope",
    "Signal flares",
    "Parachute silk",
    "Magnetic compass",
    "Two .45 caliber pistols",
    "Life raft",
    "One case of dehydrated milk",
    "Box of matches"
  ],
  "nasa_ranking": [
    "Oxygen tanks",
    "Water",
    "Stellar map",
    "Food concentrate",
    "Solar-powered FM receiver-transmitter",
    "50 feet of nylon rope",
    "First aid kit",
    "Parachute silk",
    "Life raft",
    "Signal flares",
    "Two .45 caliber pistols",
    "One case of dehydrated milk",
    "Portable heating unit",
    "Magnetic compass",
    "Box of matches"
  ],
  "score": 28,
  "teamwork_metrics": {
    "mutual_monitoring": {
      "total_monitoring_exchanges": 0,
      "total_issues_detected": 0,
      "avg_issues_per_exchange": 0.0,
      "issue_types": {},
      "issue_resolution_rate": 0.0,
      "team_monitoring_effectiveness": "low"
    },
    "shared_mental_model": {
      "convergence_trend": "unknown",
      "final_convergence": 0.26136363636363635,
      "understanding_completeness": {
        "science": 0.6055555555555555,
        "resource": 0.638888888888889
      },
      "avg_completeness": 0.6222222222222222,
      "effectiveness_rating": "low"
    }
  }
}