{
  "simulation_id": "sim_shared_mental_model_20250417_131624",
  "config": {
    "use_team_leadership": false,
    "use_closed_loop_comm": false,
    "use_mutual_monitoring": false,
    "use_shared_mental_model": true
  },
  "exchanges": [
    {
      "type": "sequential_refinement",
      "exchanges": [
        {
          "type": "initial_ranking",
          "role": "science",
          "message": "Here is my initial ranking of the survival items based on lunar conditions and the team's shared understanding of survival priorities:\n\n### **Ranked List with Justifications**\n1. **Oxygen Tanks**  \n   Oxygen is essential for maintaining life. The moon has no atmosphere, so this is the highest priority. Without oxygen, survival is impossible within minutes.\n\n2. **Water**  \n   Water is vital for hydration and survival. Dehydration can lead to cognitive dysfunction and physical incapacitation during the trek.\n\n3. **Stellar Map**  \n   Since the moon lacks magnetic fields and a reliable GPS system, celestial navigation is required to find the correct path to the rendezvous point.\n\n4. **Solar-powered FM Receiver-Transmitter**  \n   Communication with the mother ship is critical for navigation updates, emergency assistance, and assurance of rescue at the rendezvous point.\n\n5. **Food Concentrate**  \n   Nutritional energy is necessary to maintain physical activity and cognitive function during the trek. Food concentrate is compact and high in calories.\n\n6. **Portable Heating Unit**  \n   Thermal regulation is crucial due to the extreme cold when traversing lunar shadows and nighttime conditions. While bulky, this prevents hypothermia.\n\n7. **50 Feet of Nylon Rope**  \n   The rope is valuable for traversing craters, assisting team members in climbing obstacles, and securing equipment.\n\n8. **First Aid Kit**  \n   Injuries are inevitable in a 200-mile trek on uneven terrain. A first aid kit can treat wounds and prevent infections that could hinder progress.\n\n9. **Signal Flares**  \n   Useful for signaling the mother ship upon reaching the rendezvous point, especially if there's visual contact but no radio communication.\n\n10. **Parachute Silk**  \n    Multi-functional: can be used for shade against the sun, ground insulation, and makeshift shelters during rests or thermal regulation.\n\n11. **Life Raft**  \n    Primarily unnecessary but could be repurposed for carrying supplies, shielding against lunar dust, or providing insulation.\n\n12. **Two .45 Caliber Pistols**  \n    While self-defense is not an issue on the moon, pistols could be used to startle or signal (audibly or visually), and theoretically to propel projectiles to overcome obstacles.\n\n13. **One Case of Dehydrated Milk**  \n    Provides a secondary source of nutrition but requires water for rehydration and is less efficient compared to food concentrate.\n\n14. **Magnetic Compass**  \n    Useless on the moon due to the absence of a global magnetic field. Navigation relies on celestial bodies, rendering this item redundant.\n\n15. **Box of Matches**  \n    Completely useless in a vacuum environment. Matches require oxygen to ignite, which is unavailable on the lunar surface.\n\n---\n\n### Summary of Key Considerations:  \n- **Survival Essentials:** Oxygen and water are life-critical, followed by navigation tools for the trek.  \n- **Lunar Environment:** Temperature extremes, lack of atmosphere, and challenging terrain dictate the need for thermal regulation, mobility aids, and communication.  \n- **Item Utility:** Tools and supplies that serve multi-functional purposes or aid long-term logical navigation and physical endurance take precedence.\n\nLet me know if you'd like to adjust ranking priorities or discuss specific items further!",
          "ranking": [
            "Oxygen tanks",
            "Water",
            "Stellar map",
            "Solar-powered FM receiver-transmitter",
            "Food concentrate",
            "Portable heating unit",
            "50 feet of nylon rope",
            "First aid kit",
            "Signal flares",
            "Parachute silk",
            "Life raft",
            "Two .45 caliber pistols",
            "One case of dehydrated milk",
            "Magnetic compass",
            "Box of matches"
          ]
        },
        {
          "type": "refinement",
          "iteration": 1,
          "role": "resource",
          "message": "### Refined Ranking of Lunar Survival Items\n\nAfter reviewing the initial ranking with a focus on resource efficiency, utility vs. weight, and survival priorities under the lunar environment, I have adjusted the list where applicable. My decisions below take into account the absolute necessity of some items, the multi-functionality of others, and the redundancy or inefficiency of less useful tools.\n\n---\n\n### **1. Oxygen Tanks**\n- **Justification:** Agreed with the initial ranking. Without oxygen, survival is impossible. This is the most critically life-sustaining item.  \n- **Rationale:** Immediate and continuous priority for survival in a vacuum.\n\n---\n\n### **2. Water**\n- **Justification:** Agreed with the initial ranking. Essential for hydration and physical endurance. Dehydration could hinder cognitive and physical function during the trek.  \n- **Rationale:** It is second only to oxygen in importance for sustaining life.\n\n---\n\n### **3. Stellar Map**\n- **Adjustment:** No change from the original ranking. Navigation is critical to reaching the rendezvous point, especially in the absence of a magnetic compass or GPS.  \n- **Rationale:** Without a reliable navigation method, the team risks getting lost, which would result in failure to survive.\n\n---\n\n### **4. Food Concentrate**\n- **Adjustment:** Moved up from #5. Food is necessary for sustained energy over a 200-mile trek. Lunar conditions will push the crew\u2019s physical limits, so they need quick, high-calorie nutrition.  \n- **Rationale:** Energy depletion compromises decision-making and physical mobility. Water is insufficient to provide energy for this journey.\n\n---\n\n### **5. Solar-powered FM Receiver-Transmitter**\n- **Adjustment:** Lowered from #4. Communication is important but secondary to immediate survival needs like food. Its primary value is at the rendezvous point to ensure rescue, not during the entire trek.  \n- **Rationale:** If navigation is accurate, communication can be utilized later. It's less critical than essentials like food for the trek itself.\n\n---\n\n### **6. Portable Heating Unit**\n- **Adjustment:** No change from the initial ranking. Temperature regulation is necessary to prevent hypothermia during night phases or in shadowed regions.  \n- **Rationale:** Without thermal protection, the extreme lunar cold could be life-threatening.\n\n---\n\n### **7. 50 Feet of Nylon Rope**\n- **Justification:** Agreed with the initial ranking. The rope is lightweight and highly versatile, useful for navigating craters, securing supplies, and team safety during the trek.  \n- **Rationale:** Its multi-purpose utility makes it indispensable.\n\n---\n\n### **8. First Aid Kit**\n- **Justification:** Agreed with the initial ranking. Treating injuries and preventing infections are critical for ensuring the team can continue traveling.  \n- **Rationale:** Although not immediately life-sustaining, it addresses potential survival hindrances during the journey.\n\n---\n\n### **9. Signal Flares**\n- **Justification:** Agreed with the initial ranking. Useful for signaling the mother ship upon arrival at the rendezvous point if visual contact is possible but radio communication fails.  \n- **Rationale:** Its use is situational but important during the final phase of the mission.\n\n---\n\n### **10. Parachute Silk**\n- **Justification:** Agreed with the initial ranking. It can serve as shade, insulation, or shelter against lunar temperatures during rests.  \n- **Rationale:** Multi-functional but non-essential compared to higher-ranked items.\n\n---\n\n### **11. Life Raft**\n- **Justification:** Agreed with the initial ranking. While not needed for flotation, it could be repurposed to carry heavy items, protect against lunar dust, or even insulate supplies.  \n- **Rationale:** Secondary utility makes it less crucial than other items.\n\n---\n\n### **12. Two .45 Caliber Pistols**\n- **Adjustment:** Moved up from #13. While firearms have limited utility, they could be used to propel objects (e.g., creating makeshift projectiles), signal visually or audibly, or assist in physical obstacles.  \n- **Rationale:** A slight edge in potential utility over dehydrated milk.\n\n---\n\n### **13. One Case of Dehydrated Milk**\n- **Justification:** Agree with the original ranking. Provides nutrition but is less efficient than food concentrate and requires water rehydration, which could deplete a critical resource.  \n- **Rationale:** A backup food source with logistical drawbacks.\n\n---\n\n### **14. Magnetic Compass**\n- **Justification:** No change. Completely useless on the moon due to the lack of a global magnetic field. Has no survival value.  \n- **Rationale:** The stellar map is the primary tool for navigation.\n\n---\n\n### **15. Box of Matches**\n- **Justification:** Agreed with the initial ranking. Matches are ineffective in a vacuum as they require oxygen to ignite.  \n- **Rationale:** Zero functionality in the lunar environment.\n\n---\n\n### Final Refined Ranking:\n1. **Oxygen Tanks** \u2013 Critical for survival.  \n2. **Water** \u2013 Essential for hydration and endurance.  \n3. **Stellar Map** \u2013 Vital for accurate navigation.  \n4. **Food Concentrate** \u2013 Necessary for energy and physical activity.  \n5. **Solar-powered FM Receiver-Transmitter** \u2013 Ensures communication with the mother ship.  \n6. **Portable Heating Unit** \u2013 Protects against extreme cold.  \n7. **50 Feet of Nylon Rope** \u2013 Multi-use tool for rugged terrain.  \n8. **First Aid Kit** \u2013 Treats injuries and prevents infections.  \n9. **Signal Flares** \u2013 Signaling aid at the rendezvous point.  \n10. **Parachute Silk** \u2013 Versatile for thermal insulation and shade.  \n11. **Life Raft** \u2013 Useful for carrying supplies and as protection from lunar dust.  \n12. **Two .45 Caliber Pistols** \u2013 Limited use but potentially helpful for signaling or obstacle navigation.  \n13. **One Case of Dehydrated Milk** \u2013 Backup nutrition but water-intensive.  \n14. **Magnetic Compass** \u2013 Useless on the moon; no magnetic field.  \n15. **Box of Matches** \u2013 Completely non-functional in a vacuum.  \n\n---\n\n### Key Adjustments Summary:\n- Food Concentrate raised above the Solar-powered FM Receiver-Transmitter due to its immediate survival importance during the trek.\n- Two .45 Caliber Pistols moved slightly higher than the dehydrated milk due to broader potential uses.  \nThis refined ranking better reflects optimal resource efficiency and survival priorities for the lunar environment.",
          "ranking": [
            "Oxygen tanks",
            "Water",
            "Stellar map",
            "Food concentrate",
            "Solar-powered FM receiver-transmitter",
            "Portable heating unit",
            "50 feet of nylon rope",
            "First aid kit",
            "Signal flares",
            "Parachute silk",
            "Life raft",
            "Two .45 caliber pistols",
            "One case of dehydrated milk",
            "Magnetic compass",
            "Box of matches"
          ]
        }
      ],
      "iterations": [
        {
          "iteration": 0,
          "current_ranking": [
            "Oxygen tanks",
            "Water",
            "Stellar map",
            "Solar-powered FM receiver-transmitter",
            "Food concentrate",
            "Portable heating unit",
            "50 feet of nylon rope",
            "First aid kit",
            "Signal flares",
            "Parachute silk",
            "Life raft",
            "Two .45 caliber pistols",
            "One case of dehydrated milk",
            "Magnetic compass",
            "Box of matches"
          ],
          "current_message": "Here is my initial ranking of the survival items based on lunar conditions and the team's shared understanding of survival priorities:\n\n### **Ranked List with Justifications**\n1. **Oxygen Tanks**  \n   Oxygen is essential for maintaining life. The moon has no atmosphere, so this is the highest priority. Without oxygen, survival is impossible within minutes.\n\n2. **Water**  \n   Water is vital for hydration and survival. Dehydration can lead to cognitive dysfunction and physical incapacitation during the trek.\n\n3. **Stellar Map**  \n   Since the moon lacks magnetic fields and a reliable GPS system, celestial navigation is required to find the correct path to the rendezvous point.\n\n4. **Solar-powered FM Receiver-Transmitter**  \n   Communication with the mother ship is critical for navigation updates, emergency assistance, and assurance of rescue at the rendezvous point.\n\n5. **Food Concentrate**  \n   Nutritional energy is necessary to maintain physical activity and cognitive function during the trek. Food concentrate is compact and high in calories.\n\n6. **Portable Heating Unit**  \n   Thermal regulation is crucial due to the extreme cold when traversing lunar shadows and nighttime conditions. While bulky, this prevents hypothermia.\n\n7. **50 Feet of Nylon Rope**  \n   The rope is valuable for traversing craters, assisting team members in climbing obstacles, and securing equipment.\n\n8. **First Aid Kit**  \n   Injuries are inevitable in a 200-mile trek on uneven terrain. A first aid kit can treat wounds and prevent infections that could hinder progress.\n\n9. **Signal Flares**  \n   Useful for signaling the mother ship upon reaching the rendezvous point, especially if there's visual contact but no radio communication.\n\n10. **Parachute Silk**  \n    Multi-functional: can be used for shade against the sun, ground insulation, and makeshift shelters during rests or thermal regulation.\n\n11. **Life Raft**  \n    Primarily unnecessary but could be repurposed for carrying supplies, shielding against lunar dust, or providing insulation.\n\n12. **Two .45 Caliber Pistols**  \n    While self-defense is not an issue on the moon, pistols could be used to startle or signal (audibly or visually), and theoretically to propel projectiles to overcome obstacles.\n\n13. **One Case of Dehydrated Milk**  \n    Provides a secondary source of nutrition but requires water for rehydration and is less efficient compared to food concentrate.\n\n14. **Magnetic Compass**  \n    Useless on the moon due to the absence of a global magnetic field. Navigation relies on celestial bodies, rendering this item redundant.\n\n15. **Box of Matches**  \n    Completely useless in a vacuum environment. Matches require oxygen to ignite, which is unavailable on the lunar surface.\n\n---\n\n### Summary of Key Considerations:  \n- **Survival Essentials:** Oxygen and water are life-critical, followed by navigation tools for the trek.  \n- **Lunar Environment:** Temperature extremes, lack of atmosphere, and challenging terrain dictate the need for thermal regulation, mobility aids, and communication.  \n- **Item Utility:** Tools and supplies that serve multi-functional purposes or aid long-term logical navigation and physical endurance take precedence.\n\nLet me know if you'd like to adjust ranking priorities or discuss specific items further!",
          "current_agent": "science"
        },
        {
          "iteration": 1,
          "current_ranking": [
            "Oxygen tanks",
            "Water",
            "Stellar map",
            "Food concentrate",
            "Solar-powered FM receiver-transmitter",
            "Portable heating unit",
            "50 feet of nylon rope",
            "First aid kit",
            "Signal flares",
            "Parachute silk",
            "Life raft",
            "Two .45 caliber pistols",
            "One case of dehydrated milk",
            "Magnetic compass",
            "Box of matches"
          ],
          "current_message": "### Refined Ranking of Lunar Survival Items\n\nAfter reviewing the initial ranking with a focus on resource efficiency, utility vs. weight, and survival priorities under the lunar environment, I have adjusted the list where applicable. My decisions below take into account the absolute necessity of some items, the multi-functionality of others, and the redundancy or inefficiency of less useful tools.\n\n---\n\n### **1. Oxygen Tanks**\n- **Justification:** Agreed with the initial ranking. Without oxygen, survival is impossible. This is the most critically life-sustaining item.  \n- **Rationale:** Immediate and continuous priority for survival in a vacuum.\n\n---\n\n### **2. Water**\n- **Justification:** Agreed with the initial ranking. Essential for hydration and physical endurance. Dehydration could hinder cognitive and physical function during the trek.  \n- **Rationale:** It is second only to oxygen in importance for sustaining life.\n\n---\n\n### **3. Stellar Map**\n- **Adjustment:** No change from the original ranking. Navigation is critical to reaching the rendezvous point, especially in the absence of a magnetic compass or GPS.  \n- **Rationale:** Without a reliable navigation method, the team risks getting lost, which would result in failure to survive.\n\n---\n\n### **4. Food Concentrate**\n- **Adjustment:** Moved up from #5. Food is necessary for sustained energy over a 200-mile trek. Lunar conditions will push the crew\u2019s physical limits, so they need quick, high-calorie nutrition.  \n- **Rationale:** Energy depletion compromises decision-making and physical mobility. Water is insufficient to provide energy for this journey.\n\n---\n\n### **5. Solar-powered FM Receiver-Transmitter**\n- **Adjustment:** Lowered from #4. Communication is important but secondary to immediate survival needs like food. Its primary value is at the rendezvous point to ensure rescue, not during the entire trek.  \n- **Rationale:** If navigation is accurate, communication can be utilized later. It's less critical than essentials like food for the trek itself.\n\n---\n\n### **6. Portable Heating Unit**\n- **Adjustment:** No change from the initial ranking. Temperature regulation is necessary to prevent hypothermia during night phases or in shadowed regions.  \n- **Rationale:** Without thermal protection, the extreme lunar cold could be life-threatening.\n\n---\n\n### **7. 50 Feet of Nylon Rope**\n- **Justification:** Agreed with the initial ranking. The rope is lightweight and highly versatile, useful for navigating craters, securing supplies, and team safety during the trek.  \n- **Rationale:** Its multi-purpose utility makes it indispensable.\n\n---\n\n### **8. First Aid Kit**\n- **Justification:** Agreed with the initial ranking. Treating injuries and preventing infections are critical for ensuring the team can continue traveling.  \n- **Rationale:** Although not immediately life-sustaining, it addresses potential survival hindrances during the journey.\n\n---\n\n### **9. Signal Flares**\n- **Justification:** Agreed with the initial ranking. Useful for signaling the mother ship upon arrival at the rendezvous point if visual contact is possible but radio communication fails.  \n- **Rationale:** Its use is situational but important during the final phase of the mission.\n\n---\n\n### **10. Parachute Silk**\n- **Justification:** Agreed with the initial ranking. It can serve as shade, insulation, or shelter against lunar temperatures during rests.  \n- **Rationale:** Multi-functional but non-essential compared to higher-ranked items.\n\n---\n\n### **11. Life Raft**\n- **Justification:** Agreed with the initial ranking. While not needed for flotation, it could be repurposed to carry heavy items, protect against lunar dust, or even insulate supplies.  \n- **Rationale:** Secondary utility makes it less crucial than other items.\n\n---\n\n### **12. Two .45 Caliber Pistols**\n- **Adjustment:** Moved up from #13. While firearms have limited utility, they could be used to propel objects (e.g., creating makeshift projectiles), signal visually or audibly, or assist in physical obstacles.  \n- **Rationale:** A slight edge in potential utility over dehydrated milk.\n\n---\n\n### **13. One Case of Dehydrated Milk**\n- **Justification:** Agree with the original ranking. Provides nutrition but is less efficient than food concentrate and requires water rehydration, which could deplete a critical resource.  \n- **Rationale:** A backup food source with logistical drawbacks.\n\n---\n\n### **14. Magnetic Compass**\n- **Justification:** No change. Completely useless on the moon due to the lack of a global magnetic field. Has no survival value.  \n- **Rationale:** The stellar map is the primary tool for navigation.\n\n---\n\n### **15. Box of Matches**\n- **Justification:** Agreed with the initial ranking. Matches are ineffective in a vacuum as they require oxygen to ignite.  \n- **Rationale:** Zero functionality in the lunar environment.\n\n---\n\n### Final Refined Ranking:\n1. **Oxygen Tanks** \u2013 Critical for survival.  \n2. **Water** \u2013 Essential for hydration and endurance.  \n3. **Stellar Map** \u2013 Vital for accurate navigation.  \n4. **Food Concentrate** \u2013 Necessary for energy and physical activity.  \n5. **Solar-powered FM Receiver-Transmitter** \u2013 Ensures communication with the mother ship.  \n6. **Portable Heating Unit** \u2013 Protects against extreme cold.  \n7. **50 Feet of Nylon Rope** \u2013 Multi-use tool for rugged terrain.  \n8. **First Aid Kit** \u2013 Treats injuries and prevents infections.  \n9. **Signal Flares** \u2013 Signaling aid at the rendezvous point.  \n10. **Parachute Silk** \u2013 Versatile for thermal insulation and shade.  \n11. **Life Raft** \u2013 Useful for carrying supplies and as protection from lunar dust.  \n12. **Two .45 Caliber Pistols** \u2013 Limited use but potentially helpful for signaling or obstacle navigation.  \n13. **One Case of Dehydrated Milk** \u2013 Backup nutrition but water-intensive.  \n14. **Magnetic Compass** \u2013 Useless on the moon; no magnetic field.  \n15. **Box of Matches** \u2013 Completely non-functional in a vacuum.  \n\n---\n\n### Key Adjustments Summary:\n- Food Concentrate raised above the Solar-powered FM Receiver-Transmitter due to its immediate survival importance during the trek.\n- Two .45 Caliber Pistols moved slightly higher than the dehydrated milk due to broader potential uses.  \nThis refined ranking better reflects optimal resource efficiency and survival priorities for the lunar environment.",
          "current_agent": "resource",
          "difference_score": 2
        }
      ],
      "final_ranking": [
        "Oxygen tanks",
        "Water",
        "Stellar map",
        "Food concentrate",
        "Solar-powered FM receiver-transmitter",
        "Portable heating unit",
        "50 feet of nylon rope",
        "First aid kit",
        "Signal flares",
        "Parachute silk",
        "Life raft",
        "Two .45 caliber pistols",
        "One case of dehydrated milk",
        "Magnetic compass",
        "Box of matches"
      ],
      "final_message": "### Refined Ranking of Lunar Survival Items\n\nAfter reviewing the initial ranking with a focus on resource efficiency, utility vs. weight, and survival priorities under the lunar environment, I have adjusted the list where applicable. My decisions below take into account the absolute necessity of some items, the multi-functionality of others, and the redundancy or inefficiency of less useful tools.\n\n---\n\n### **1. Oxygen Tanks**\n- **Justification:** Agreed with the initial ranking. Without oxygen, survival is impossible. This is the most critically life-sustaining item.  \n- **Rationale:** Immediate and continuous priority for survival in a vacuum.\n\n---\n\n### **2. Water**\n- **Justification:** Agreed with the initial ranking. Essential for hydration and physical endurance. Dehydration could hinder cognitive and physical function during the trek.  \n- **Rationale:** It is second only to oxygen in importance for sustaining life.\n\n---\n\n### **3. Stellar Map**\n- **Adjustment:** No change from the original ranking. Navigation is critical to reaching the rendezvous point, especially in the absence of a magnetic compass or GPS.  \n- **Rationale:** Without a reliable navigation method, the team risks getting lost, which would result in failure to survive.\n\n---\n\n### **4. Food Concentrate**\n- **Adjustment:** Moved up from #5. Food is necessary for sustained energy over a 200-mile trek. Lunar conditions will push the crew\u2019s physical limits, so they need quick, high-calorie nutrition.  \n- **Rationale:** Energy depletion compromises decision-making and physical mobility. Water is insufficient to provide energy for this journey.\n\n---\n\n### **5. Solar-powered FM Receiver-Transmitter**\n- **Adjustment:** Lowered from #4. Communication is important but secondary to immediate survival needs like food. Its primary value is at the rendezvous point to ensure rescue, not during the entire trek.  \n- **Rationale:** If navigation is accurate, communication can be utilized later. It's less critical than essentials like food for the trek itself.\n\n---\n\n### **6. Portable Heating Unit**\n- **Adjustment:** No change from the initial ranking. Temperature regulation is necessary to prevent hypothermia during night phases or in shadowed regions.  \n- **Rationale:** Without thermal protection, the extreme lunar cold could be life-threatening.\n\n---\n\n### **7. 50 Feet of Nylon Rope**\n- **Justification:** Agreed with the initial ranking. The rope is lightweight and highly versatile, useful for navigating craters, securing supplies, and team safety during the trek.  \n- **Rationale:** Its multi-purpose utility makes it indispensable.\n\n---\n\n### **8. First Aid Kit**\n- **Justification:** Agreed with the initial ranking. Treating injuries and preventing infections are critical for ensuring the team can continue traveling.  \n- **Rationale:** Although not immediately life-sustaining, it addresses potential survival hindrances during the journey.\n\n---\n\n### **9. Signal Flares**\n- **Justification:** Agreed with the initial ranking. Useful for signaling the mother ship upon arrival at the rendezvous point if visual contact is possible but radio communication fails.  \n- **Rationale:** Its use is situational but important during the final phase of the mission.\n\n---\n\n### **10. Parachute Silk**\n- **Justification:** Agreed with the initial ranking. It can serve as shade, insulation, or shelter against lunar temperatures during rests.  \n- **Rationale:** Multi-functional but non-essential compared to higher-ranked items.\n\n---\n\n### **11. Life Raft**\n- **Justification:** Agreed with the initial ranking. While not needed for flotation, it could be repurposed to carry heavy items, protect against lunar dust, or even insulate supplies.  \n- **Rationale:** Secondary utility makes it less crucial than other items.\n\n---\n\n### **12. Two .45 Caliber Pistols**\n- **Adjustment:** Moved up from #13. While firearms have limited utility, they could be used to propel objects (e.g., creating makeshift projectiles), signal visually or audibly, or assist in physical obstacles.  \n- **Rationale:** A slight edge in potential utility over dehydrated milk.\n\n---\n\n### **13. One Case of Dehydrated Milk**\n- **Justification:** Agree with the original ranking. Provides nutrition but is less efficient than food concentrate and requires water rehydration, which could deplete a critical resource.  \n- **Rationale:** A backup food source with logistical drawbacks.\n\n---\n\n### **14. Magnetic Compass**\n- **Justification:** No change. Completely useless on the moon due to the lack of a global magnetic field. Has no survival value.  \n- **Rationale:** The stellar map is the primary tool for navigation.\n\n---\n\n### **15. Box of Matches**\n- **Justification:** Agreed with the initial ranking. Matches are ineffective in a vacuum as they require oxygen to ignite.  \n- **Rationale:** Zero functionality in the lunar environment.\n\n---\n\n### Final Refined Ranking:\n1. **Oxygen Tanks** \u2013 Critical for survival.  \n2. **Water** \u2013 Essential for hydration and endurance.  \n3. **Stellar Map** \u2013 Vital for accurate navigation.  \n4. **Food Concentrate** \u2013 Necessary for energy and physical activity.  \n5. **Solar-powered FM Receiver-Transmitter** \u2013 Ensures communication with the mother ship.  \n6. **Portable Heating Unit** \u2013 Protects against extreme cold.  \n7. **50 Feet of Nylon Rope** \u2013 Multi-use tool for rugged terrain.  \n8. **First Aid Kit** \u2013 Treats injuries and prevents infections.  \n9. **Signal Flares** \u2013 Signaling aid at the rendezvous point.  \n10. **Parachute Silk** \u2013 Versatile for thermal insulation and shade.  \n11. **Life Raft** \u2013 Useful for carrying supplies and as protection from lunar dust.  \n12. **Two .45 Caliber Pistols** \u2013 Limited use but potentially helpful for signaling or obstacle navigation.  \n13. **One Case of Dehydrated Milk** \u2013 Backup nutrition but water-intensive.  \n14. **Magnetic Compass** \u2013 Useless on the moon; no magnetic field.  \n15. **Box of Matches** \u2013 Completely non-functional in a vacuum.  \n\n---\n\n### Key Adjustments Summary:\n- Food Concentrate raised above the Solar-powered FM Receiver-Transmitter due to its immediate survival importance during the trek.\n- Two .45 Caliber Pistols moved slightly higher than the dehydrated milk due to broader potential uses.  \nThis refined ranking better reflects optimal resource efficiency and survival priorities for the lunar environment.",
      "score": 16
    }
  ],
  "final_ranking": [
    "Oxygen tanks",
    "Water",
    "Stellar map",
    "Food concentrate",
    "Solar-powered FM receiver-transmitter",
    "Portable heating unit",
    "50 feet of nylon rope",
    "First aid kit",
    "Signal flares",
    "Parachute silk",
    "Life raft",
    "Two .45 caliber pistols",
    "One case of dehydrated milk",
    "Magnetic compass",
    "Box of matches"
  ],
  "nasa_ranking": [
    "Oxygen tanks",
    "Water",
    "Stellar map",
    "Food concentrate",
    "Solar-powered FM receiver-transmitter",
    "50 feet of nylon rope",
    "First aid kit",
    "Parachute silk",
    "Life raft",
    "Signal flares",
    "Two .45 caliber pistols",
    "One case of dehydrated milk",
    "Portable heating unit",
    "Magnetic compass",
    "Box of matches"
  ],
  "score": 16,
  "teamwork_metrics": {
    "shared_mental_model": {
      "convergence_trend": "unknown",
      "final_convergence": 0.1356382978723404,
      "understanding_completeness": {
        "science": 0.5222222222222223,
        "resource": 0.4772727272727273
      },
      "avg_completeness": 0.4997474747474748,
      "effectiveness_rating": "low"
    }
  }
}