{
  "simulation_id": "sim_leadership_closed_loop_mutual_monitoring_shared_mental_model_20250417_131700",
  "config": {
    "use_team_leadership": true,
    "use_closed_loop_comm": true,
    "use_mutual_monitoring": true,
    "use_shared_mental_model": true
  },
  "exchanges": [
    {
      "type": "sequential_refinement",
      "exchanges": [
        {
          "type": "initial_ranking",
          "role": "resource",
          "message": "Here is my initial ranking of the lunar survival items. I based this on survival priorities for the lunar environment and the critical conditions of the trek. Each rank is explained with its relevance to the scenario.\n\n---\n\n### **Ranked List with Justifications**\n\n1. **Oxygen tanks**  \n   - **Justification**: Oxygen is absolutely critical for survival in the moon's airless environment. Without it, life is unsustainable beyond minutes. Hence, it is the highest priority.\n\n2. **Water**  \n   - **Justification**: Dehydration is a serious risk, especially when trekking across the lunar surface. Water is essential to regulate bodily functions and maintain survival over the duration of the trek.\n\n3. **Stellar map**  \n   - **Justification**: Navigation is crucial for reaching the rendezvous point. A stellar map will allow the crew to orient themselves and find the correct route amidst the desolate lunar landscape.\n\n4. **Solar-powered FM receiver-transmitter**  \n   - **Justification**: Effective communication with the mother ship or potential rescue parties is critical to ensuring support, updates, and coordination during the trek.\n\n5. **Portable heating unit**  \n   - **Justification**: Extreme temperatures on the moon can be life-threatening. A heating unit would help regulate body temperature during the harsh cold periods on the trek.\n\n6. **Food concentrate**  \n   - **Justification**: While food needs are secondary to oxygen and water, compact food concentrate ensures energy for the trek without adding much weight.\n\n7. **First aid kit**  \n   - **Justification**: Medical emergencies or injuries during the trek must be treated immediately to ensure the crew remains capable of continuing.\n\n8. **50 feet of nylon rope**  \n   - **Justification**: The terrain is uneven and potentially hazardous. Nylon rope can assist in climbing, securing equipment, or rescuing members in dangerous situations.\n\n9. **Signal flares**  \n   - **Justification**: Flares can assist in signaling the rendezvous team upon approach or attracting attention during an emergency.\n\n10. **Parachute silk**  \n    - **Justification**: This can be used to create a shade for protection against the sun or as insulation during colder temperatures.\n\n11. **Magnetic compass**  \n    - **Justification**: A magnetic compass is of limited use on the moon due to the lack of a global magnetic field, so this ranks low for navigation.\n\n12. **Life raft**  \n    - **Justification**: A life raft is meant for water environments, which are nonexistent on the moon. Its only utility might be as an insulating surface or cargo carrier.\n\n13. **One case of dehydrated milk**  \n    - **Justification**: While food is important, dehydrated milk takes a secondary role to other more crucial food supplies like concentrates and water. It is bulkier and harder to rehydrate.\n\n14. **Two .45 caliber pistols**  \n    - **Justification**: Firearms have almost no utility in the lunar environment apart from possible self-defense against hazards like meteorite debris or for mechanical purposes (e.g., triggering devices).\n\n15. **Box of matches**  \n    - **Justification**: Matches are completely useless in the vacuum of the moon, where there is no oxygen for combustion. They serve no functional purpose in this environment.\n\n---\n\nThis ranking prioritizes survival essentials and items that directly support navigation, communication, and adaptation to lunar conditions. Let me know if this aligns with your understanding or if we need further discussion! \n\n**(Request for Confirmation):** Please confirm that our team's shared understanding of lunar conditions and survival priorities was applied correctly in this ranking process. Let me know if I misunderstood any assumptions.",
          "ranking": [
            "Oxygen tanks",
            "Water",
            "Stellar map",
            "Solar-powered FM receiver-transmitter",
            "Portable heating unit",
            "Food concentrate",
            "First aid kit",
            "50 feet of nylon rope",
            "Signal flares",
            "Parachute silk",
            "Magnetic compass",
            "Life raft",
            "One case of dehydrated milk",
            "Two .45 caliber pistols",
            "Box of matches"
          ]
        },
        {
          "type": "refinement",
          "iteration": 1,
          "role": "science",
          "message": "### **Refined Ranking of Lunar Survival Items**\n\nBased on the shared team understanding of the lunar environment and survival priorities, as well as my technical expertise in lunar conditions, I have refined the item rankings. Below is the revised list, incorporating justifications for any adjustments.\n\n---\n\n### **Refined Ranked List with Justifications**\n\n#### **1. Oxygen tanks**  \n- **Reason for Placement**: Oxygen remains the single most critical item because survival is impossible in the moon\u2019s vacuum without breathable air. No other item matches its importance for life sustenance.  \n- **Agreement**: This ranking remains unchanged.\n\n---\n\n#### **2. Water**  \n- **Reason for Placement**: Dehydration risks increase significantly during the 200-mile trek. Water is vital for bodily functions and temperature regulation, especially in the harsh lunar environment.  \n- **Agreement**: This placement remains unchanged.\n\n---\n\n#### **3. Solar-powered FM receiver-transmitter**  \n- **Change**: Previously ranked #4 \u2192 Moved to #3.  \n- **Reason**: Effective communication with the mother ship is essential to coordinate rescue or signal for help if the team gets lost or delayed. With no atmosphere, radio is the only viable communication method. It must be available to keep the team connected.  \n- **Specialized Knowledge**: Communication can serve as secondary navigation, with updates about coordinates or potential hazards, hence increasing its importance.\n\n---\n\n#### **4. Stellar map**  \n- **Change**: Previously ranked #3 \u2192 Moved to #4.  \n- **Reason**: While navigation is critical, a stellar map is secondary to communication, which can assist with real-time updates on direction. Still, knowing positioning relative to constellations and landmarks ensures the crew\u2019s path to the rendezvous point.  \n- **Agreement**: Navigation remains top-tier, with minor reprioritization.\n\n---\n\n#### **5. Portable heating unit**  \n- **Reason for Placement**: Extreme cold during the lunar night (-250\u00b0F) poses life-threatening risks. A portable heating unit is essential for maintaining adequate body temperature and preventing hypothermia.  \n- **Agreement**: Placement remains unchanged, as temperature regulation is vital for survival.\n\n---\n\n#### **6. Food concentrate**  \n- **Reason for Placement**: Provides vital energy for the strenuous trek without unnecessary mass or bulk. Food, while less critical than oxygen and water, remains a necessity for sustained energy and focus over extended periods.  \n- **Agreement**: Placement remains unchanged.\n\n---\n\n#### **7. First aid kit**  \n- **Change**: Previously ranked #7 \u2192 Remains #7.  \n- **Reason**: Immediate medical treatment is essential for injuries or other health concerns during the trek. Absence of timely care could result in death or incapacity, making the kit indispensable but secondary to oxygen, water, food, and temperature regulation.  \n- **Agreement**: No changes needed.\n\n---\n\n#### **8. Signal flares**  \n- **Change**: Previously ranked #9 \u2192 Moved to #8.  \n- **Reason**: Visual signaling at critical junctures, especially upon nearing the rendezvous point, could save time and aid rescue. Matches are useless in the lunar environment, and communication through radio could fail. Flares are the best backup signaling mechanism.  \n- **Specialized Knowledge**: Flares provide a reliable form of signaling even in extreme visibility conditions on the lunar surface.\n\n---\n\n#### **9. 50 feet of nylon rope**  \n- **Change**: Previously ranked #8 \u2192 Moved to #9.  \n- **Reason**: Nylon rope\u2019s utility for climbing, securing equipment, or creating makeshift solutions on uneven terrain remains valid but slightly less critical than reliable signaling mechanisms via flares.  \n- **Agreement**: The utility vs. frequency of usage balances its ranking here.\n\n---\n\n#### **10. Parachute silk**  \n- **Change**: Previously ranked #10 \u2192 Remains #10.  \n- **Reason**: Useful as insulation against the sun or cold and as a makeshift shade. Its utility is important but secondary compared to direct survival tools like water, food, and signaling.  \n- **Agreement**: This placement is appropriate.\n\n---\n\n#### **11. Magnetic compass**  \n- **Change**: Previously ranked #11 \u2192 Remains #11.  \n- **Reason**: The moon lacks a global magnetic field, making the compass nearly useless for navigation. It only retains minor use as a backup tool for indicating relative directions or angles if landmarks can be visualized.  \n- **Specialized Knowledge**: Lunar navigation relies entirely on maps, celestial orientation, or communication systems.\n\n---\n\n#### **12. Life raft**  \n- **Change**: Previously ranked #12 \u2192 Remains #12.  \n- **Reason**: While lacking purpose for flotation, it could double as an insulating platform for resting or transporting supplies over rough terrain. Its utility is minimal in this scenario.  \n- **Agreement**: This ranking remains appropriate.\n\n---\n\n#### **13. One case of dehydrated milk**  \n- **Change**: Previously ranked #13 \u2192 Remains #13.  \n- **Reason**: Dehydrated milk ranks low as it is bulky, secondary to more compact food sources, and requires water (already a critical resource) for rehydration.  \n- **Specialized Knowledge**: Food concentrate delivers more vital energy with less fuss and weight.\n\n---\n\n#### **14. Two .45 caliber pistols**  \n- **Change**: Previously ranked #14 \u2192 Remains #14.  \n- **Reason**: Firearms are practically useless in the lunar environment, as no known hazards require defense. Their only application might be for mechanical operations or triggering systems, which is negligible.  \n- **Specialized Knowledge**: Lunar threats stem from environmental conditions, not external entities.\n\n---\n\n#### **15. Box of matches**  \n- **Change**: Previously ranked #15 \u2192 Remains #15.  \n- **Reason**: Matches are entirely ineffective in a vacuum, where combustion cannot occur due to the absence of oxygen. Other signaling methods supersede their purpose.  \n- **Agreement**: Matches have no functional utility.\n\n---\n\n### **Final Refined Ranking**\n1. Oxygen tanks  \n2. Water  \n3. Solar-powered FM receiver-transmitter  \n4. Stellar map  \n5. Portable heating unit  \n6. Food concentrate  \n7. First aid kit  \n8. Signal flares  \n9. 50 feet of nylon rope  \n10. Parachute silk  \n11. Magnetic compass  \n12. Life raft  \n13. One case of dehydrated milk  \n14. Two .45 caliber pistols  \n15. Box of matches  \n\n---\n\n**Team Communication Model** (Closed-Loop Confirmation):\n- *Message Sent*: \"Refined rankings provided. Adjustments explained for items #3, #4, and #8. Confirm acceptance or discuss points requiring clarification.\"  \n- *Message Received*: (Acknowledged receipt and understanding).  \n- *Sender Verification*: \"Confirmed shared understanding of rationale.\"  ",
          "ranking": [
            "Oxygen tanks",
            "Water",
            "Solar-powered FM receiver-transmitter",
            "Stellar map",
            "Portable heating unit",
            "Food concentrate",
            "First aid kit",
            "Signal flares",
            "50 feet of nylon rope",
            "Parachute silk",
            "Magnetic compass",
            "Life raft",
            "One case of dehydrated milk",
            "Two .45 caliber pistols",
            "Box of matches"
          ]
        }
      ],
      "iterations": [
        {
          "iteration": 0,
          "current_ranking": [
            "Oxygen tanks",
            "Water",
            "Stellar map",
            "Solar-powered FM receiver-transmitter",
            "Portable heating unit",
            "Food concentrate",
            "First aid kit",
            "50 feet of nylon rope",
            "Signal flares",
            "Parachute silk",
            "Magnetic compass",
            "Life raft",
            "One case of dehydrated milk",
            "Two .45 caliber pistols",
            "Box of matches"
          ],
          "current_message": "Here is my initial ranking of the lunar survival items. I based this on survival priorities for the lunar environment and the critical conditions of the trek. Each rank is explained with its relevance to the scenario.\n\n---\n\n### **Ranked List with Justifications**\n\n1. **Oxygen tanks**  \n   - **Justification**: Oxygen is absolutely critical for survival in the moon's airless environment. Without it, life is unsustainable beyond minutes. Hence, it is the highest priority.\n\n2. **Water**  \n   - **Justification**: Dehydration is a serious risk, especially when trekking across the lunar surface. Water is essential to regulate bodily functions and maintain survival over the duration of the trek.\n\n3. **Stellar map**  \n   - **Justification**: Navigation is crucial for reaching the rendezvous point. A stellar map will allow the crew to orient themselves and find the correct route amidst the desolate lunar landscape.\n\n4. **Solar-powered FM receiver-transmitter**  \n   - **Justification**: Effective communication with the mother ship or potential rescue parties is critical to ensuring support, updates, and coordination during the trek.\n\n5. **Portable heating unit**  \n   - **Justification**: Extreme temperatures on the moon can be life-threatening. A heating unit would help regulate body temperature during the harsh cold periods on the trek.\n\n6. **Food concentrate**  \n   - **Justification**: While food needs are secondary to oxygen and water, compact food concentrate ensures energy for the trek without adding much weight.\n\n7. **First aid kit**  \n   - **Justification**: Medical emergencies or injuries during the trek must be treated immediately to ensure the crew remains capable of continuing.\n\n8. **50 feet of nylon rope**  \n   - **Justification**: The terrain is uneven and potentially hazardous. Nylon rope can assist in climbing, securing equipment, or rescuing members in dangerous situations.\n\n9. **Signal flares**  \n   - **Justification**: Flares can assist in signaling the rendezvous team upon approach or attracting attention during an emergency.\n\n10. **Parachute silk**  \n    - **Justification**: This can be used to create a shade for protection against the sun or as insulation during colder temperatures.\n\n11. **Magnetic compass**  \n    - **Justification**: A magnetic compass is of limited use on the moon due to the lack of a global magnetic field, so this ranks low for navigation.\n\n12. **Life raft**  \n    - **Justification**: A life raft is meant for water environments, which are nonexistent on the moon. Its only utility might be as an insulating surface or cargo carrier.\n\n13. **One case of dehydrated milk**  \n    - **Justification**: While food is important, dehydrated milk takes a secondary role to other more crucial food supplies like concentrates and water. It is bulkier and harder to rehydrate.\n\n14. **Two .45 caliber pistols**  \n    - **Justification**: Firearms have almost no utility in the lunar environment apart from possible self-defense against hazards like meteorite debris or for mechanical purposes (e.g., triggering devices).\n\n15. **Box of matches**  \n    - **Justification**: Matches are completely useless in the vacuum of the moon, where there is no oxygen for combustion. They serve no functional purpose in this environment.\n\n---\n\nThis ranking prioritizes survival essentials and items that directly support navigation, communication, and adaptation to lunar conditions. Let me know if this aligns with your understanding or if we need further discussion! \n\n**(Request for Confirmation):** Please confirm that our team's shared understanding of lunar conditions and survival priorities was applied correctly in this ranking process. Let me know if I misunderstood any assumptions.",
          "current_agent": "resource"
        },
        {
          "iteration": 1,
          "current_ranking": [
            "Oxygen tanks",
            "Water",
            "Solar-powered FM receiver-transmitter",
            "Stellar map",
            "Portable heating unit",
            "Food concentrate",
            "First aid kit",
            "Signal flares",
            "50 feet of nylon rope",
            "Parachute silk",
            "Magnetic compass",
            "Life raft",
            "One case of dehydrated milk",
            "Two .45 caliber pistols",
            "Box of matches"
          ],
          "current_message": "### **Refined Ranking of Lunar Survival Items**\n\nBased on the shared team understanding of the lunar environment and survival priorities, as well as my technical expertise in lunar conditions, I have refined the item rankings. Below is the revised list, incorporating justifications for any adjustments.\n\n---\n\n### **Refined Ranked List with Justifications**\n\n#### **1. Oxygen tanks**  \n- **Reason for Placement**: Oxygen remains the single most critical item because survival is impossible in the moon\u2019s vacuum without breathable air. No other item matches its importance for life sustenance.  \n- **Agreement**: This ranking remains unchanged.\n\n---\n\n#### **2. Water**  \n- **Reason for Placement**: Dehydration risks increase significantly during the 200-mile trek. Water is vital for bodily functions and temperature regulation, especially in the harsh lunar environment.  \n- **Agreement**: This placement remains unchanged.\n\n---\n\n#### **3. Solar-powered FM receiver-transmitter**  \n- **Change**: Previously ranked #4 \u2192 Moved to #3.  \n- **Reason**: Effective communication with the mother ship is essential to coordinate rescue or signal for help if the team gets lost or delayed. With no atmosphere, radio is the only viable communication method. It must be available to keep the team connected.  \n- **Specialized Knowledge**: Communication can serve as secondary navigation, with updates about coordinates or potential hazards, hence increasing its importance.\n\n---\n\n#### **4. Stellar map**  \n- **Change**: Previously ranked #3 \u2192 Moved to #4.  \n- **Reason**: While navigation is critical, a stellar map is secondary to communication, which can assist with real-time updates on direction. Still, knowing positioning relative to constellations and landmarks ensures the crew\u2019s path to the rendezvous point.  \n- **Agreement**: Navigation remains top-tier, with minor reprioritization.\n\n---\n\n#### **5. Portable heating unit**  \n- **Reason for Placement**: Extreme cold during the lunar night (-250\u00b0F) poses life-threatening risks. A portable heating unit is essential for maintaining adequate body temperature and preventing hypothermia.  \n- **Agreement**: Placement remains unchanged, as temperature regulation is vital for survival.\n\n---\n\n#### **6. Food concentrate**  \n- **Reason for Placement**: Provides vital energy for the strenuous trek without unnecessary mass or bulk. Food, while less critical than oxygen and water, remains a necessity for sustained energy and focus over extended periods.  \n- **Agreement**: Placement remains unchanged.\n\n---\n\n#### **7. First aid kit**  \n- **Change**: Previously ranked #7 \u2192 Remains #7.  \n- **Reason**: Immediate medical treatment is essential for injuries or other health concerns during the trek. Absence of timely care could result in death or incapacity, making the kit indispensable but secondary to oxygen, water, food, and temperature regulation.  \n- **Agreement**: No changes needed.\n\n---\n\n#### **8. Signal flares**  \n- **Change**: Previously ranked #9 \u2192 Moved to #8.  \n- **Reason**: Visual signaling at critical junctures, especially upon nearing the rendezvous point, could save time and aid rescue. Matches are useless in the lunar environment, and communication through radio could fail. Flares are the best backup signaling mechanism.  \n- **Specialized Knowledge**: Flares provide a reliable form of signaling even in extreme visibility conditions on the lunar surface.\n\n---\n\n#### **9. 50 feet of nylon rope**  \n- **Change**: Previously ranked #8 \u2192 Moved to #9.  \n- **Reason**: Nylon rope\u2019s utility for climbing, securing equipment, or creating makeshift solutions on uneven terrain remains valid but slightly less critical than reliable signaling mechanisms via flares.  \n- **Agreement**: The utility vs. frequency of usage balances its ranking here.\n\n---\n\n#### **10. Parachute silk**  \n- **Change**: Previously ranked #10 \u2192 Remains #10.  \n- **Reason**: Useful as insulation against the sun or cold and as a makeshift shade. Its utility is important but secondary compared to direct survival tools like water, food, and signaling.  \n- **Agreement**: This placement is appropriate.\n\n---\n\n#### **11. Magnetic compass**  \n- **Change**: Previously ranked #11 \u2192 Remains #11.  \n- **Reason**: The moon lacks a global magnetic field, making the compass nearly useless for navigation. It only retains minor use as a backup tool for indicating relative directions or angles if landmarks can be visualized.  \n- **Specialized Knowledge**: Lunar navigation relies entirely on maps, celestial orientation, or communication systems.\n\n---\n\n#### **12. Life raft**  \n- **Change**: Previously ranked #12 \u2192 Remains #12.  \n- **Reason**: While lacking purpose for flotation, it could double as an insulating platform for resting or transporting supplies over rough terrain. Its utility is minimal in this scenario.  \n- **Agreement**: This ranking remains appropriate.\n\n---\n\n#### **13. One case of dehydrated milk**  \n- **Change**: Previously ranked #13 \u2192 Remains #13.  \n- **Reason**: Dehydrated milk ranks low as it is bulky, secondary to more compact food sources, and requires water (already a critical resource) for rehydration.  \n- **Specialized Knowledge**: Food concentrate delivers more vital energy with less fuss and weight.\n\n---\n\n#### **14. Two .45 caliber pistols**  \n- **Change**: Previously ranked #14 \u2192 Remains #14.  \n- **Reason**: Firearms are practically useless in the lunar environment, as no known hazards require defense. Their only application might be for mechanical operations or triggering systems, which is negligible.  \n- **Specialized Knowledge**: Lunar threats stem from environmental conditions, not external entities.\n\n---\n\n#### **15. Box of matches**  \n- **Change**: Previously ranked #15 \u2192 Remains #15.  \n- **Reason**: Matches are entirely ineffective in a vacuum, where combustion cannot occur due to the absence of oxygen. Other signaling methods supersede their purpose.  \n- **Agreement**: Matches have no functional utility.\n\n---\n\n### **Final Refined Ranking**\n1. Oxygen tanks  \n2. Water  \n3. Solar-powered FM receiver-transmitter  \n4. Stellar map  \n5. Portable heating unit  \n6. Food concentrate  \n7. First aid kit  \n8. Signal flares  \n9. 50 feet of nylon rope  \n10. Parachute silk  \n11. Magnetic compass  \n12. Life raft  \n13. One case of dehydrated milk  \n14. Two .45 caliber pistols  \n15. Box of matches  \n\n---\n\n**Team Communication Model** (Closed-Loop Confirmation):\n- *Message Sent*: \"Refined rankings provided. Adjustments explained for items #3, #4, and #8. Confirm acceptance or discuss points requiring clarification.\"  \n- *Message Received*: (Acknowledged receipt and understanding).  \n- *Sender Verification*: \"Confirmed shared understanding of rationale.\"  ",
          "current_agent": "science",
          "difference_score": 4
        }
      ],
      "final_ranking": [
        "Oxygen tanks",
        "Water",
        "Solar-powered FM receiver-transmitter",
        "Stellar map",
        "Portable heating unit",
        "Food concentrate",
        "First aid kit",
        "Signal flares",
        "50 feet of nylon rope",
        "Parachute silk",
        "Magnetic compass",
        "Life raft",
        "One case of dehydrated milk",
        "Two .45 caliber pistols",
        "Box of matches"
      ],
      "final_message": "### **Refined Ranking of Lunar Survival Items**\n\nBased on the shared team understanding of the lunar environment and survival priorities, as well as my technical expertise in lunar conditions, I have refined the item rankings. Below is the revised list, incorporating justifications for any adjustments.\n\n---\n\n### **Refined Ranked List with Justifications**\n\n#### **1. Oxygen tanks**  \n- **Reason for Placement**: Oxygen remains the single most critical item because survival is impossible in the moon\u2019s vacuum without breathable air. No other item matches its importance for life sustenance.  \n- **Agreement**: This ranking remains unchanged.\n\n---\n\n#### **2. Water**  \n- **Reason for Placement**: Dehydration risks increase significantly during the 200-mile trek. Water is vital for bodily functions and temperature regulation, especially in the harsh lunar environment.  \n- **Agreement**: This placement remains unchanged.\n\n---\n\n#### **3. Solar-powered FM receiver-transmitter**  \n- **Change**: Previously ranked #4 \u2192 Moved to #3.  \n- **Reason**: Effective communication with the mother ship is essential to coordinate rescue or signal for help if the team gets lost or delayed. With no atmosphere, radio is the only viable communication method. It must be available to keep the team connected.  \n- **Specialized Knowledge**: Communication can serve as secondary navigation, with updates about coordinates or potential hazards, hence increasing its importance.\n\n---\n\n#### **4. Stellar map**  \n- **Change**: Previously ranked #3 \u2192 Moved to #4.  \n- **Reason**: While navigation is critical, a stellar map is secondary to communication, which can assist with real-time updates on direction. Still, knowing positioning relative to constellations and landmarks ensures the crew\u2019s path to the rendezvous point.  \n- **Agreement**: Navigation remains top-tier, with minor reprioritization.\n\n---\n\n#### **5. Portable heating unit**  \n- **Reason for Placement**: Extreme cold during the lunar night (-250\u00b0F) poses life-threatening risks. A portable heating unit is essential for maintaining adequate body temperature and preventing hypothermia.  \n- **Agreement**: Placement remains unchanged, as temperature regulation is vital for survival.\n\n---\n\n#### **6. Food concentrate**  \n- **Reason for Placement**: Provides vital energy for the strenuous trek without unnecessary mass or bulk. Food, while less critical than oxygen and water, remains a necessity for sustained energy and focus over extended periods.  \n- **Agreement**: Placement remains unchanged.\n\n---\n\n#### **7. First aid kit**  \n- **Change**: Previously ranked #7 \u2192 Remains #7.  \n- **Reason**: Immediate medical treatment is essential for injuries or other health concerns during the trek. Absence of timely care could result in death or incapacity, making the kit indispensable but secondary to oxygen, water, food, and temperature regulation.  \n- **Agreement**: No changes needed.\n\n---\n\n#### **8. Signal flares**  \n- **Change**: Previously ranked #9 \u2192 Moved to #8.  \n- **Reason**: Visual signaling at critical junctures, especially upon nearing the rendezvous point, could save time and aid rescue. Matches are useless in the lunar environment, and communication through radio could fail. Flares are the best backup signaling mechanism.  \n- **Specialized Knowledge**: Flares provide a reliable form of signaling even in extreme visibility conditions on the lunar surface.\n\n---\n\n#### **9. 50 feet of nylon rope**  \n- **Change**: Previously ranked #8 \u2192 Moved to #9.  \n- **Reason**: Nylon rope\u2019s utility for climbing, securing equipment, or creating makeshift solutions on uneven terrain remains valid but slightly less critical than reliable signaling mechanisms via flares.  \n- **Agreement**: The utility vs. frequency of usage balances its ranking here.\n\n---\n\n#### **10. Parachute silk**  \n- **Change**: Previously ranked #10 \u2192 Remains #10.  \n- **Reason**: Useful as insulation against the sun or cold and as a makeshift shade. Its utility is important but secondary compared to direct survival tools like water, food, and signaling.  \n- **Agreement**: This placement is appropriate.\n\n---\n\n#### **11. Magnetic compass**  \n- **Change**: Previously ranked #11 \u2192 Remains #11.  \n- **Reason**: The moon lacks a global magnetic field, making the compass nearly useless for navigation. It only retains minor use as a backup tool for indicating relative directions or angles if landmarks can be visualized.  \n- **Specialized Knowledge**: Lunar navigation relies entirely on maps, celestial orientation, or communication systems.\n\n---\n\n#### **12. Life raft**  \n- **Change**: Previously ranked #12 \u2192 Remains #12.  \n- **Reason**: While lacking purpose for flotation, it could double as an insulating platform for resting or transporting supplies over rough terrain. Its utility is minimal in this scenario.  \n- **Agreement**: This ranking remains appropriate.\n\n---\n\n#### **13. One case of dehydrated milk**  \n- **Change**: Previously ranked #13 \u2192 Remains #13.  \n- **Reason**: Dehydrated milk ranks low as it is bulky, secondary to more compact food sources, and requires water (already a critical resource) for rehydration.  \n- **Specialized Knowledge**: Food concentrate delivers more vital energy with less fuss and weight.\n\n---\n\n#### **14. Two .45 caliber pistols**  \n- **Change**: Previously ranked #14 \u2192 Remains #14.  \n- **Reason**: Firearms are practically useless in the lunar environment, as no known hazards require defense. Their only application might be for mechanical operations or triggering systems, which is negligible.  \n- **Specialized Knowledge**: Lunar threats stem from environmental conditions, not external entities.\n\n---\n\n#### **15. Box of matches**  \n- **Change**: Previously ranked #15 \u2192 Remains #15.  \n- **Reason**: Matches are entirely ineffective in a vacuum, where combustion cannot occur due to the absence of oxygen. Other signaling methods supersede their purpose.  \n- **Agreement**: Matches have no functional utility.\n\n---\n\n### **Final Refined Ranking**\n1. Oxygen tanks  \n2. Water  \n3. Solar-powered FM receiver-transmitter  \n4. Stellar map  \n5. Portable heating unit  \n6. Food concentrate  \n7. First aid kit  \n8. Signal flares  \n9. 50 feet of nylon rope  \n10. Parachute silk  \n11. Magnetic compass  \n12. Life raft  \n13. One case of dehydrated milk  \n14. Two .45 caliber pistols  \n15. Box of matches  \n\n---\n\n**Team Communication Model** (Closed-Loop Confirmation):\n- *Message Sent*: \"Refined rankings provided. Adjustments explained for items #3, #4, and #8. Confirm acceptance or discuss points requiring clarification.\"  \n- *Message Received*: (Acknowledged receipt and understanding).  \n- *Sender Verification*: \"Confirmed shared understanding of rationale.\"  ",
      "score": 30
    }
  ],
  "final_ranking": [
    "Oxygen tanks",
    "Water",
    "Solar-powered FM receiver-transmitter",
    "Stellar map",
    "Portable heating unit",
    "Food concentrate",
    "First aid kit",
    "Signal flares",
    "50 feet of nylon rope",
    "Parachute silk",
    "Magnetic compass",
    "Life raft",
    "One case of dehydrated milk",
    "Two .45 caliber pistols",
    "Box of matches"
  ],
  "nasa_ranking": [
    "Oxygen tanks",
    "Water",
    "Stellar map",
    "Food concentrate",
    "Solar-powered FM receiver-transmitter",
    "50 feet of nylon rope",
    "First aid kit",
    "Parachute silk",
    "Life raft",
    "Signal flares",
    "Two .45 caliber pistols",
    "One case of dehydrated milk",
    "Portable heating unit",
    "Magnetic compass",
    "Box of matches"
  ],
  "score": 30,
  "teamwork_metrics": {
    "mutual_monitoring": {
      "total_monitoring_exchanges": 0,
      "total_issues_detected": 0,
      "avg_issues_per_exchange": 0.0,
      "issue_types": {},
      "issue_resolution_rate": 0.0,
      "team_monitoring_effectiveness": "low"
    },
    "shared_mental_model": {
      "convergence_trend": "unknown",
      "final_convergence": 0.125,
      "understanding_completeness": {
        "resource": 0.4388888888888889,
        "science": 0.5079365079365079
      },
      "avg_completeness": 0.4734126984126984,
      "effectiveness_rating": "low"
    }
  }
}