{
  "simulation_id": "sim_closed_loop_20250417_135114",
  "config": {
    "use_team_leadership": false,
    "use_closed_loop_comm": true,
    "use_mutual_monitoring": false,
    "use_shared_mental_model": false
  },
  "exchanges": [
    {
      "type": "sequential_refinement",
      "exchanges": [
        {
          "type": "initial_ranking",
          "role": "science",
          "message": "Here is the initial ranking of the 15 lunar survival items in order of importance for the 200-mile trek to the rendezvous point based on the unique environmental conditions of the Moon:\n\n---\n\n### Ranking:\n\n1. **Oxygen tanks**  \n   **Justification:** Oxygen is critical for survival as the Moon has no atmosphere. Without oxygen, life functions cannot be sustained, making this the top priority.\n\n2. **Water**  \n   **Justification:** Though dehydration sets in more slowly than suffocation, water is essential for maintaining bodily functions and preventing fatigue during the arduous trek.\n\n3. **Solar-powered FM receiver-transmitter**  \n   **Justification:** Communication with the mother ship is crucial for receiving instructions and assistance during the journey. This item provides lifeline communication.\n\n4. **Stellar map**  \n   **Justification:** Navigation is essential to determine the correct direction to the rendezvous point. The map allows for orientation using lunar landmarks and constellations visible in the sky.\n\n5. **Food concentrate**  \n   **Justification:** Food provides necessary energy to sustain the physical effort required for the trek. Concentrated food is compact and nutritionally dense for efficient transport.\n\n6. **First aid kit**  \n   **Justification:** Injuries or health emergencies during the journey could incapacitate crew members. A first aid kit is required for immediate medical care.\n\n7. **Signal flares**  \n   **Justification:** Signal flares can be used to indicate location to the mother ship or rescue team in case of disorientation or emergencies.\n\n8. **Parachute silk**  \n   **Justification:** This material can be used for multiple purposes\u2014shielding from solar radiation, improvising shelters, or carrying other items.\n\n9. **50 feet of nylon rope**  \n   **Justification:** Nylon rope can aid in traversing difficult lunar terrain and securing equipment or crew members in challenging areas.\n\n10. **Portable heating unit**  \n   **Justification:** The Moon\u2019s dark side is extremely cold, and this unit helps to prevent hypothermia during periods when the Sun is not providing direct warmth.\n\n11. **Life raft**  \n   **Justification:** While designed for water survival, the inflatable raft could be used to transport supplies or as an insulating surface to sit or rest on.\n\n12. **One case of dehydrated milk**  \n   **Justification:** Dehydrated milk is a secondary source of nutrition, though less compact and efficient compared to food concentrate.\n\n13. **Two .45 caliber pistols**  \n   **Justification:** There are no predators or conflicts on the moon, diminishing the direct survival usage of firearms. They might only be useful as tools to break or manipulate objects if necessary.\n\n14. **Magnetic compass**  \n   **Justification:** Magnetic compasses rely on Earth's magnetic field, which is absent on the Moon. This item is useless for lunar navigation.\n\n15. **Box of matches**  \n   **Justification:** Matches require oxygen to ignite and are therefore non-functional in the oxygen-deprived lunar environment.\n\n---\n\n### Remarks:\nLet me know if there are any refinements or additional aspects you'd like me to consider regarding this initial ranking. I will verify your acknowledgment and adjustments in line with closed-loop communication principles.",
          "ranking": [
            "Oxygen tanks",
            "Water",
            "Solar-powered FM receiver-transmitter",
            "Stellar map",
            "Food concentrate",
            "First aid kit",
            "Signal flares",
            "Parachute silk",
            "50 feet of nylon rope",
            "Portable heating unit",
            "Life raft",
            "One case of dehydrated milk",
            "Two .45 caliber pistols",
            "Magnetic compass",
            "Box of matches"
          ]
        },
        {
          "type": "refinement",
          "iteration": 1,
          "role": "resource",
          "message": "Acknowledging receipt of the initial ranking provided for lunar survival items. I will conduct a detailed review based on resource efficiency, utility, and conditions specific to the Moon's environment. Any changes will include clear reasoning, and the refined list will ensure proper coverage of all items. I will also acknowledge unchanged rankings briefly.\n\nHere is the refined ranking of items from 1\u201315, along with detailed justifications:\n\n---\n\n### Refined Ranking:\n\n1. **Oxygen tanks** (No change)  \n   **Justification:** Oxygen remains the highest-priority survival item, as it is directly life-sustaining. Its essential role in ensuring breathability on the Moon makes it irreplaceable for the entire journey.\n\n2. **Water** (No change)  \n   **Justification:** Hydration remains critical for sustaining bodily functions, preventing fatigue, and avoiding secondary dangers like overheating. The trek's physical demands emphasize water\u2019s importance.\n\n3. **Solar-powered FM receiver-transmitter** (No change)  \n   **Justification:** Communication with the mother ship allows for status updates, distress signals, and navigation assistance, making this a vital technology for continued survival.\n\n4. **Stellar map** (No change)  \n   **Justification:** Accurate navigation is critical for a 200-mile journey across the Moon's surface without landmarks. The stellar map ensures proper orientation to reach the rendezvous point.\n\n5. **Food concentrate** (No change)  \n   **Justification:** Compact and nutritionally dense food is optimal for energy production during intense physical activity, especially on the Moon, where mass and weight need to be minimized.\n\n6. **First aid kit** (No change)  \n   **Justification:** Immediate care for injuries or emergencies is vital to prevent incapacitation of crew members. The first aid kit remains essential for addressing potential health issues.\n\n7. **Parachute silk** (Adjusted from Rank 8 to Rank 7)  \n   **Reason for change:** Parachute silk\u2019s versatility\u2014thermal insulation, shelter creation, and radiation shielding\u2014makes it slightly more critical than signal flares. While signaling is important, mitigating environmental risks has a broader impact on survival.  \n\n8. **Signal flares** (Adjusted from Rank 7 to Rank 8)  \n   **Reason for change:** Signal flares retain situational importance for communication with rescue personnel but are functionally secondary to environmental survival tools like parachute silk.\n\n9. **50 feet of nylon rope** (No change)  \n   **Justification:** Nylon rope is equally versatile for aiding traverse of rough lunar terrain, securing equipment, and providing crew safety in challenging areas.\n\n10. **Portable heating unit** (No change)  \n   **Justification:** Cold temperatures on the Moon\u2019s dark side necessitate heat generation to avoid hypothermia. This item remains critical based on environmental risks.\n\n11. **Life raft** (Adjusted from Rank 11 to Rank 12)  \n   **Reason for change:** The life raft\u2019s uses (insulating supplies or providing a resting surface) are limited compared to dehydrated milk, which is a secondary nutritional asset. While helpful, it is less critical overall.\n\n12. **One case of dehydrated milk** (Adjusted from Rank 12 to Rank 11)  \n   **Reason for change:** Dehydrated milk, while secondary to food concentrate, provides a backup nutritional source and contributes to endurance. It is slightly more impactful than the life raft overall.\n\n13. **Two .45 caliber pistols** (No change)  \n   **Justification:** Their utility on the Moon is primarily as tools (e.g., breaking or manipulating objects) rather than for defense. This limited use keeps them in the lower rankings.\n\n14. **Magnetic compass** (No change)  \n   **Justification:** Magnetic compasses are fully useless on the Moon, as there is no magnetic field present to enable navigation.\n\n15. **Box of matches** (No change)  \n   **Justification:** Matches cannot ignite without oxygen and serve no functional purpose in the Moon\u2019s environment, leaving them as the least important survival item.\n\n---\n\n### Refined Ranking Summary:\n\n1. **Oxygen tanks**  \n2. **Water**  \n3. **Solar-powered FM receiver-transmitter**  \n4. **Stellar map**  \n5. **Food concentrate**  \n6. **First aid kit**  \n7. **Parachute silk**  \n8. **Signal flares**  \n9. **50 feet of nylon rope**  \n10. **Portable heating unit**  \n11. **One case of dehydrated milk**  \n12. **Life raft**  \n13. **Two .45 caliber pistols**  \n14. **Magnetic compass**  \n15. **Box of matches**\n\n---\n\n### Closed-Loop Communication:\nPlease confirm receipt of the refined ranking. If further adjustments or considerations are needed, clarify areas requiring review. Upon acknowledgment, I will verify understanding and proceed with any additional refinements or confirmations.",
          "ranking": [
            "Oxygen tanks",
            "Water",
            "Solar-powered FM receiver-transmitter",
            "Stellar map",
            "Food concentrate",
            "First aid kit",
            "Parachute silk",
            "Signal flares",
            "50 feet of nylon rope",
            "Portable heating unit",
            "Life raft",
            "One case of dehydrated milk",
            "Two .45 caliber pistols",
            "Magnetic compass",
            "Box of matches"
          ]
        }
      ],
      "iterations": [
        {
          "iteration": 0,
          "current_ranking": [
            "Oxygen tanks",
            "Water",
            "Solar-powered FM receiver-transmitter",
            "Stellar map",
            "Food concentrate",
            "First aid kit",
            "Signal flares",
            "Parachute silk",
            "50 feet of nylon rope",
            "Portable heating unit",
            "Life raft",
            "One case of dehydrated milk",
            "Two .45 caliber pistols",
            "Magnetic compass",
            "Box of matches"
          ],
          "current_message": "Here is the initial ranking of the 15 lunar survival items in order of importance for the 200-mile trek to the rendezvous point based on the unique environmental conditions of the Moon:\n\n---\n\n### Ranking:\n\n1. **Oxygen tanks**  \n   **Justification:** Oxygen is critical for survival as the Moon has no atmosphere. Without oxygen, life functions cannot be sustained, making this the top priority.\n\n2. **Water**  \n   **Justification:** Though dehydration sets in more slowly than suffocation, water is essential for maintaining bodily functions and preventing fatigue during the arduous trek.\n\n3. **Solar-powered FM receiver-transmitter**  \n   **Justification:** Communication with the mother ship is crucial for receiving instructions and assistance during the journey. This item provides lifeline communication.\n\n4. **Stellar map**  \n   **Justification:** Navigation is essential to determine the correct direction to the rendezvous point. The map allows for orientation using lunar landmarks and constellations visible in the sky.\n\n5. **Food concentrate**  \n   **Justification:** Food provides necessary energy to sustain the physical effort required for the trek. Concentrated food is compact and nutritionally dense for efficient transport.\n\n6. **First aid kit**  \n   **Justification:** Injuries or health emergencies during the journey could incapacitate crew members. A first aid kit is required for immediate medical care.\n\n7. **Signal flares**  \n   **Justification:** Signal flares can be used to indicate location to the mother ship or rescue team in case of disorientation or emergencies.\n\n8. **Parachute silk**  \n   **Justification:** This material can be used for multiple purposes\u2014shielding from solar radiation, improvising shelters, or carrying other items.\n\n9. **50 feet of nylon rope**  \n   **Justification:** Nylon rope can aid in traversing difficult lunar terrain and securing equipment or crew members in challenging areas.\n\n10. **Portable heating unit**  \n   **Justification:** The Moon\u2019s dark side is extremely cold, and this unit helps to prevent hypothermia during periods when the Sun is not providing direct warmth.\n\n11. **Life raft**  \n   **Justification:** While designed for water survival, the inflatable raft could be used to transport supplies or as an insulating surface to sit or rest on.\n\n12. **One case of dehydrated milk**  \n   **Justification:** Dehydrated milk is a secondary source of nutrition, though less compact and efficient compared to food concentrate.\n\n13. **Two .45 caliber pistols**  \n   **Justification:** There are no predators or conflicts on the moon, diminishing the direct survival usage of firearms. They might only be useful as tools to break or manipulate objects if necessary.\n\n14. **Magnetic compass**  \n   **Justification:** Magnetic compasses rely on Earth's magnetic field, which is absent on the Moon. This item is useless for lunar navigation.\n\n15. **Box of matches**  \n   **Justification:** Matches require oxygen to ignite and are therefore non-functional in the oxygen-deprived lunar environment.\n\n---\n\n### Remarks:\nLet me know if there are any refinements or additional aspects you'd like me to consider regarding this initial ranking. I will verify your acknowledgment and adjustments in line with closed-loop communication principles.",
          "current_agent": "science"
        },
        {
          "iteration": 1,
          "current_ranking": [
            "Oxygen tanks",
            "Water",
            "Solar-powered FM receiver-transmitter",
            "Stellar map",
            "Food concentrate",
            "First aid kit",
            "Parachute silk",
            "Signal flares",
            "50 feet of nylon rope",
            "Portable heating unit",
            "Life raft",
            "One case of dehydrated milk",
            "Two .45 caliber pistols",
            "Magnetic compass",
            "Box of matches"
          ],
          "current_message": "Acknowledging receipt of the initial ranking provided for lunar survival items. I will conduct a detailed review based on resource efficiency, utility, and conditions specific to the Moon's environment. Any changes will include clear reasoning, and the refined list will ensure proper coverage of all items. I will also acknowledge unchanged rankings briefly.\n\nHere is the refined ranking of items from 1\u201315, along with detailed justifications:\n\n---\n\n### Refined Ranking:\n\n1. **Oxygen tanks** (No change)  \n   **Justification:** Oxygen remains the highest-priority survival item, as it is directly life-sustaining. Its essential role in ensuring breathability on the Moon makes it irreplaceable for the entire journey.\n\n2. **Water** (No change)  \n   **Justification:** Hydration remains critical for sustaining bodily functions, preventing fatigue, and avoiding secondary dangers like overheating. The trek's physical demands emphasize water\u2019s importance.\n\n3. **Solar-powered FM receiver-transmitter** (No change)  \n   **Justification:** Communication with the mother ship allows for status updates, distress signals, and navigation assistance, making this a vital technology for continued survival.\n\n4. **Stellar map** (No change)  \n   **Justification:** Accurate navigation is critical for a 200-mile journey across the Moon's surface without landmarks. The stellar map ensures proper orientation to reach the rendezvous point.\n\n5. **Food concentrate** (No change)  \n   **Justification:** Compact and nutritionally dense food is optimal for energy production during intense physical activity, especially on the Moon, where mass and weight need to be minimized.\n\n6. **First aid kit** (No change)  \n   **Justification:** Immediate care for injuries or emergencies is vital to prevent incapacitation of crew members. The first aid kit remains essential for addressing potential health issues.\n\n7. **Parachute silk** (Adjusted from Rank 8 to Rank 7)  \n   **Reason for change:** Parachute silk\u2019s versatility\u2014thermal insulation, shelter creation, and radiation shielding\u2014makes it slightly more critical than signal flares. While signaling is important, mitigating environmental risks has a broader impact on survival.  \n\n8. **Signal flares** (Adjusted from Rank 7 to Rank 8)  \n   **Reason for change:** Signal flares retain situational importance for communication with rescue personnel but are functionally secondary to environmental survival tools like parachute silk.\n\n9. **50 feet of nylon rope** (No change)  \n   **Justification:** Nylon rope is equally versatile for aiding traverse of rough lunar terrain, securing equipment, and providing crew safety in challenging areas.\n\n10. **Portable heating unit** (No change)  \n   **Justification:** Cold temperatures on the Moon\u2019s dark side necessitate heat generation to avoid hypothermia. This item remains critical based on environmental risks.\n\n11. **Life raft** (Adjusted from Rank 11 to Rank 12)  \n   **Reason for change:** The life raft\u2019s uses (insulating supplies or providing a resting surface) are limited compared to dehydrated milk, which is a secondary nutritional asset. While helpful, it is less critical overall.\n\n12. **One case of dehydrated milk** (Adjusted from Rank 12 to Rank 11)  \n   **Reason for change:** Dehydrated milk, while secondary to food concentrate, provides a backup nutritional source and contributes to endurance. It is slightly more impactful than the life raft overall.\n\n13. **Two .45 caliber pistols** (No change)  \n   **Justification:** Their utility on the Moon is primarily as tools (e.g., breaking or manipulating objects) rather than for defense. This limited use keeps them in the lower rankings.\n\n14. **Magnetic compass** (No change)  \n   **Justification:** Magnetic compasses are fully useless on the Moon, as there is no magnetic field present to enable navigation.\n\n15. **Box of matches** (No change)  \n   **Justification:** Matches cannot ignite without oxygen and serve no functional purpose in the Moon\u2019s environment, leaving them as the least important survival item.\n\n---\n\n### Refined Ranking Summary:\n\n1. **Oxygen tanks**  \n2. **Water**  \n3. **Solar-powered FM receiver-transmitter**  \n4. **Stellar map**  \n5. **Food concentrate**  \n6. **First aid kit**  \n7. **Parachute silk**  \n8. **Signal flares**  \n9. **50 feet of nylon rope**  \n10. **Portable heating unit**  \n11. **One case of dehydrated milk**  \n12. **Life raft**  \n13. **Two .45 caliber pistols**  \n14. **Magnetic compass**  \n15. **Box of matches**\n\n---\n\n### Closed-Loop Communication:\nPlease confirm receipt of the refined ranking. If further adjustments or considerations are needed, clarify areas requiring review. Upon acknowledgment, I will verify understanding and proceed with any additional refinements or confirmations.",
          "current_agent": "resource",
          "difference_score": 2
        }
      ],
      "final_ranking": [
        "Oxygen tanks",
        "Water",
        "Solar-powered FM receiver-transmitter",
        "Stellar map",
        "Food concentrate",
        "First aid kit",
        "Parachute silk",
        "Signal flares",
        "50 feet of nylon rope",
        "Portable heating unit",
        "Life raft",
        "One case of dehydrated milk",
        "Two .45 caliber pistols",
        "Magnetic compass",
        "Box of matches"
      ],
      "final_message": "Acknowledging receipt of the initial ranking provided for lunar survival items. I will conduct a detailed review based on resource efficiency, utility, and conditions specific to the Moon's environment. Any changes will include clear reasoning, and the refined list will ensure proper coverage of all items. I will also acknowledge unchanged rankings briefly.\n\nHere is the refined ranking of items from 1\u201315, along with detailed justifications:\n\n---\n\n### Refined Ranking:\n\n1. **Oxygen tanks** (No change)  \n   **Justification:** Oxygen remains the highest-priority survival item, as it is directly life-sustaining. Its essential role in ensuring breathability on the Moon makes it irreplaceable for the entire journey.\n\n2. **Water** (No change)  \n   **Justification:** Hydration remains critical for sustaining bodily functions, preventing fatigue, and avoiding secondary dangers like overheating. The trek's physical demands emphasize water\u2019s importance.\n\n3. **Solar-powered FM receiver-transmitter** (No change)  \n   **Justification:** Communication with the mother ship allows for status updates, distress signals, and navigation assistance, making this a vital technology for continued survival.\n\n4. **Stellar map** (No change)  \n   **Justification:** Accurate navigation is critical for a 200-mile journey across the Moon's surface without landmarks. The stellar map ensures proper orientation to reach the rendezvous point.\n\n5. **Food concentrate** (No change)  \n   **Justification:** Compact and nutritionally dense food is optimal for energy production during intense physical activity, especially on the Moon, where mass and weight need to be minimized.\n\n6. **First aid kit** (No change)  \n   **Justification:** Immediate care for injuries or emergencies is vital to prevent incapacitation of crew members. The first aid kit remains essential for addressing potential health issues.\n\n7. **Parachute silk** (Adjusted from Rank 8 to Rank 7)  \n   **Reason for change:** Parachute silk\u2019s versatility\u2014thermal insulation, shelter creation, and radiation shielding\u2014makes it slightly more critical than signal flares. While signaling is important, mitigating environmental risks has a broader impact on survival.  \n\n8. **Signal flares** (Adjusted from Rank 7 to Rank 8)  \n   **Reason for change:** Signal flares retain situational importance for communication with rescue personnel but are functionally secondary to environmental survival tools like parachute silk.\n\n9. **50 feet of nylon rope** (No change)  \n   **Justification:** Nylon rope is equally versatile for aiding traverse of rough lunar terrain, securing equipment, and providing crew safety in challenging areas.\n\n10. **Portable heating unit** (No change)  \n   **Justification:** Cold temperatures on the Moon\u2019s dark side necessitate heat generation to avoid hypothermia. This item remains critical based on environmental risks.\n\n11. **Life raft** (Adjusted from Rank 11 to Rank 12)  \n   **Reason for change:** The life raft\u2019s uses (insulating supplies or providing a resting surface) are limited compared to dehydrated milk, which is a secondary nutritional asset. While helpful, it is less critical overall.\n\n12. **One case of dehydrated milk** (Adjusted from Rank 12 to Rank 11)  \n   **Reason for change:** Dehydrated milk, while secondary to food concentrate, provides a backup nutritional source and contributes to endurance. It is slightly more impactful than the life raft overall.\n\n13. **Two .45 caliber pistols** (No change)  \n   **Justification:** Their utility on the Moon is primarily as tools (e.g., breaking or manipulating objects) rather than for defense. This limited use keeps them in the lower rankings.\n\n14. **Magnetic compass** (No change)  \n   **Justification:** Magnetic compasses are fully useless on the Moon, as there is no magnetic field present to enable navigation.\n\n15. **Box of matches** (No change)  \n   **Justification:** Matches cannot ignite without oxygen and serve no functional purpose in the Moon\u2019s environment, leaving them as the least important survival item.\n\n---\n\n### Refined Ranking Summary:\n\n1. **Oxygen tanks**  \n2. **Water**  \n3. **Solar-powered FM receiver-transmitter**  \n4. **Stellar map**  \n5. **Food concentrate**  \n6. **First aid kit**  \n7. **Parachute silk**  \n8. **Signal flares**  \n9. **50 feet of nylon rope**  \n10. **Portable heating unit**  \n11. **One case of dehydrated milk**  \n12. **Life raft**  \n13. **Two .45 caliber pistols**  \n14. **Magnetic compass**  \n15. **Box of matches**\n\n---\n\n### Closed-Loop Communication:\nPlease confirm receipt of the refined ranking. If further adjustments or considerations are needed, clarify areas requiring review. Upon acknowledgment, I will verify understanding and proceed with any additional refinements or confirmations.",
      "score": 18
    }
  ],
  "final_ranking": [
    "Oxygen tanks",
    "Water",
    "Solar-powered FM receiver-transmitter",
    "Stellar map",
    "Food concentrate",
    "First aid kit",
    "Parachute silk",
    "Signal flares",
    "50 feet of nylon rope",
    "Portable heating unit",
    "Life raft",
    "One case of dehydrated milk",
    "Two .45 caliber pistols",
    "Magnetic compass",
    "Box of matches"
  ],
  "nasa_ranking": [
    "Oxygen tanks",
    "Water",
    "Stellar map",
    "Food concentrate",
    "Solar-powered FM receiver-transmitter",
    "50 feet of nylon rope",
    "First aid kit",
    "Parachute silk",
    "Life raft",
    "Signal flares",
    "Two .45 caliber pistols",
    "One case of dehydrated milk",
    "Portable heating unit",
    "Magnetic compass",
    "Box of matches"
  ],
  "score": 18,
  "teamwork_metrics": {}
}