{
  "simulation_id": "sim_closed_loop_20250417_135816",
  "config": {
    "use_team_leadership": false,
    "use_closed_loop_comm": true,
    "use_mutual_monitoring": false,
    "use_shared_mental_model": false
  },
  "exchanges": [
    {
      "type": "sequential_refinement",
      "exchanges": [
        {
          "type": "initial_ranking",
          "role": "science",
          "message": "### Lunar Survival Team: Ranking Lunar Survival Items for 200-Mile Trek\n\n**Context:** Survival on the lunar surface hinges upon addressing extreme environmental conditions: lack of breathable atmosphere (requires oxygen), absence of water sources, extreme temperatures, low gravity, and navigation in a harsh terrain. The moon has no atmosphere, rendering certain terrestrial items useless (e.g., matches).\n\n**Key Priorities:** Primary survival depends on breathable air, hydration, temperature management, mobility, navigation, and communication. Secondary needs include signaling and protection.\n\n### Ranked Survival Items\n\n**1. Oxygen Tanks**\n   - Justification: Oxygen is the most critical survival resource, as the moon has no atmosphere. Without air, survival is impossible.\n   - Priority: Supplies the crew with breathable air for the duration of the trek.\n\n**2. Water**\n   - Justification: Necessary for hydration and vital physiological functions. Dehydration would rapidly compromise physical and cognitive performance.\n   - Priority: Ensures survival in the absence of any water sources on the moon.\n\n**3. Stellar Map**\n   - Justification: Essential for navigation on the lunar surface. With no magnetic field or landmarks, celestial navigation ensures the crew reaches the rendezvous point.\n   - Priority: Prevents disorientation and ensures prolonged survival.\n\n**4. Solar-Powered FM Receiver-Transmitter**\n   - Justification: Enables communication with the mother ship or rescue team, which could be crucial if the crew is delayed or lost.\n   - Priority: Critical for signaling when survival is endangered.\n\n**5. Food Concentrate**\n   - Justification: Provides essential calories and nutrients to maintain energy and prevent starvation during the trek.\n   - Priority: Needed to sustain physical activity over several days.\n\n**6. First Aid Kit**\n   - Justification: Necessary for treating injuries, preventing infection, and addressing fatigue-related issues. A medical emergency can be life-threatening.\n   - Priority: Provides immediate health care during the journey.\n\n**7. Portable Heating Unit**\n   - Justification: Crucial for combating the extreme cold of lunar nights or shaded regions. Prevents hypothermia.\n   - Priority: Ensures thermal regulation for survival.\n\n**8. Signal Flares**\n   - Justification: Useful for signaling the mother ship or rescuers upon reaching the rendezvous point. Essential in case communication systems fail.\n   - Priority: Secondary signaling mechanism.\n\n**9. 50 Feet of Nylon Rope**\n   - Justification: Useful for climbing, hauling, or securing equipment in the uneven lunar terrain. Ensures mobility and problem-solving capability.\n   - Priority: Enhances tactical response to obstacles.\n\n**10. Parachute Silk**\n   - Justification: Can be used as shade, insulation, or improvised repairs. Secondary utility for survival needs.\n   - Priority: Multi-purpose material, not critical but useful.\n\n**11. Magnetic Compass**\n   - Justification: Useless on the moon due to the absence of a global magnetic field. Retained only for potential improvised utility, e.g., as a reflective surface.\n   - Priority: Not reliable for navigation.\n\n**12. Life Raft**\n   - Justification: Minimal utility on the lunar surface. Could function as a transport aid if inflated or as insulation material.\n   - Priority: Emergency utility, but limited relevance.\n\n**13. One Case of Dehydrated Milk**\n   - Justification: Provides nutrition but is secondary to water and food concentrate. Requires water for preparation, adding complexity.\n   - Priority: Nutrition redundancy compared to food concentrate.\n\n**14. Two .45 Caliber Pistols**\n   - Justification: Limited usefulness on the moon. Could aid psychological confidence or problem-solving in rare scenarios (e.g., generating mechanical force).\n   - Priority: Primarily symbolic and last-resort tool.\n\n**15. Box of Matches**\n   - Justification: Completely useless on the moon due to lack of oxygen to sustain combustion. No survival value.\n   - Priority: Completely non-functional in the lunar environment.\n\n---\n\n### Communication Approach with Teammates\n\nI am presenting this list as my initial ranking based on the scientific analysis of lunar conditions and survival requirements. Please:\n1. **Acknowledge receipt** of this list.\n2. **Confirm understanding** of the justifications provided.\n3. Provide feedback or approval to ensure no critical detail is overlooked.\n\nOver to you for confirmation and collaborative refinement.",
          "ranking": [
            "Oxygen tanks",
            "Water",
            "Stellar map",
            "Solar-powered FM receiver-transmitter",
            "Food concentrate",
            "First aid kit",
            "Portable heating unit",
            "Signal flares",
            "50 feet of nylon rope",
            "Parachute silk",
            "Magnetic compass",
            "Life raft",
            "One case of dehydrated milk",
            "Two .45 caliber pistols",
            "Box of matches"
          ]
        },
        {
          "type": "refinement",
          "iteration": 1,
          "role": "resource",
          "message": "### Acknowledgment\nI have received the current ranked list of lunar survival items and reviewed the justifications. I confirm my understanding of the survival priorities outlined, as well as the reasoning attached to each item's position. I will now refine the ranking based on my expertise as a Resource Manager, ensuring optimal resource efficiency and prioritizing items based on their utility vs weight. I'll explain my reasoning for each suggested change and maintain closed-loop communication throughout this process.\n\n---\n\n### Refined Ranking of Lunar Survival Items:\n\n**1. Oxygen Tanks**  \n- **Justification:** Oxygen remains the single most critical resource for survival, as the moon\u2019s lack of atmosphere makes breathable air essential.  \n- **Confirmation:** Agreed with the original ranking; no change is necessary.\n\n**2. Water**  \n- **Justification:** Water is vital for hydration and necessary for maintaining physical and cognitive performance over the trek\u2019s duration.  \n- **Confirmation:** Agreed with the original ranking; no change is necessary.\n\n**3. Solar-Powered FM Receiver-Transmitter**  \n- **Reasoning for Higher Ranking:** Communication with the mother ship is critical for ensuring rescue if the trek encounters unforeseen delays or obstacles. Its functionality could make the difference between survival and being stranded. Navigation, while important, is secondary to communication in emergencies.  \n- **New Position:** Moved up from rank 4 to rank 3 to reflect its higher priority as an active survival tool.\n\n**4. Stellar Map**  \n- **Reasoning for Slightly Lower Ranking:** The stellar map is essential for navigation but assumes uninterrupted progress toward the rendezvous point. Its dependence on celestial visibility may also be vulnerable to situational limitations (e.g., lunar storms, obstructions).  \n- **New Position:** Reduced from rank 3 to rank 4.\n\n**5. Food Concentrate**  \n- **Justification:** Food concentrate is necessary to provide calories and sustain physical activity during a multi-day trek. It remains high priority but secondary to oxygen, water, navigation, and communication.  \n- **Confirmation:** Agreed with the original ranking; no change is necessary.\n\n**6. First Aid Kit**  \n- **Reasoning for Higher Ranking:** Potential injuries or health issues during a 200-mile trek could jeopardize the entire mission. Immediate treatment capabilities are vital for survival. Its importance outweighs items that provide secondary utility.  \n- **New Position:** Moved up from rank 6 to rank 6.\n\n**7. Portable Heating Unit**  \n- **Justification:** Thermal regulation is crucial for preventing hypothermia during the trek, particularly during lunar nights or shaded regions. Its priority is correctly ranked.  \n- **Confirmation:** Agreed with the original ranking; no change is necessary.\n\n**8. 50 Feet of Nylon Rope**  \n- **Reasoning for Higher Ranking:** The rope\u2019s multi-purpose functionality (e.g., climbing obstacles, securing equipment, solving terrain challenges) could be critical for mobility. It also pairs well with other survival tools. Its practical uses elevate its ranking over signal flares.  \n- **New Position:** Moved up from rank 9 to rank 8.\n\n**9. Signal Flares**  \n- **Reasoning for Lower Ranking:** Signal flares are essential signaling mechanisms but are less versatile compared to nylon rope. Their use is limited to the end of the trek or emergencies. Thus, they are slightly less critical than items offering broad utility during the journey.  \n- **New Position:** Reduced from rank 8 to rank 9.\n\n**10. Parachute Silk**  \n- **Justification:** Multi-purpose material for shade, insulation, or improvisation. It is useful in secondary survival functions but not critical for immediate trek priorities.  \n- **Confirmation:** Agreed with the original ranking; no change is necessary.\n\n**11. Magnetic Compass**  \n- **Justification:** Useless for navigation on the moon due to the absence of a global magnetic field. Potential improvised uses (e.g., as a reflective surface) do not warrant a higher ranking.  \n- **Confirmation:** Agreed with the original ranking; no change is necessary.\n\n**12. Life Raft**  \n- **Reasoning for Higher Ranking:** Though minimally useful compared to most items, it offers potential for insulation or as an aid for carrying supplies, which slightly improves its utility over dehydrated milk.  \n- **New Position:** Moved up from rank 12 to rank 11.\n\n**13. One Case of Dehydrated Milk**  \n- **Reasoning for Lower Ranking:** Requires water for preparation, creating redundancy in survival priority. Food concentrate already fulfills the higher nutritional need. Dehydrated milk has less utility in comparison.  \n- **New Position:** Reduced from rank 11 to rank 12.\n\n**14. Two .45 Caliber Pistols**  \n- **Justification:** Limited survival value on the moon, with minimal practical application. Potential improvisation (e.g., generating mechanical force) remains a rare, last-resort use case.  \n- **Confirmation:** Agreed with the original ranking; no change is necessary.\n\n**15. Box of Matches**  \n- **Justification:** As confirmed, completely non-functional in the lunar environment. It rightfully ranks last.  \n- **Confirmation:** Agreed with the original ranking; no change is necessary.\n\n---\n\n### Final Refined Ranking \n1. Oxygen Tanks  \n2. Water  \n3. Solar-Powered FM Receiver-Transmitter  \n4. Stellar Map  \n5. Food Concentrate  \n6. First Aid Kit  \n7. Portable Heating Unit  \n8. 50 Feet of Nylon Rope  \n9. Signal Flares  \n10. Parachute Silk  \n11. Life Raft  \n12. One Case of Dehydrated Milk  \n13. Two .45 Caliber Pistols  \n14. Magnetic Compass  \n15. Box of Matches  \n\n---\n\n### Confirmation Request\nI have provided a refined ranking based on survival priorities. Please:  \n1. **Acknowledge receipt** of this refined list.  \n2. **Confirm understanding** of the reasoning behind each adjustment.  \n3. Provide any feedback or suggestions for improvement to ensure consensus and optimal survival planning.  \n\nOver to you!",
          "ranking": [
            "Oxygen tanks",
            "Water",
            "Solar-powered FM receiver-transmitter",
            "Stellar map",
            "Food concentrate",
            "First aid kit",
            "Portable heating unit",
            "50 feet of nylon rope",
            "Signal flares",
            "Parachute silk",
            "Magnetic compass",
            "Life raft",
            "One case of dehydrated milk",
            "Two .45 caliber pistols",
            "Box of matches"
          ]
        }
      ],
      "iterations": [
        {
          "iteration": 0,
          "current_ranking": [
            "Oxygen tanks",
            "Water",
            "Stellar map",
            "Solar-powered FM receiver-transmitter",
            "Food concentrate",
            "First aid kit",
            "Portable heating unit",
            "Signal flares",
            "50 feet of nylon rope",
            "Parachute silk",
            "Magnetic compass",
            "Life raft",
            "One case of dehydrated milk",
            "Two .45 caliber pistols",
            "Box of matches"
          ],
          "current_message": "### Lunar Survival Team: Ranking Lunar Survival Items for 200-Mile Trek\n\n**Context:** Survival on the lunar surface hinges upon addressing extreme environmental conditions: lack of breathable atmosphere (requires oxygen), absence of water sources, extreme temperatures, low gravity, and navigation in a harsh terrain. The moon has no atmosphere, rendering certain terrestrial items useless (e.g., matches).\n\n**Key Priorities:** Primary survival depends on breathable air, hydration, temperature management, mobility, navigation, and communication. Secondary needs include signaling and protection.\n\n### Ranked Survival Items\n\n**1. Oxygen Tanks**\n   - Justification: Oxygen is the most critical survival resource, as the moon has no atmosphere. Without air, survival is impossible.\n   - Priority: Supplies the crew with breathable air for the duration of the trek.\n\n**2. Water**\n   - Justification: Necessary for hydration and vital physiological functions. Dehydration would rapidly compromise physical and cognitive performance.\n   - Priority: Ensures survival in the absence of any water sources on the moon.\n\n**3. Stellar Map**\n   - Justification: Essential for navigation on the lunar surface. With no magnetic field or landmarks, celestial navigation ensures the crew reaches the rendezvous point.\n   - Priority: Prevents disorientation and ensures prolonged survival.\n\n**4. Solar-Powered FM Receiver-Transmitter**\n   - Justification: Enables communication with the mother ship or rescue team, which could be crucial if the crew is delayed or lost.\n   - Priority: Critical for signaling when survival is endangered.\n\n**5. Food Concentrate**\n   - Justification: Provides essential calories and nutrients to maintain energy and prevent starvation during the trek.\n   - Priority: Needed to sustain physical activity over several days.\n\n**6. First Aid Kit**\n   - Justification: Necessary for treating injuries, preventing infection, and addressing fatigue-related issues. A medical emergency can be life-threatening.\n   - Priority: Provides immediate health care during the journey.\n\n**7. Portable Heating Unit**\n   - Justification: Crucial for combating the extreme cold of lunar nights or shaded regions. Prevents hypothermia.\n   - Priority: Ensures thermal regulation for survival.\n\n**8. Signal Flares**\n   - Justification: Useful for signaling the mother ship or rescuers upon reaching the rendezvous point. Essential in case communication systems fail.\n   - Priority: Secondary signaling mechanism.\n\n**9. 50 Feet of Nylon Rope**\n   - Justification: Useful for climbing, hauling, or securing equipment in the uneven lunar terrain. Ensures mobility and problem-solving capability.\n   - Priority: Enhances tactical response to obstacles.\n\n**10. Parachute Silk**\n   - Justification: Can be used as shade, insulation, or improvised repairs. Secondary utility for survival needs.\n   - Priority: Multi-purpose material, not critical but useful.\n\n**11. Magnetic Compass**\n   - Justification: Useless on the moon due to the absence of a global magnetic field. Retained only for potential improvised utility, e.g., as a reflective surface.\n   - Priority: Not reliable for navigation.\n\n**12. Life Raft**\n   - Justification: Minimal utility on the lunar surface. Could function as a transport aid if inflated or as insulation material.\n   - Priority: Emergency utility, but limited relevance.\n\n**13. One Case of Dehydrated Milk**\n   - Justification: Provides nutrition but is secondary to water and food concentrate. Requires water for preparation, adding complexity.\n   - Priority: Nutrition redundancy compared to food concentrate.\n\n**14. Two .45 Caliber Pistols**\n   - Justification: Limited usefulness on the moon. Could aid psychological confidence or problem-solving in rare scenarios (e.g., generating mechanical force).\n   - Priority: Primarily symbolic and last-resort tool.\n\n**15. Box of Matches**\n   - Justification: Completely useless on the moon due to lack of oxygen to sustain combustion. No survival value.\n   - Priority: Completely non-functional in the lunar environment.\n\n---\n\n### Communication Approach with Teammates\n\nI am presenting this list as my initial ranking based on the scientific analysis of lunar conditions and survival requirements. Please:\n1. **Acknowledge receipt** of this list.\n2. **Confirm understanding** of the justifications provided.\n3. Provide feedback or approval to ensure no critical detail is overlooked.\n\nOver to you for confirmation and collaborative refinement.",
          "current_agent": "science"
        },
        {
          "iteration": 1,
          "current_ranking": [
            "Oxygen tanks",
            "Water",
            "Solar-powered FM receiver-transmitter",
            "Stellar map",
            "Food concentrate",
            "First aid kit",
            "Portable heating unit",
            "50 feet of nylon rope",
            "Signal flares",
            "Parachute silk",
            "Magnetic compass",
            "Life raft",
            "One case of dehydrated milk",
            "Two .45 caliber pistols",
            "Box of matches"
          ],
          "current_message": "### Acknowledgment\nI have received the current ranked list of lunar survival items and reviewed the justifications. I confirm my understanding of the survival priorities outlined, as well as the reasoning attached to each item's position. I will now refine the ranking based on my expertise as a Resource Manager, ensuring optimal resource efficiency and prioritizing items based on their utility vs weight. I'll explain my reasoning for each suggested change and maintain closed-loop communication throughout this process.\n\n---\n\n### Refined Ranking of Lunar Survival Items:\n\n**1. Oxygen Tanks**  \n- **Justification:** Oxygen remains the single most critical resource for survival, as the moon\u2019s lack of atmosphere makes breathable air essential.  \n- **Confirmation:** Agreed with the original ranking; no change is necessary.\n\n**2. Water**  \n- **Justification:** Water is vital for hydration and necessary for maintaining physical and cognitive performance over the trek\u2019s duration.  \n- **Confirmation:** Agreed with the original ranking; no change is necessary.\n\n**3. Solar-Powered FM Receiver-Transmitter**  \n- **Reasoning for Higher Ranking:** Communication with the mother ship is critical for ensuring rescue if the trek encounters unforeseen delays or obstacles. Its functionality could make the difference between survival and being stranded. Navigation, while important, is secondary to communication in emergencies.  \n- **New Position:** Moved up from rank 4 to rank 3 to reflect its higher priority as an active survival tool.\n\n**4. Stellar Map**  \n- **Reasoning for Slightly Lower Ranking:** The stellar map is essential for navigation but assumes uninterrupted progress toward the rendezvous point. Its dependence on celestial visibility may also be vulnerable to situational limitations (e.g., lunar storms, obstructions).  \n- **New Position:** Reduced from rank 3 to rank 4.\n\n**5. Food Concentrate**  \n- **Justification:** Food concentrate is necessary to provide calories and sustain physical activity during a multi-day trek. It remains high priority but secondary to oxygen, water, navigation, and communication.  \n- **Confirmation:** Agreed with the original ranking; no change is necessary.\n\n**6. First Aid Kit**  \n- **Reasoning for Higher Ranking:** Potential injuries or health issues during a 200-mile trek could jeopardize the entire mission. Immediate treatment capabilities are vital for survival. Its importance outweighs items that provide secondary utility.  \n- **New Position:** Moved up from rank 6 to rank 6.\n\n**7. Portable Heating Unit**  \n- **Justification:** Thermal regulation is crucial for preventing hypothermia during the trek, particularly during lunar nights or shaded regions. Its priority is correctly ranked.  \n- **Confirmation:** Agreed with the original ranking; no change is necessary.\n\n**8. 50 Feet of Nylon Rope**  \n- **Reasoning for Higher Ranking:** The rope\u2019s multi-purpose functionality (e.g., climbing obstacles, securing equipment, solving terrain challenges) could be critical for mobility. It also pairs well with other survival tools. Its practical uses elevate its ranking over signal flares.  \n- **New Position:** Moved up from rank 9 to rank 8.\n\n**9. Signal Flares**  \n- **Reasoning for Lower Ranking:** Signal flares are essential signaling mechanisms but are less versatile compared to nylon rope. Their use is limited to the end of the trek or emergencies. Thus, they are slightly less critical than items offering broad utility during the journey.  \n- **New Position:** Reduced from rank 8 to rank 9.\n\n**10. Parachute Silk**  \n- **Justification:** Multi-purpose material for shade, insulation, or improvisation. It is useful in secondary survival functions but not critical for immediate trek priorities.  \n- **Confirmation:** Agreed with the original ranking; no change is necessary.\n\n**11. Magnetic Compass**  \n- **Justification:** Useless for navigation on the moon due to the absence of a global magnetic field. Potential improvised uses (e.g., as a reflective surface) do not warrant a higher ranking.  \n- **Confirmation:** Agreed with the original ranking; no change is necessary.\n\n**12. Life Raft**  \n- **Reasoning for Higher Ranking:** Though minimally useful compared to most items, it offers potential for insulation or as an aid for carrying supplies, which slightly improves its utility over dehydrated milk.  \n- **New Position:** Moved up from rank 12 to rank 11.\n\n**13. One Case of Dehydrated Milk**  \n- **Reasoning for Lower Ranking:** Requires water for preparation, creating redundancy in survival priority. Food concentrate already fulfills the higher nutritional need. Dehydrated milk has less utility in comparison.  \n- **New Position:** Reduced from rank 11 to rank 12.\n\n**14. Two .45 Caliber Pistols**  \n- **Justification:** Limited survival value on the moon, with minimal practical application. Potential improvisation (e.g., generating mechanical force) remains a rare, last-resort use case.  \n- **Confirmation:** Agreed with the original ranking; no change is necessary.\n\n**15. Box of Matches**  \n- **Justification:** As confirmed, completely non-functional in the lunar environment. It rightfully ranks last.  \n- **Confirmation:** Agreed with the original ranking; no change is necessary.\n\n---\n\n### Final Refined Ranking \n1. Oxygen Tanks  \n2. Water  \n3. Solar-Powered FM Receiver-Transmitter  \n4. Stellar Map  \n5. Food Concentrate  \n6. First Aid Kit  \n7. Portable Heating Unit  \n8. 50 Feet of Nylon Rope  \n9. Signal Flares  \n10. Parachute Silk  \n11. Life Raft  \n12. One Case of Dehydrated Milk  \n13. Two .45 Caliber Pistols  \n14. Magnetic Compass  \n15. Box of Matches  \n\n---\n\n### Confirmation Request\nI have provided a refined ranking based on survival priorities. Please:  \n1. **Acknowledge receipt** of this refined list.  \n2. **Confirm understanding** of the reasoning behind each adjustment.  \n3. Provide any feedback or suggestions for improvement to ensure consensus and optimal survival planning.  \n\nOver to you!",
          "current_agent": "resource",
          "difference_score": 4
        }
      ],
      "final_ranking": [
        "Oxygen tanks",
        "Water",
        "Solar-powered FM receiver-transmitter",
        "Stellar map",
        "Food concentrate",
        "First aid kit",
        "Portable heating unit",
        "50 feet of nylon rope",
        "Signal flares",
        "Parachute silk",
        "Magnetic compass",
        "Life raft",
        "One case of dehydrated milk",
        "Two .45 caliber pistols",
        "Box of matches"
      ],
      "final_message": "### Acknowledgment\nI have received the current ranked list of lunar survival items and reviewed the justifications. I confirm my understanding of the survival priorities outlined, as well as the reasoning attached to each item's position. I will now refine the ranking based on my expertise as a Resource Manager, ensuring optimal resource efficiency and prioritizing items based on their utility vs weight. I'll explain my reasoning for each suggested change and maintain closed-loop communication throughout this process.\n\n---\n\n### Refined Ranking of Lunar Survival Items:\n\n**1. Oxygen Tanks**  \n- **Justification:** Oxygen remains the single most critical resource for survival, as the moon\u2019s lack of atmosphere makes breathable air essential.  \n- **Confirmation:** Agreed with the original ranking; no change is necessary.\n\n**2. Water**  \n- **Justification:** Water is vital for hydration and necessary for maintaining physical and cognitive performance over the trek\u2019s duration.  \n- **Confirmation:** Agreed with the original ranking; no change is necessary.\n\n**3. Solar-Powered FM Receiver-Transmitter**  \n- **Reasoning for Higher Ranking:** Communication with the mother ship is critical for ensuring rescue if the trek encounters unforeseen delays or obstacles. Its functionality could make the difference between survival and being stranded. Navigation, while important, is secondary to communication in emergencies.  \n- **New Position:** Moved up from rank 4 to rank 3 to reflect its higher priority as an active survival tool.\n\n**4. Stellar Map**  \n- **Reasoning for Slightly Lower Ranking:** The stellar map is essential for navigation but assumes uninterrupted progress toward the rendezvous point. Its dependence on celestial visibility may also be vulnerable to situational limitations (e.g., lunar storms, obstructions).  \n- **New Position:** Reduced from rank 3 to rank 4.\n\n**5. Food Concentrate**  \n- **Justification:** Food concentrate is necessary to provide calories and sustain physical activity during a multi-day trek. It remains high priority but secondary to oxygen, water, navigation, and communication.  \n- **Confirmation:** Agreed with the original ranking; no change is necessary.\n\n**6. First Aid Kit**  \n- **Reasoning for Higher Ranking:** Potential injuries or health issues during a 200-mile trek could jeopardize the entire mission. Immediate treatment capabilities are vital for survival. Its importance outweighs items that provide secondary utility.  \n- **New Position:** Moved up from rank 6 to rank 6.\n\n**7. Portable Heating Unit**  \n- **Justification:** Thermal regulation is crucial for preventing hypothermia during the trek, particularly during lunar nights or shaded regions. Its priority is correctly ranked.  \n- **Confirmation:** Agreed with the original ranking; no change is necessary.\n\n**8. 50 Feet of Nylon Rope**  \n- **Reasoning for Higher Ranking:** The rope\u2019s multi-purpose functionality (e.g., climbing obstacles, securing equipment, solving terrain challenges) could be critical for mobility. It also pairs well with other survival tools. Its practical uses elevate its ranking over signal flares.  \n- **New Position:** Moved up from rank 9 to rank 8.\n\n**9. Signal Flares**  \n- **Reasoning for Lower Ranking:** Signal flares are essential signaling mechanisms but are less versatile compared to nylon rope. Their use is limited to the end of the trek or emergencies. Thus, they are slightly less critical than items offering broad utility during the journey.  \n- **New Position:** Reduced from rank 8 to rank 9.\n\n**10. Parachute Silk**  \n- **Justification:** Multi-purpose material for shade, insulation, or improvisation. It is useful in secondary survival functions but not critical for immediate trek priorities.  \n- **Confirmation:** Agreed with the original ranking; no change is necessary.\n\n**11. Magnetic Compass**  \n- **Justification:** Useless for navigation on the moon due to the absence of a global magnetic field. Potential improvised uses (e.g., as a reflective surface) do not warrant a higher ranking.  \n- **Confirmation:** Agreed with the original ranking; no change is necessary.\n\n**12. Life Raft**  \n- **Reasoning for Higher Ranking:** Though minimally useful compared to most items, it offers potential for insulation or as an aid for carrying supplies, which slightly improves its utility over dehydrated milk.  \n- **New Position:** Moved up from rank 12 to rank 11.\n\n**13. One Case of Dehydrated Milk**  \n- **Reasoning for Lower Ranking:** Requires water for preparation, creating redundancy in survival priority. Food concentrate already fulfills the higher nutritional need. Dehydrated milk has less utility in comparison.  \n- **New Position:** Reduced from rank 11 to rank 12.\n\n**14. Two .45 Caliber Pistols**  \n- **Justification:** Limited survival value on the moon, with minimal practical application. Potential improvisation (e.g., generating mechanical force) remains a rare, last-resort use case.  \n- **Confirmation:** Agreed with the original ranking; no change is necessary.\n\n**15. Box of Matches**  \n- **Justification:** As confirmed, completely non-functional in the lunar environment. It rightfully ranks last.  \n- **Confirmation:** Agreed with the original ranking; no change is necessary.\n\n---\n\n### Final Refined Ranking \n1. Oxygen Tanks  \n2. Water  \n3. Solar-Powered FM Receiver-Transmitter  \n4. Stellar Map  \n5. Food Concentrate  \n6. First Aid Kit  \n7. Portable Heating Unit  \n8. 50 Feet of Nylon Rope  \n9. Signal Flares  \n10. Parachute Silk  \n11. Life Raft  \n12. One Case of Dehydrated Milk  \n13. Two .45 Caliber Pistols  \n14. Magnetic Compass  \n15. Box of Matches  \n\n---\n\n### Confirmation Request\nI have provided a refined ranking based on survival priorities. Please:  \n1. **Acknowledge receipt** of this refined list.  \n2. **Confirm understanding** of the reasoning behind each adjustment.  \n3. Provide any feedback or suggestions for improvement to ensure consensus and optimal survival planning.  \n\nOver to you!",
      "score": 26
    }
  ],
  "final_ranking": [
    "Oxygen tanks",
    "Water",
    "Solar-powered FM receiver-transmitter",
    "Stellar map",
    "Food concentrate",
    "First aid kit",
    "Portable heating unit",
    "50 feet of nylon rope",
    "Signal flares",
    "Parachute silk",
    "Magnetic compass",
    "Life raft",
    "One case of dehydrated milk",
    "Two .45 caliber pistols",
    "Box of matches"
  ],
  "nasa_ranking": [
    "Oxygen tanks",
    "Water",
    "Stellar map",
    "Food concentrate",
    "Solar-powered FM receiver-transmitter",
    "50 feet of nylon rope",
    "First aid kit",
    "Parachute silk",
    "Life raft",
    "Signal flares",
    "Two .45 caliber pistols",
    "One case of dehydrated milk",
    "Portable heating unit",
    "Magnetic compass",
    "Box of matches"
  ],
  "score": 26,
  "teamwork_metrics": {}
}